,UTC,Post Date,Number of Comments,Upvote Ratio,Text,polarity,subjectivity,word_count,is_spam
737,1619300384.0,2021-04-24 17:39:44,0,2.0,whilst yes 2016 hack pretty substantial somewhat wakeup call developers hack affected obsolete part blockchain extremely unlikely anything remotely similar could happen considering growth contributers ethereum core node geth easily tell im sure think otherwise promises make cant keep youre thinking eth 20 important learn development cycle things would definately want go wrong see 2016 dao hack dont believe claims better,0.05666666666666667,0.7527777777777778,112,0
738,1619299182.0,2021-04-24 17:19:42,1,2.0,thanks kind sir,0.4,0.55,3,1
739,1619263918.0,2021-04-24 07:31:58,2,21.0,moons moon moons moon moons moon moons,0.0,0.0,13,0
740,1619299473.0,2021-04-24 17:24:33,0,2.0,welcome,1.0,1.0,5,1
741,1619264040.0,2021-04-24 07:34:00,3,7.0,moons moon moon moon moon,0.0,0.0,12,0
743,1619265413.0,2021-04-24 07:56:53,1,7.0,end poet keep scrolling,0.0,0.0,9,0
744,1619274358.0,2021-04-24 10:25:58,3,10.0,moon moon moon moon moon moon moon moon moon moon,0.0,0.0,10,0
745,1619276955.0,2021-04-24 11:09:15,1,2.0,moons moan mainnet comes true,0.35,0.65,12,0
746,1619272259.0,2021-04-24 09:50:59,1,5.0,much honest work,0.25,0.55,7,1
749,1619284529.0,2021-04-24 13:15:29,0,1.0,read south park cow voice,-0.13333333333333333,0.16666666666666666,8,0
750,1619292079.0,2021-04-24 15:21:19,0,2.0,roses red violets upset bring doge vet dr wrote script reefer hope give ether,0.0,0.5,34,1
751,1619272851.0,2021-04-24 10:00:51,1,7.0,thanks simple wisdom philosopher youll get paid,0.1,0.2785714285714286,10,1
753,1619274302.0,2021-04-24 10:25:02,1,4.0,flying lambos moons boys color want,0.0,0.0,14,1
756,1619291222.0,2021-04-24 15:07:02,0,2.0,thinking silver gold flecks,0.0,0.0,7,0
757,1619305335.0,2021-04-24 19:02:15,34,0.95,ethereum active addresses hits new high,0.05434343434343434,0.5315151515151514,6,0
758,1619305336.0,2021-04-24 19:02:16,0,1.0,hello rcryptocurrency readers please try following links sort comments controversial first click doesnt work mobile potentially find cryptowikis articles subject post click contribute cryptowikis click bot action performed automatically please contact moderators subredditmessagecomposetorcryptocurrency questions concerns,0.12222222222222223,0.4694444444444445,64,1
759,1619305669.0,2021-04-24 19:07:49,2,6.0,excited eths future eip 1559 eth 20 cant come soon enough think low eth fees possibilities ecosystem,0.12187500000000001,0.47500000000000003,25,1
760,1619305401.0,2021-04-24 19:03:21,1,5.0,eth btc happen,0.0,0.0,5,0
762,1619305522.0,2021-04-24 19:05:22,0,2.0,good price ethereum erc tokens even importantly defi,0.29500000000000004,0.6950000000000001,20,0
763,1619306033.0,2021-04-24 19:13:53,0,2.0,thats awesome imagine 20 hits fees gets even lower point afford invest little prices alt projects,0.40625,0.75,24,0
764,1619305372.0,2021-04-24 19:02:52,0,1.0,moon go,0.0,0.0,5,0
765,1619305587.0,2021-04-24 19:06:27,1,1.0,dont hit new highs every day cant delete address,0.13636363636363635,0.45454545454545453,14,1
766,1619305710.0,2021-04-24 19:08:30,0,1.0,2021 looks like promissing year eth might buy bit,0.0,0.0,13,0
767,1619307139.0,2021-04-24 19:32:19,0,1.0,maybe people finally got advice getting tokens exchange happened turkey,0.0,1.0,19,0
768,1619309753.0,2021-04-24 20:15:53,0,1.0,tldr active addresses ethereum network rose new alltime high 771000 addresses week number surpassed previous records january 2018 saw 735000 active addresses rise initial coin offerings late 2017 likely precursor accelerated growth network summary auto generated bot meant replace reading original article always dyor,0.05380303030303031,0.5661212121212121,70,0
769,1619313933.0,2021-04-24 21:25:33,0,1.0,explains ath days ago guess,-0.2,0.1,10,0
770,1619306034.0,2021-04-24 19:13:54,2,1.0,long eth 20 starts,-0.05,0.4,7,1
771,1619310083.0,2021-04-24 20:21:23,0,1.0,eth change world dapps smart contracts amazing,0.4071428571428572,0.7714285714285715,11,0
773,1619305999.0,2021-04-24 19:13:19,3,5.0,holding 10 dollars eth dont know anything anything,0.0,0.0,14,1
774,1619305923.0,2021-04-24 19:12:03,0,1.0,active address one used transfer crypto cant delete address ether flowing doesnt count active,-0.13333333333333333,0.6,32,0
775,1619306558.0,2021-04-24 19:22:38,0,2.0,date hadnt set docking yet main instalment eth 20 likely time 2022 although recently talk accelerated maybe late year eip1559 contentious development happening july involves burning ethereum essentially make even scarce also fix gas fees volatility making algorithmically stable exciting times,0.14583333333333334,0.5354166666666667,74,1
776,1619306306.0,2021-04-24 19:18:26,0,1.0,eth 20 divided several phases read detailed eth 20 roadmap take 510 years every single improvement get done way earlier tho,0.013095238095238104,0.49404761904761907,38,1
777,1619305947.0,2021-04-24 19:12:27,1,3.0,votes,0.0,0.0,4,1
778,1619306188.0,2021-04-24 19:16:28,1,4.0,great board,1.0,0.75,6,0
779,1619306241.0,2021-04-24 19:17:21,1,3.0,never late learn invest youve made good choice eth imo,0.19999999999999998,0.6000000000000001,16,0
780,1619312166.0,2021-04-24 20:56:06,1,2.0,knew enough spend 10 5,0.0,0.5,9,1
781,1619312213.0,2021-04-24 20:56:53,0,2.0,time flipening,0.0,0.0,4,1
783,1619306521.0,2021-04-24 19:22:01,1,3.0,thanks might sound much ill learn trade lose,0.06666666666666667,0.26666666666666666,21,1
784,1619312412.0,2021-04-24 21:00:12,0,1.0,actually minimum value lol,0.4,0.39999999999999997,7,0
785,1619307020.0,2021-04-24 19:30:20,1,3.0,dont 1 second ever ashamed investment allowance invest within means dont worry people think im going award free reddit reward give moons get crypto checkout nano free faucets available wasnt spam attack network look sub,0.2964285714285714,0.4821428571428571,67,1
786,1619307381.0,2021-04-24 19:36:21,1,2.0,hey thank help award ill surely learn lot sub think ill hold moon get next month,0.25,0.4444444444444444,29,1
787,1619309024.0,2021-04-24 20:03:44,1,2.0,apparently get moons next month hold onto month seems like good idea,0.3125,0.36250000000000004,23,1
788,1619309198.0,2021-04-24 20:06:38,1,2.0,apply moons ones gained specific month,0.0,0.125,18,1
789,1619309386.0,2021-04-24 20:09:46,1,2.0,think youre holding 100 sure,0.5,0.8888888888888888,10,0
790,1619309487.0,2021-04-24 20:11:27,1,1.0,thanks answers lovely daynight,0.35,0.475,9,1
791,1619309639.0,2021-04-24 20:13:59,0,2.0,youre welcome dm anytime happy help,0.8,0.95,11,1
792,1619227931.0,2021-04-23 21:32:11,231,0.87,youre asking strangers internet whether sell crypto probably sell crypto,0.0,0.0,21,0
793,1619229061.0,2021-04-23 21:51:01,21,299.0,agree think people dont anyone talk comes crypto yes space might best place blindly follow everyone however agree reasons sure hell would prefer hearing opinions people share interests someone barely clue crypto day week,0.25833333333333336,0.43009259259259264,75,0
794,1619230841.0,2021-04-23 22:20:41,2,26.0,new upon time im thankful strangers giving opinions back 2017 today im almost ready live passive income investments,0.11818181818181818,0.36363636363636365,36,1
795,1619233647.0,2021-04-23 23:07:27,2,16.0,strangers internet telling buy crypto whole reason bought crypto,0.25,0.4,17,0
796,1619227981.0,2021-04-23 21:33:01,3,12.0,got ta get burned least,-0.3,0.4,7,0
797,1619230637.0,2021-04-23 22:17:17,1,26.0,waaay simplistic way looking things asking others know knowledge outside space doesnt mean sell everything people ask selling houses investments doesnt mean sell fact could huge mistake good talk people get opinions,0.05625000000000001,0.5375,69,0
798,1619227996.0,2021-04-23 21:33:16,7,46.0,hodl stop worrying much,0.2,0.2,9,0
799,1619228110.0,2021-04-23 21:35:10,2,13.0,new investors always panic downturn market need constant reassurance temporary dip,0.06818181818181818,0.3939393939393939,27,1
800,1619237895.0,2021-04-24 00:18:15,1,3.0,im asking reassure muh lack faith fiat,0.0,0.0,13,0
801,1619228383.0,2021-04-23 21:39:43,1,7.0,lurking tends better see something talked know stay away sound project doesnt need shilling,0.475,0.475,27,0
802,1619236085.0,2021-04-23 23:48:05,1,3.0,send 5 eth ill send 5 real dollars,0.2,0.30000000000000004,10,1
803,1619262700.0,2021-04-24 07:11:40,0,3.0,ill read posts like think wow 500k worth money ledger nope noob 50 robinhood,0.2,0.55,26,1
804,1619270682.0,2021-04-24 09:24:42,0,3.0,ah yes people never ask advice research new investmenthobbypurchase lets randomly guess hope best,0.21212121212121213,0.4181818181818182,23,0
805,1619279303.0,2021-04-24 11:48:23,0,3.0,need people make money,0.0,0.0,8,1
806,1619228158.0,2021-04-23 21:35:58,1,3.0,seeing certain shitcoin 100x better bet lotto chasers coming space donating money,0.35714285714285715,0.5357142857142857,20,0
807,1619229883.0,2021-04-23 22:04:43,1,4.0,yea feel gardening today saw weird bugs tangerine tree going ask internet handle decided nah fuck ripped tree realized shouldnt even growing tree dont know take care tree,-0.45,0.8,62,0
808,1619228507.0,2021-04-23 21:41:47,0,2.0,seriously im tired daily posts asking sell hodl,-0.2,0.35,13,1
809,1619235484.0,2021-04-23 23:38:04,0,2.0,wanting hear others opinions something doesnt necessarily mean blindly following bad take,-0.3374999999999999,0.4847222222222222,17,1
810,1619250366.0,2021-04-24 03:46:06,0,2.0,stand till end,0.0,0.0,6,0
811,1619251632.0,2021-04-24 04:07:12,0,2.0,forgot c trying farm moons,0.0,0.0,7,1
812,1619237571.0,2021-04-24 00:12:51,0,2.0,remember read saying back first learn remove l true crypto space sure earn without learning anything crypto lucky spend time learning getting technology behind surely wont ask anyone would want hodl sell tiny dips,0.19166666666666665,0.5993055555555555,73,1
813,1619239386.0,2021-04-24 00:43:06,0,0.0,somebody get op fucking beer simple honest everyone team sport,-0.05000000000000001,0.6857142857142858,17,1
814,1619228129.0,2021-04-23 21:35:29,0,1.0,definitely agree b invested crypto get gains shouldnt crypto,0.0,0.5,18,0
816,1619229100.0,2021-04-23 21:51:40,0,1.0,advice everyone whos asked today,0.0,0.0,8,1
817,1619229107.0,2021-04-23 21:51:47,1,1.0,youre asking strangers internet market peak set turn bear accept every single answer wrong,-0.2857142857142857,0.5571428571428572,28,0
818,1619229254.0,2021-04-23 21:54:14,0,1.0,tldr youre weak handed little shit youre weak handed little shit,-0.25416666666666665,0.6416666666666666,15,0
819,1619230570.0,2021-04-23 22:16:10,0,1.0,agree feel like lot people asking questions invested much without researching positions unfortunately many seen severe losses may deep may stick around start make smart decisions wont make mistakes,0.22857142857142856,0.4357142857142857,58,1
820,1619230849.0,2021-04-23 22:20:49,0,1.0,c looking excuse talk like minded people interest crypto reddit,-0.05,0.05,19,0
821,1619231203.0,2021-04-23 22:26:43,0,1.0,volatility crypto also 10x markets understandable ppl get nervous like op said youre worried maybe invested much need downsize,0.037500000000000006,0.2875,33,1
823,1619231828.0,2021-04-23 22:37:08,0,1.0,ignore man hold,0.0,1.0,7,0
824,1619231869.0,2021-04-23 22:37:49,0,1.0,unless loss,0.0,0.0,5,1
825,1619232588.0,2021-04-23 22:49:48,0,1.0,ok im selling crypto thanks,0.35,0.35,9,1
826,1619232821.0,2021-04-23 22:53:41,0,1.0,forget passwords hold simple,0.25,0.6785714285714286,9,1
827,1619233864.0,2021-04-23 23:11:04,1,1.0,strangers internet always right financial advisors,0.17857142857142855,0.26785714285714285,13,0
828,1619234541.0,2021-04-23 23:22:21,0,1.0,haha love title hahaha word advice use funds would used pizza beer haha dollar cost every time youre buy pizza beer instead calculate would cost get usdt instead dips youd rather invest pizza beer crypto portfolio wanting get rich quick aint happening unless youre starting like 100k minimum haha kind money throw around without worry haha,0.2808333333333334,0.44499999999999995,96,0
829,1619235582.0,2021-04-23 23:39:42,0,1.0,ironically inverse true well youre asking people internet whether buy realize already know heart youre going buy anyway,0.35,0.65,37,0
830,1619235715.0,2021-04-23 23:41:55,0,1.0,really following dont invest willing lose take kinds risks fine even ask idiots investment,-0.12166666666666667,0.47000000000000003,35,1
831,1619235834.0,2021-04-23 23:43:54,0,1.0,better way yolo suggestion random internet stranger,0.0,0.5,14,0
832,1619236007.0,2021-04-23 23:46:47,0,1.0,instruction unclear bought crypto increased positions,0.5,0.5,9,1
833,1619236009.0,2021-04-23 23:46:49,1,1.0,anyone really know putting money crypto speculation speculation,0.2,0.2,19,1
834,1619236910.0,2021-04-24 00:01:50,0,1.0,need money sell dont dont sell ever want,0.0,0.0,20,1
835,1619237075.0,2021-04-24 00:04:35,0,1.0,dont invest youre willing lose,-0.125,0.75,8,0
836,1619238527.0,2021-04-24 00:28:47,0,1.0,youre asking question wouldnt better hodl,0.5,0.5,11,0
837,1619241494.0,2021-04-24 01:18:14,0,1.0,fair cc posters arent random people part educated crypto heads,0.2333333333333333,0.6333333333333333,17,0
838,1619241938.0,2021-04-24 01:25:38,0,1.0,jokes made money cuz someone shilled vet hahaaa,0.0,0.0,12,1
839,1619242198.0,2021-04-24 01:29:58,0,1.0,friend thats trading since 2014 whenever someone asks crypto advice says like sold crypto wouldnt know reality dudes holding bags probably smart move,0.21428571428571427,0.6428571428571429,40,0
840,1619242304.0,2021-04-24 01:31:44,0,1.0,sound advice clicked expecting bad advice surprised gind instead youre giving exact advice give friends family asking buy im never selling crypto believe new paradigm ive remained confident decisions since 2017 throughout bear market dont conviction either research increase confidence b take profits bound big wont able survive crypto markets without making ton bad decisions youre trying follow trends chase pumps emotional volatile crypto requires balls platinum confidence rock,0.08219696969696973,0.5142676767676768,131,0
841,1619242391.0,2021-04-24 01:33:11,0,1.0,talking people cant hurt thats learned look research people expecting future development coin hand theres way many hodl im ape posts even legit coins,0.275,0.4,48,0
842,1619242891.0,2021-04-24 01:41:31,0,1.0,sometimes feeling sub full people 100 crypto see investors,0.475,0.775,21,1
843,1619243142.0,2021-04-24 01:45:42,0,1.0,crypto space mainly dependent supply demand youll determine people risk risk sentiment know suitable hold crypto projects dont steady income sources way actually determine good try know people willing buy higher price future,0.21212121212121213,0.4462121212121212,83,1
844,1619244370.0,2021-04-24 02:06:10,1,1.0,gate keeping,0.0,0.0,5,1
845,1619244515.0,2021-04-24 02:08:35,1,1.0,get dude speculation idea people position lot people one talk comes crypto let alone get advice theyll come communities like get told fuck asking questions one else would able answer dont early investors want cryptocurrency market become popular trying youre giving advice people imply post shouldnt taking advice strangers internet,0.25999999999999995,0.5850000000000001,105,0
846,1619244981.0,2021-04-24 02:16:21,0,1.0,sell crypto,0.0,0.0,6,1
847,1619245251.0,2021-04-24 02:20:51,0,1.0,pretty much lot people sub looking confirmation bias say something dont want hear youre bot shilling learned best dyor nobodys got best interest mind,0.6125,0.45,42,0
848,1619246061.0,2021-04-24 02:34:21,0,1.0,wonder sub expert everything crypto,0.0,0.0,16,0
849,1619246288.0,2021-04-24 02:38:08,0,1.0,beginner learning curve thats ask reddit generally ask buying advice research buy worked fine till,0.23333333333333334,0.5,36,1
850,1619246660.0,2021-04-24 02:44:20,0,1.0,na patronizing dumb investors dont time research technical knowledge experience theres shame seeking advice people time knowledge experience everyone influenced opinions others,0.15625,0.4,51,1
851,1619246955.0,2021-04-24 02:49:15,1,1.0,buy money,0.0,0.0,7,1
852,1619246963.0,2021-04-24 02:49:23,0,1.0,posts many people anyone talk crypto irl 100 spot bunch coworkers deal coins make point hit different social media shithits fan chat anyone wants lot people need someone talk,0.18333333333333335,0.3166666666666667,66,1
853,1619247100.0,2021-04-24 02:51:40,0,1.0,fair points,0.9099999999999999,1.0,3,1
854,1619247447.0,2021-04-24 02:57:27,0,1.0,disagree admitting dont know enough seeking advice topic great character trait imo,0.4,0.625,19,0
855,1619247495.0,2021-04-24 02:58:15,0,1.0,true think also invite education crypto people learn strangers internet reasons shouldnt sell everyones different part journey get burned learn see past self person didnt know much underlying fundamentals asked fact learned ton people online im much better place hodling forever,0.16,0.44000000000000006,80,0
856,1619247578.0,2021-04-24 02:59:38,0,1.0,yeah many people something win dont sell,0.65,0.45,13,0
857,1619248535.0,2021-04-24 03:15:35,0,1.0,one simple phrase tell google,0.0,0.35714285714285715,9,1
858,1619250003.0,2021-04-24 03:40:03,0,1.0,friend mine got crypto quiet recently exactly dilemma asked reason answer price tanking staring full minute legit told research explained volatility market,0.15,0.3458333333333333,47,1
859,1619250531.0,2021-04-24 03:48:51,0,1.0,hodlers breaking already huh,0.0,0.0,5,1
860,1619254486.0,2021-04-24 04:54:46,0,1.0,disagree asking peoples opinions doesnt mean following blindly second voice never bad long accept consequences actions,-0.21249999999999997,0.3708333333333333,28,0
861,1619254695.0,2021-04-24 04:58:15,0,1.0,one doesnt simply base opinion brain youre always asking even read supposedly respected authority article something asking stranger needs done asking many many strangers reach conclusion,0.19999999999999998,0.75,43,0
862,1619254761.0,2021-04-24 04:59:21,0,1.0,think good place see lot people moving way worked months ago started reading listening podcasts talking technology block chain alt coins nft etc think real reason hodl even powerful dips try trade bit news wave projects,0.39999999999999997,0.6333333333333334,71,0
863,1619256059.0,2021-04-24 05:20:59,0,1.0,sure buy lesser price,0.25,0.6944444444444444,9,1
864,1619256895.0,2021-04-24 05:34:55,0,1.0,shouldnt bought crypto first place,0.25,0.3333333333333333,14,0
865,1619258355.0,2021-04-24 05:59:15,0,1.0,always get strategy mind dont strategy youre yoloing battle,0.0,0.0,18,0
866,1619258531.0,2021-04-24 06:02:11,0,1.0,thinks fuck believe crypto invest half savings cause strangers internet told buy,-0.2833333333333333,0.3833333333333333,32,0
867,1619259217.0,2021-04-24 06:13:37,0,1.0,disagree example dont ask still waiting selling coins simply want money gpu want buy 20 whole investment still want sell soon reach goal price also vet xlm btc eth longer term bnb bought 260 sell reach 530560 already hit target,0.1,0.37857142857142856,86,1
868,1619264307.0,2021-04-24 07:38:27,0,1.0,yeah dont come sub focused crypto looking advice crypto,0.0,0.0,14,1
869,1619266760.0,2021-04-24 08:19:20,0,1.0,well hear hear see see rightfully think thinking,0.0,0.0,22,0
870,1619268414.0,2021-04-24 08:46:54,0,1.0,1 person talk crypto gets advice tiktok take everything says grains salt one places feel like hear opinions people educated crypto sift memery often entertaining shillery always annoying also unless youre experienced difficult beginning tell legit advice opinions shills hence noob knowing sell cant found except knows,0.012499999999999997,0.65,117,0
871,1619270875.0,2021-04-24 09:27:55,0,1.0,third option new never seen loss level 10 drop lot youre used weeds hold vs cant,0.08863636363636364,0.29545454545454547,43,1
872,1619271467.0,2021-04-24 09:37:47,0,1.0,usualy mindset already predetermined needs confirmation strangers,0.0,0.0,13,1
873,1619272191.0,2021-04-24 09:49:51,0,1.0,omg hilarious thought folks trolls asking transact sorry yall everything needs taken grain salt,0.0,1.0,31,0
874,1619274532.0,2021-04-24 10:28:52,0,1.0,sell crypto 1 hurry worth 0 kidding,0.5859375,0.1,16,0
875,1619276716.0,2021-04-24 11:05:16,0,1.0,say sell hodl,0.0,0.0,8,0
876,1619276874.0,2021-04-24 11:07:54,0,1.0,actually youre asking shouldnt sell come back vengeance,0.0,0.05,16,0
877,1619278275.0,2021-04-24 11:31:15,0,1.0,family girlfriend tired talking crypto resort telegram groups mean theres problem listening others opinions projects mean dont use reviews buy products,-0.3416666666666666,0.6916666666666668,45,1
878,1619279338.0,2021-04-24 11:48:58,0,1.0,scared money dont make money,0.0,0.0,6,1
879,1619279577.0,2021-04-24 11:52:57,0,1.0,dont ask random people advice cant shake fist make huge losses though absolve mistakes obviously,0.125,0.725,29,1
880,1619280778.0,2021-04-24 12:12:58,0,1.0,think goes bit times good triangulate rcc reason tend get form tunnel vision things good open discussion form willingness get different perception worse thing could work silo,0.2285714285714285,0.6285714285714287,62,0
881,1619282841.0,2021-04-24 12:47:21,0,1.0,invest believe shouldnt fomo,0.0,1.0,11,1
882,1619283232.0,2021-04-24 12:53:52,0,1.0,ill teach grandchildren sell dont think ill able sell crypto life time im 20s,0.5,0.625,24,1
883,1619285550.0,2021-04-24 13:32:30,0,1.0,good luck start crypto journey,0.875,0.6000000000000001,11,0
884,1619286404.0,2021-04-24 13:46:44,1,1.0,c made life changing money take table youre 10x take 10 table barely going notice 10xs thatd difference 90x 100x practically nothing bear market need sell might sell bottom thatd lot worse,-0.17500000000000002,0.35,74,1
885,1619287084.0,2021-04-24 13:58:04,0,1.0,sell crypto yer jk,0.0,0.0,10,1
887,1619253759.0,2021-04-24 04:42:39,0,0.0,difference talking complete strangers specific interest community moron,-0.23333333333333336,0.5083333333333333,15,0
888,1619230634.0,2021-04-23 22:17:14,5,74.0,think people dont anyone talk comes crypto vouch like 2 people irl maybe,0.5,0.5,23,1
889,1619243909.0,2021-04-24 01:58:29,3,32.0,tbh 4 years ive crypto ive gotten nearly investment advice reddit ive done pretty well think long discern good advice advice helpful place learn crypto,0.24,0.5399999999999999,52,0
890,1619233993.0,2021-04-23 23:13:13,1,12.0,feel know one person rl interested crypto sometimes think maybe bore,0.125,0.75,23,1
891,1619247715.0,2021-04-24 03:01:55,0,8.0,yeah girlfriend doesnt understand dont like shilling coins coworkers cause lose money get mad like talk guys coins gets crypto fix also community instant surround knowledge experience shouldnt shame people dont know crypto space help educate functioning member crypto society,-0.390625,0.8333333333333333,82,1
892,1619242981.0,2021-04-24 01:43:01,0,6.0,like no1 besides ppl reddit goes stocks crypto also always smarter ask ppl opinion even dont agree hear side story ofc shouldnt sell long holdings bcz some1 wrote something reddit,-0.0859375,0.31875,50,0
893,1619246675.0,2021-04-24 02:44:35,0,5.0,feel people ask question wheather sell crypto others internet especially subbecause need support crypto market correctionit good hear crypto market long time also newthey wan na know one feeling panicked scared dipthey dont much experience act correction wan na hear something makes hold crypto hard times,0.09305555555555552,0.6236111111111111,92,0
894,1619247081.0,2021-04-24 02:51:21,0,3.0,yeah issue dont really anyone talk crypto nice least chat people time time,0.16666666666666666,0.5333333333333333,31,0
895,1619249190.0,2021-04-24 03:26:30,0,3.0,always scream dyor,0.0,0.0,5,0
896,1619243255.0,2021-04-24 01:47:35,0,2.0,amazing see coworkers talk crypto day past two years like didnt exist soon btc started climbing anyone wants talk,0.18333333333333335,0.4166666666666667,35,0
897,1619252276.0,2021-04-24 04:17:56,0,2.0,really true circles mention crypto met well know handful people crypto work,0.2833333333333333,0.7166666666666667,28,1
898,1619256683.0,2021-04-24 05:31:23,0,2.0,isnt crypto thingy beats superman,0.0,0.0,7,0
899,1619248522.0,2021-04-24 03:15:22,0,1.0,also community knowledgeable investing general third party perspective never kills,0.08333333333333333,0.26666666666666666,19,0
900,1619249013.0,2021-04-24 03:23:33,0,1.0,plus another popular piece advise tell anyone youve invested crypto agree asking sell great question really place could ask,0.09999999999999999,0.7124999999999999,40,0
901,1619250251.0,2021-04-24 03:44:11,0,1.0,agree seems like one circle friends crypto corona happened havent contacting friends much either either way sub closest crypto discussion forum,0.1,0.6,44,0
902,1619253072.0,2021-04-24 04:31:12,0,1.0,also find people crypto game years hearing sharing experience fomo fear dip panic selling kind feels good hear calms people especially people new roller coaster 2013 people panicking crashed 2017 people panicked held coins stayed calm 2021 feels great even right hold enjoy feeling veterans 2025 someone mentioned another postthe first year crypto always hardest,0.22434787434787434,0.5201909201909202,113,0
903,1619258431.0,2021-04-24 06:00:31,0,1.0,really good point,0.7,0.6000000000000001,6,0
904,1619263655.0,2021-04-24 07:27:35,0,1.0,second people know irl buy crypto told convert coins doge morning hit 30,0.0,0.5,27,1
905,1619265311.0,2021-04-24 07:55:11,0,1.0,people dont anyone talk thing honestly true quite lot people,0.45499999999999996,0.8450000000000001,19,0
906,1619274199.0,2021-04-24 10:23:19,0,1.0,started talk workmath teacher economics colleagues like ow stay away yeah nobody near vicinity talk crypto,0.1,0.4,36,0
907,1619274914.0,2021-04-24 10:35:14,0,1.0,hardest part got reinvolved crypto feeling alone decision making process ive read medical scientific study documents help determine veracity damn league people really helped determine directly indirectly thankful wasnt panicked like lot people certainly found confused lot place helped immensely,0.044897959183673466,0.45306122448979597,81,1
