,UTC,Post Date,Number of Comments,Upvote Ratio,Text,polarity,subjectivity,word_count,is_spam
0,1619295034.0,2021-04-24 16:10:34,99,0.93,tried maticpolygon l2 ethereum one tell sooner,0.0,0.0,16,1
1,1619295035.0,2021-04-24 16:10:35,0,1.0,hello rcryptocurrency readers please try following links sort comments controversial first click doesnt work mobile potentially find cryptowikis articles subject post click contribute cryptowikis click bot action performed automatically please contact moderators subredditmessagecomposetorcryptocurrency questions concerns,0.12222222222222223,0.4694444444444445,64,1
2,1619295312.0,2021-04-24 16:15:12,2,38.0,yeah polygon matic pretty amazing still new services popping daily best way people dont know understand like bsc centralized shitchain fast cheap bridge assets tofrom eth,0.36948051948051946,0.5649350649350648,46,0
3,1619295267.0,2021-04-24 16:14:27,1,14.0,well shit im going try shy away uniswap 1inch exact reason,-0.15,0.5166666666666667,21,0
4,1619295633.0,2021-04-24 16:20:33,2,13.0,polygon hopefully help solve gas issues,0.0,0.0,11,1
5,1619296705.0,2021-04-24 16:38:25,0,7.0,welcome think people choose bsc eth l2s bscs fees high compared polygon polygon aave opensea brainer,0.52,0.8673333333333333,30,0
6,1619295252.0,2021-04-24 16:14:12,1,6.0,youre essentially wrapping tokens another completely separate network adds layer trust ya faster cheaper,0.05,0.35,22,0
7,1619296756.0,2021-04-24 16:39:16,1,7.0,polygon ecosystem growing rapidly curve aave sushiswap amd 2 native dexes quickswap cometh swap im enjoying actually able play around lp defi without paying triple digits,0.3333333333333333,0.44166666666666665,40,1
8,1619295315.0,2021-04-24 16:15:15,2,8.0,matic kind awesome believe even mint nfts matic without cost nft minting tool matic thing im slightly surprised isnt mentioned often,0.55,0.825,42,0
9,1619296743.0,2021-04-24 16:39:03,1,3.0,actually thinking using maticpolygon least experiment perusing around wallet section bridge way send erc token exchange bridge saved metamask kind like bridge works bsc want bridge erc 20 token bsc withdraw exchange send address binance bridge gives get saved metamask wallet reason asking since gemini free withdrawals would rather pay extra eth gas fees unless,0.10166666666666667,0.5700000000000001,114,0
10,1619300881.0,2021-04-24 17:48:01,1,3.0,wtf really nowhere mentioned,-0.1875,0.6,7,1
11,1619295130.0,2021-04-24 16:12:10,1,7.0,true made mistake,0.175,0.3875,8,0
12,1619295272.0,2021-04-24 16:14:32,1,4.0,matic one bags im holding long term,-0.025,0.7,14,0
13,1619295486.0,2021-04-24 16:18:06,3,5.0,given polygon announced february 2021 doubts roadmap development move ahead features prioritizedthat might scare people seems professional development team behind experience sounds really positive,-0.003977272727272746,0.5863636363636364,50,0
14,1619298157.0,2021-04-24 17:02:37,1,2.0,im kinda new could explain bit matic maybe even use avoid fees,0.13636363636363635,0.45454545454545453,22,1
15,1619298982.0,2021-04-24 17:16:22,0,2.0,yes shill 2nd biggest bag,0.0,0.0,6,0
16,1619298983.0,2021-04-24 17:16:23,1,2.0,also recommend people check celer network launched layer 2 finance,0.0,0.0,15,1
17,1619299292.0,2021-04-24 17:21:32,1,2.0,try tell people every chance get also check xdai another ethereum sidechain bridge two networks seemlessly,0.0,0.0,28,1
18,1619299502.0,2021-04-24 17:25:02,0,2.0,lot people problems fact every time ive checked gas fees ramp 40 usd dont know im something wrong im playing around small amounts fees impossible pay,-0.35416666666666663,0.825,46,0
19,1619299882.0,2021-04-24 17:31:22,1,2.0,wait send metamask eth mainnet polygon thats know,0.0,0.0,23,0
20,1619295237.0,2021-04-24 16:13:57,1,2.0,polygon skale others working scalability fees cheaper like,0.0,0.0,18,1
21,1619295619.0,2021-04-24 16:20:19,3,2.0,isnt matic eth side chain since eth open source lot projects copied including bsc necessarily bad wouldnt get similar fee problems everyone uses also erc20 tokens usable,0.11666666666666664,0.5222222222222221,42,0
24,1619296496.0,2021-04-24 16:34:56,1,1.0,matic beautiful,0.55,1.0,3,0
25,1619295252.0,2021-04-24 16:14:12,1,0.0,im still new clicking pieces together know right ethereum way cooler initially thought looked nmr think theres potential really cool market exchanges future,0.1740665584415584,0.46087662337662333,39,0
26,1619296504.0,2021-04-24 16:35:04,0,1.0,dont see point going back mainnet things moment dex working aave working ntf minter working learned comments starting look sceptically elrond algorand cardano bags still believe hold tight lol,0.15535714285714286,0.2714285714285714,49,1
27,1619296671.0,2021-04-24 16:37:51,1,1.0,anyone good tutorial ive really stopped using uniswap due high fees,0.23374999999999999,0.42874999999999996,19,0
28,1619297712.0,2021-04-24 16:55:12,0,1.0,wonder get polkamon matic,0.0,0.0,10,0
29,1619298043.0,2021-04-24 17:00:43,1,1.0,ive never heard basically way send eth cheaper,0.0,0.0,15,0
30,1619300861.0,2021-04-24 17:47:41,0,1.0,try loopring even better,0.625,0.5,8,0
31,1619301935.0,2021-04-24 18:05:35,0,1.0,clarify use polygon network metamask,0.0,0.0,12,1
32,1619301992.0,2021-04-24 18:06:32,0,1.0,possible buy eth straight matic enabled networkexchange,0.1,0.7,12,0
34,1619304238.0,2021-04-24 18:43:58,0,1.0,like matic might like ftm even faster cheaper native layer 1,0.0,0.0,19,1
35,1619304509.0,2021-04-24 18:48:29,0,1.0,missing something dont nearly many tokens actuallyuseful dont compatibility 99 erc20 tokens im confused even big deal uniswap every single erc20 possible matic network less 100,-0.02976190476190476,0.37886904761904766,48,0
36,1619305946.0,2021-04-24 19:12:26,0,1.0,thanks didnt know possible already maybe finally sell shitcoins held hostage ledger,0.08333333333333333,0.7333333333333334,20,1
37,1619306104.0,2021-04-24 19:15:04,0,1.0,aave quickswap curve polygon amazing far transactions super fast cost basically nothing convert token token using qs integrates seamlessly metamask really offers glimpse great defi could potentially future mass adoption really hope whole ecosystem well,0.2090277777777778,0.5097222222222223,65,0
38,1619306331.0,2021-04-24 19:18:51,0,1.0,wait hear xdai chain l2 solutions popping recently due rising interest cryptocurrency going tell something ease low price speed transactions using bsc risk triggering binance bad bsc bad centralization bad echo chamber im tech savvy took 6 hours figure tokens andor coins need bridging last time tried bridge use l2 solutions exchanging reddit moons xdai chain network frankly future fast transactions even layer 1 supposed future layer 2 works pretty much like toll roads congested city networks first experience bsc like nearly hit head using cryptocurrency 3 months discovered uses l2 bridging erc20 network said fees ridiculously low even compared low xdai bsc fees gon na try one,-0.07941176470588232,0.3897058823529412,187,0
39,1619306540.0,2021-04-24 19:22:20,0,1.0,wait sdk fully developed available dapps popping matics main net quick easy,0.2388888888888889,0.39444444444444443,24,0
40,1619306836.0,2021-04-24 19:27:16,0,1.0,downside cost bridge polygon eth chain absolute joy use,0.3333333333333333,0.7000000000000001,22,1
41,1619307567.0,2021-04-24 19:39:27,0,1.0,since checked thought many coins supported liquidity issues wrong,0.0,0.7,22,0
42,1619307804.0,2021-04-24 19:43:24,0,1.0,eli5 guide mint nft using cheap alternative,0.4,0.7,15,0
43,1619308801.0,2021-04-24 20:00:01,0,1.0,anyone looking learn different layer 2 options emerging ethereum read 2 amazing posts uliberosist,0.3666666666666667,0.6666666666666666,22,1
44,1619309710.0,2021-04-24 20:15:10,0,1.0,meterio better matic saying lot people dont know yet,0.5,0.5,15,0
45,1619310193.0,2021-04-24 20:23:13,0,1.0,catch needs projects built first,0.375,0.41666666666666663,13,1
46,1619310681.0,2021-04-24 20:31:21,0,1.0,simple answer 10 still lot gas fees,0.0,0.35714285714285715,10,1
47,1619310762.0,2021-04-24 20:32:42,0,1.0,really noob question use get l2 eth l1 dont know best way get l2,0.6,0.25,27,1
48,1619311012.0,2021-04-24 20:36:52,0,1.0,ive singing praises crickets called shill,0.0,0.0,14,1
49,1619312237.0,2021-04-24 20:57:17,0,1.0,good know look matic,0.7,0.6000000000000001,9,1
50,1619303445.0,2021-04-24 18:30:45,0,0.0,people dont listen rather buy hyped coins zero use rather looking existing solutions,0.0,0.0,18,0
51,1619296733.0,2021-04-24 16:38:53,2,11.0,wish id used march literally houndres dollars lost fees feel stupid uninformed,-0.7999999999999999,1.0,20,0
52,1619300030.0,2021-04-24 17:33:50,0,4.0,far less expensive bsc payed 20c fees bsc thought cheap pay 20c bsc think expensive centralised,-0.13333333333333333,0.6333333333333334,32,0
53,1619295492.0,2021-04-24 16:18:12,0,2.0,yeah try see couldve saved much tried sooner,-0.275,0.6,17,0
54,1619296569.0,2021-04-24 16:36:09,0,6.0,try wont go back,0.0,0.0,8,1
55,1619301483.0,2021-04-24 17:58:03,1,3.0,well helps people use hardest part convincing people actually use instead complaining high eth gas fees every tx matic polygon tx competing space eth network,0.165,0.66,43,0
56,1619295968.0,2021-04-24 16:26:08,1,4.0,ive read polygon l2 relies base ethereum 1st layer security consensus 2nd layer polygon security layer uses polygon core validators security services 3rd layer networks layer makes interoperability blockchains 4th layer polygon makes onchain crosschain smart contracts possible right complex smart,-0.04017857142857144,0.5517857142857143,61,0
57,1619298049.0,2021-04-24 17:00:49,1,2.0,didnt know sushiswap integration cometh swap either lol,0.8,0.7,9,0
58,1619295709.0,2021-04-24 16:21:49,1,6.0,wtf even got ntf minting options transfer ntf back mainnet,-0.25,0.5,15,0
59,1619305370.0,2021-04-24 19:02:50,0,1.0,iota launching feeless nfts shortly,0.0,0.3,5,1
60,1619301661.0,2021-04-24 18:01:01,1,1.0,exchanges know support native withdraws matic would need withdraw eth wallet metamask use bridge transfer ethmatic still one time cost ideally point future exchanges would support directly would simply withdraw usdc example directly matic network pennies avoid bridge arent yet,0.22000000000000003,0.4564285714285714,76,1
62,1619295369.0,2021-04-24 16:16:09,0,3.0,try feel frustrated like right thats wrote post hopefully people see save desperate amounts gas fees like use dexs like uniswap etc,-0.33809523809523806,0.5785714285714286,42,1
63,1619295555.0,2021-04-24 16:19:15,1,4.0,yeah might consider buying token road right im heaven using l2 like almost free fast transactions,0.18253968253968256,0.5561507936507937,27,0
64,1619301418.0,2021-04-24 17:56:58,0,3.0,matic changed name polygon 2021 network went live back 2019,0.06818181818181818,0.25,16,1
65,1619296056.0,2021-04-24 16:27:36,0,2.0,works thats need,1.0,1.0,7,1
66,1619313183.0,2021-04-24 21:13:03,0,1.0,main concern seems like temporary solution good playing around defi wouldnt want get totally invested l2 solutions particularly zkrollups far secure advanced technical perspective polygon claims also optimistic zk rollups arent clear produce meanwhile solutions like starkex optimism well underway dapps work really well,0.19333333333333333,0.4819230769230769,77,0
67,1619298439.0,2021-04-24 17:07:19,1,3.0,recommend checking quick video youtube know use metamask easy got ta send polygon layer 2 matic bridge good go,0.5905555555555556,0.7000000000000001,41,1
68,1619301377.0,2021-04-24 17:56:17,0,2.0,cool,0.4375,0.65,3,0
70,1619301250.0,2021-04-24 17:54:10,0,1.0,yup thats good go,0.875,0.6000000000000001,9,0
71,1619295733.0,2021-04-24 16:22:13,0,1.0,skale check,0.0,0.0,5,1
72,1619296045.0,2021-04-24 16:27:25,0,2.0,think side chain someone please confirm also always assumed erc20 tokens accepted anywhere used erc20,0.0,0.0,27,1
73,1619296170.0,2021-04-24 16:29:30,0,1.0,ive read polygon l2 blockchains relies base1st ethereum layer security consensus 2nd layer polygonis security layer handles polygons security service product 3rd layer blockchain interoperability 4th layer polygon makes onchain crosschain smart contracts possible quite complex stuff ive understood correctly really l2 eth also chain works relying eth,0.01904761904761905,0.3738095238095238,78,1
74,1619296304.0,2021-04-24 16:31:44,1,1.0,think check sure checked dexquickswap erc20s like enjin aave etc reafy traded basically free swap shit day,0.2333333333333333,0.8296296296296296,39,0
75,1619295776.0,2021-04-24 16:22:56,0,1.0,atleast form already fixing biggest concern eth pretty decent,0.20833333333333331,0.8333333333333333,14,0
76,1619296600.0,2021-04-24 16:36:40,0,1.0,didnt even know worked like today tell,0.0,0.0,14,1
77,1619298722.0,2021-04-24 17:12:02,0,1.0,always matic,0.0,0.0,7,0
78,1619295431.0,2021-04-24 16:17:11,1,1.0,nmr check,0.0,0.0,5,1
79,1619297357.0,2021-04-24 16:49:17,0,2.0,went youtube typed transfer matic jusr followed guide matic bridge used metamask got ta add network metamask really easy good go use quickswap like uniswap send shit around metamask like mainnet,0.3111111111111111,0.7444444444444445,58,1
80,1619298344.0,2021-04-24 17:05:44,0,1.0,kinda yeah like bsc actually layer 2 decentralized working cheaper check youtube video easy know use metamask,0.3544444444444445,0.7000000000000001,33,1
81,1619297170.0,2021-04-24 16:46:10,1,5.0,least found dont beat,-0.375,0.4,12,0
82,1619306439.0,2021-04-24 19:20:39,0,1.0,dont look past self stupid may making enough progress dont beat still way early,-0.23749999999999996,0.5125,26,0
83,1619303584.0,2021-04-24 18:33:04,0,1.0,majority dapps work ethereum polygon actually creating cosmos ethereum info works,0.25,0.3,24,0
84,1619297373.0,2021-04-24 16:49:33,1,8.0,sidechains separate blockchains run parallel ethereum miners often called validators operators consensus algorithm bridge transfer assets main chain case ethereum users deposit locking assets mainnet smart contract withdraw back ethereum users initiate exit sidechain provide proof exit included side chains history sidechains effective general computation evm contracts ported directly run sidechain enabling ethlike interoperability contracts sidechain well applicationlevel logic makes common choice nft scaling applications migrate low overheads development time however sidechains like alternative blockchains usually relax ethereums security decentralization order reach desired scale users careful assume eth assets sidechain secure mainnet secure consensus algorithm sidechain sidechains limited number operators vulnerable consensus algorithm ie could result complete theft ransom user assets stored sidechain sidechains also often require additional tooling built support requisite level ux full credit uperks,0.1654329004329004,0.5554112554112555,239,0
85,1619298182.0,2021-04-24 17:03:02,1,2.0,sushiswap newly integrated pools sushi rewards yet went live last couple days comethswap pretty good like quickswap farms better still provide fee returns quickswap seems like work progress,0.3403409090909091,0.5151515151515151,47,0
86,1619303677.0,2021-04-24 18:34:37,0,0.0,yeah think possible,0.0,1.0,6,0
87,1619302064.0,2021-04-24 18:07:44,1,1.0,thats unfortunate wonder use free withdrawal gemini metamask dai much bridge dai matin dai want experiment bit fees going transferring would probably wait,0.15000000000000002,0.625,48,0
88,1619307005.0,2021-04-24 19:30:05,0,0.0,almost free free check nano instant free transaction,0.15000000000000002,0.7666666666666666,12,1
89,1619298639.0,2021-04-24 17:10:39,0,1.0,dont actually terms still pretty new im gon na try google watch videos thanks lot,0.1590909090909091,0.43863636363636366,27,1
90,1619301652.0,2021-04-24 18:00:52,1,2.0,info bridge polygon twitter account,0.5,0.5,11,1
91,1619296463.0,2021-04-24 16:34:23,0,1.0,thats big ones theyre also avaxpangolin places normally buy super small ones worth anymore ethuniswap fees ive moved bscpancake,-0.006944444444444452,0.3819444444444444,34,0
92,1619295701.0,2021-04-24 16:21:41,0,2.0,full name numeraire,0.35,0.55,3,1
93,1619300015.0,2021-04-24 17:33:35,0,3.0,seriously past self always seems twice dumb current thats healthy sign progress,-0.09166666666666665,0.46333333333333326,20,0
95,1619306802.0,2021-04-24 19:26:42,0,1.0,quickswap probably best tokenomics ive seen 97 tokens go community rewards pre mine ico,1.0,0.3,23,0
96,1619303450.0,2021-04-24 18:30:50,0,1.0,bridge fees vary eth gas tend 20 50 range would best make one large bridge tx single crypto use dex swap matic 001 per tx gas fees ideally one exchanges wont support native matic withdraws deposits would final piece puzzle,0.4238095238095238,0.5738095238095239,66,1
98,1619298885.0,2021-04-24 17:14:45,0,3.0,havent checked yet cosmos similar services network theyve building blockchain interoperability years also big things horizon exciting times,0.04375,0.38,36,0
99,1619278961.0,2021-04-24 11:42:41,409,0.76,rant sorry btc eth pretty much unusable right,0.05892857142857143,0.6839285714285714,14,0
100,1619278963.0,2021-04-24 11:42:43,0,1.0,hello rcryptocurrency readers please try following links sort comments controversial first click doesnt work mobile potentially find cryptowikis articles subject post click contribute cryptowikis click bot action performed automatically please contact moderators subredditmessagecomposetorcryptocurrency questions concerns,0.12222222222222223,0.4694444444444445,64,1
101,1619282964.0,2021-04-24 12:49:24,2,55.0,could someone explain like 5 year old gas fees occur,0.1,0.2,21,0
102,1619279044.0,2021-04-24 11:44:04,11,115.0,isnt stellar nano lite coin vertcoin etc introducted mainly mitigate fees,0.20833333333333331,0.29166666666666663,17,0
103,1619282160.0,2021-04-24 12:36:00,2,24.0,xlm good fast ive liking algo well pick tokens thats build eth,0.44999999999999996,0.6000000000000001,19,0
104,1619280024.0,2021-04-24 12:00:24,5,82.0,eth gas fees actually dropping gradually transactions remaining high ideal high btc either 250 moment edit 120 right,0.031142857142857132,0.543142857142857,32,0
105,1619286595.0,2021-04-24 13:49:55,0,6.0,really hope alt coins sure bitcoin sacrifices speed security ethereum extensive ecosystem downfall would possible ran major major security issues,0.103125,0.6152777777777778,36,1
106,1619307585.0,2021-04-24 19:39:45,1,4.0,algo best overall package right,0.42857142857142855,0.2785714285714285,8,0
107,1619290280.0,2021-04-24 14:51:20,2,11.0,sent transaction btc costed 60 using segwit 5 10 outputs inputs even peak next block transactions 20,0.16666666666666666,0.5,39,0
108,1619280309.0,2021-04-24 12:05:09,3,51.0,moment gas fee eth low,0.0,0.39,11,1
109,1619284338.0,2021-04-24 13:12:18,0,4.0,btc adress use didnt cost 60usd send btc lol,0.8,0.7,14,0
110,1619287815.0,2021-04-24 14:10:15,0,5.0,bitcoin fees perfectly fine right 50 satbyte gets next block probably less 2 dollars,0.13392857142857142,0.27559523809523806,24,0
111,1619290508.0,2021-04-24 14:55:08,0,4.0,projects could scale low feesoh wait already exist,0.0,0.65,16,1
112,1619292635.0,2021-04-24 15:30:35,1,5.0,say eth unusable fees lowest months,0.0,0.0,15,0
113,1619279046.0,2021-04-24 11:44:06,2,27.0,well least eth solution coming,-0.3,0.4,8,0
114,1619283094.0,2021-04-24 12:51:34,4,31.0,narrative tired eth already scales right eth 2 launched 4 months ago youre choosing send transactions use applications directly layer 1 heres transaction eth 1 minute ago cost 283 still expensive far cry unusable,-0.08285714285714288,0.667142857142857,50,0
115,1619283260.0,2021-04-24 12:54:20,2,21.0,computers pretty expensive first rich people universities could afford seems true lot new technologies,0.12305194805194805,0.6982683982683983,26,1
116,1619279067.0,2021-04-24 11:44:27,1,9.0,theyre store value great way p2p,-0.4,0.75,13,0
118,1619279150.0,2021-04-24 11:45:50,3,11.0,well use lower fee crypto transfers ie ltc xlm xmr ect eth gas fee like 3 last night got ta wait bro,0.0,0.06666666666666667,26,0
119,1619279845.0,2021-04-24 11:57:25,0,8.0,fake eth fee ive wanting put nft opensea damn eth gas fees like 70 come know people aint much people way much ridiculously,-0.033333333333333326,0.675,46,0
120,1619286521.0,2021-04-24 13:48:41,1,5.0,eth fees lowest theyve year youre complaining,0.0,0.0,13,0
121,1619283332.0,2021-04-24 12:55:32,1,6.0,bitcoin fees coming quickly difficulty adjustment coming could waited lower fees since guarantee coming also lightning works today go try recommend breez wallet muun wallet phoenix wallet,0.08888888888888886,0.3944444444444445,46,1
122,1619281555.0,2021-04-24 12:25:55,1,8.0,use xlm like rest us,0.0,0.0,8,1
123,1619287314.0,2021-04-24 14:01:54,0,2.0,rbtc love post,0.5,0.6,5,1
124,1619296289.0,2021-04-24 16:31:29,1,2.0,right pay premium using decentralized technology sucks ultimately technologies designed decentralization eliminating fees hopefully gets better future theres option thats decentralized low fee like early days internet pay minute crappy 56k connection youre paying premium use burgeoning technology,0.0836734693877551,0.4372448979591836,71,0
125,1619296743.0,2021-04-24 16:39:03,0,2.0,yes yes yes iota fees doesnt make sense,0.0,0.0,11,0
126,1619297816.0,2021-04-24 16:56:56,0,2.0,lightning already use bitrefill buy daily stuff freakin third world country 13 sats fees,0.0,0.0,23,1
127,1619301590.0,2021-04-24 17:59:50,0,2.0,properly decentralized crypto possible scale base layer bitcoin decentralized crypto currency crypto currencies 3 properties decentralization security speed want increase speed base layer would need compromise decentralization security reason bitcoin doesnt want make modifications base layer scaling reason lightning network yet widely adopted one wants use bitcoin buy coffee money starts store value currently bitcoin medium exchange already happening larger transactions base layer smaller transactions lightning unit account takes time adoption companies like tesla already accepting bitcoin payment,-0.21666666666666667,0.625,138,1
128,1619282127.0,2021-04-24 12:35:27,0,6.0,really used ethereum morning worked great,0.5,0.475,9,0
129,1619283330.0,2021-04-24 12:55:30,1,5.0,hold nanos solves problems btc crypto currency,-0.1925,0.2525,23,0
130,1619283522.0,2021-04-24 12:58:42,2,6.0,really dont get cost 250 eth transaction coinbase wallet morning,0.2,0.2,17,1
131,1619286103.0,2021-04-24 13:41:43,4,8.0,exactly dont single btc eth dont believe long term far ada xrp etc made profits,0.21892857142857144,0.5807142857142856,34,0
132,1619286205.0,2021-04-24 13:43:25,0,3.0,ever heard nano instant transactions fees check imagine paying fees per transaction,0.0,0.6666666666666666,19,1
133,1619283563.0,2021-04-24 12:59:23,0,2.0,let shitcoin shilling comments commence,0.0,0.0,7,0
134,1619295655.0,2021-04-24 16:20:55,0,2.0,eth 20 whens half life 3 coming,-0.16666666666666666,0.16666666666666666,9,1
135,1619288452.0,2021-04-24 14:20:52,0,2.0,always use xrp great coin fast transactions low fees,0.3333333333333333,0.55,12,0
136,1619289073.0,2021-04-24 14:31:13,0,2.0,maybe try feeless coins like iota nano,0.0,0.0,8,1
137,1619287076.0,2021-04-24 13:57:56,0,1.0,thats need move ltc think top 10 coin faster cheaper everything,0.5,0.5,20,1
138,1619289131.0,2021-04-24 14:32:11,1,1.0,man anyone know iota feel like im taking crazy pills zoolander reference,-0.6,0.9,15,1
139,1619301939.0,2021-04-24 18:05:39,0,1.0,doge coin coming,0.0,0.0,4,0
140,1619303667.0,2021-04-24 18:34:27,0,1.0,g e c n,0.0,0.0,8,1
141,1619279176.0,2021-04-24 11:46:16,3,-3.0,btc like gold crypto currency first crypto used shit crypto eth like silver plus functionality failed transaction fees gas point view crypto smash destroy two cryptos much advanced technology speed,0.05000000000000001,0.4154761904761905,73,0
142,1619282600.0,2021-04-24 12:43:20,0,1.0,btc great brand value anything eth opinion great teamorganization pushing envelope cryptocurrency neither end state could crash spectacularly,0.7333333333333334,0.7999999999999999,35,0
143,1619284311.0,2021-04-24 13:11:51,1,1.0,try use l2 solutions like loopring send receive money still wonders people dont use often,0.5,0.5,23,1
144,1619285411.0,2021-04-24 13:30:11,0,1.0,maybe wed better using doge gas,0.5,0.5,9,1
145,1619286585.0,2021-04-24 13:49:45,1,1.0,btc eth big ones everybody knows dont see future longterm theyre serving purpose need faster cheaper transactions use less hardware resources try running ethereum node see much cpu ram takes run bitcoin core even cpu miner active cores usable machine love ethereum think growing far quickly sustain become transaction fees still cheaper convert something like litecoin transfer convert back,0.10303030303030303,0.3446969696969697,109,0
146,1619287142.0,2021-04-24 13:59:02,1,1.0,transact eth btc painfull experience always try avoid firsts outdated,-0.4000000000000001,0.6333333333333334,23,0
147,1619296560.0,2021-04-24 16:36:00,0,1.0,yeah started moving money better built blockchain tech like cardano polkadot stellar algorand dont feel good eth btc hand much limited supply wider adoption look store value nothing,0.32193877551020406,0.40969387755102044,50,1
148,1619301787.0,2021-04-24 18:03:07,0,1.0,risk crucified everyone think doge solves exact problem,0.25,0.25,16,0
149,1619280287.0,2021-04-24 12:04:47,2,-1.0,first person reply gets free award,0.375,0.5666666666666667,8,0
150,1619285158.0,2021-04-24 13:25:58,1,0.0,im heavily invested coins hope btc eth drop mine go cool story bro,0.008333333333333323,0.5083333333333333,20,1
151,1619288612.0,2021-04-24 14:23:32,1,0.0,moved 300 usd crypto three exchanges yesterday total 2 usd network fees dogecoin,0.0,0.75,21,0
152,1619279104.0,2021-04-24 11:45:04,0,1.0,agree point atm dont know protocol better whether better one sense another even matters comes people end using,0.5,0.5,36,0
153,1619279335.0,2021-04-24 11:48:55,0,1.0,transaction go last night 0000316 btc long patience get away lower fees although still pretty high compared cryptos,0.047,0.4763333333333334,34,0
