,UTC,Post Date,Number of Comments,Upvote Ratio,Text,polarity,subjectivity,word_count,is_spam
1441,1619249045.0,2021-04-24 03:24:05,1,4.0,security reason btc high txps cuz slow security sure could increase blocksize btc less secure altcoins dont think onchain speed adoptable keep security heard blockchain trilemma also lightning get developed aswell like altcoins look eth hyped totally useless atm u cant swap investments cuz gas fees prisoned blokchain without chance get finally fix shit cardano doesnt features yet soon even lightning hasnt features yet possible one predict future bitcoin adopted people dont care much see doge pump facts n stuff ppl use bitcoin cuz everyone uses thats still using whatsapp twitch youtube way better solutions privacy etc people dont care bubble cares average human absolutely dont care want cash,0.17015151515151516,0.5009343434343434,193,0
1442,1619239588.0,2021-04-24 00:46:28,0,3.0,see hold position ways right youre ignoring pace change developments see mass adoption big adopters like michael saylor suggesting btc layer currency hes saying base layer fiat rails top usd euro part realistic way global financial system underpinned something much robust economically fiat currency longer single nations currency realistic would majority people use litecoin transacting instead digital fiat top btc wont better way developed nations powerful currency would otherwise see crypto unacceptable force could benefit instead poorer countries weak currencies like venezuela would cease one people would much better problems describing real solution proposing likely one nothing going replace bitcoin anytime soon,0.16402691511387163,0.4844202898550725,193,0
1443,1619234808.0,2021-04-23 23:26:48,0,3.0,post little misleading think anyone argues btc everyday transaction perhaps years ago seen largely store value mention coming years gravitate particular price become less volatile etc continue store value may also used large purchases make fees negligible instant verification required things like backing line credit also coins besides btc also develop blockchain technology general going anywhere endless use cases,-0.01444805194805195,0.4680735930735931,105,1
1444,1619247790.0,2021-04-24 03:03:10,1,3.0,alts provide without trade offs right,0.2857142857142857,0.5357142857142857,10,1
1445,1619233602.0,2021-04-23 23:06:42,3,3.0,dont think supposed used daily transactions treated store value sell property often huge fees involved doesnt make property worthless art though one cryptocurrency value bitcoin place cryptos different properties,-0.08749999999999998,0.6291666666666667,58,0
1446,1619236233.0,2021-04-23 23:50:33,1,2.0,bitcoin anything altcoins development slower security 1 fancy things 2 dont see billionaires fomoing poopcoin anytime soon,0.0,0.0,31,1
1447,1619241312.0,2021-04-24 01:15:12,0,2.0,would love see litecoin true second layer bitcoin doesnt seem like thats ever gon na happen eth network upgrades come successfully schedule bitcoin going tough time justifying position numero uno crypto,0.24222222222222226,0.6066666666666667,49,0
1448,1619232096.0,2021-04-23 22:41:36,2,3.0,butbitcoin good bitcoin big money,0.35,0.35000000000000003,5,1
1449,1619233617.0,2021-04-23 23:06:57,0,3.0,business model company controls btc development relies network high fees attack actual attempt scale use rbitcoin platforms censor anyone disagrees theyve years even reason bitcoin cash created since bitcoin people wanted get away devs control network make useful money course attacked censored still dont seem actually making money somehow theyre still dedicated cause making sure btc isnt usable,0.1907142857142857,0.3576984126984127,109,1
1450,1619237813.0,2021-04-24 00:16:53,0,2.0,80 90 crypto wealth btc agree op bitcoin terrific store value terrible currency small transactions lightning good solution would surprised see ever reach critical mass disagree alts personally think eventually btc savings eth 20 defi fiat stable coins digital government backed currencies well internalized btc trading payment providers like paypal venmo much enjoy tech degenerate gambling mean trading personally see likely scenario altcoins big role,-0.10634615384615387,0.5913461538461537,116,0
1451,1619235420.0,2021-04-23 23:37:00,0,0.0,btc good currency thats old news simply store value remain due brand name,-0.09375,0.3830357142857143,25,0
1452,1619234214.0,2021-04-23 23:16:54,0,1.0,bitcoin isnt going anywhere soon however point adapt technology become outdated longer keep,-0.4000000000000001,0.6333333333333334,27,0
1453,1619259974.0,2021-04-24 06:26:14,2,1.0,someone doesnt follow development github bitcoin improve last years keep reading ethereum network upgrades nano spamresistance iota chrysalis update many exciting updates dlt quite silent comes bitcoin feels like bitcoin one slowest coin receive updates lighting last big solution book never heard new forks 2017 hype anyone give us insight new featuresimprovement development,0.07477272727272727,0.3017424242424243,91,1
1455,1619232223.0,2021-04-23 22:43:43,0,0.0,yep think many people come conclusion got tired trying explain maximalists cant ignore bitcoin stills carries weight arent looking elsewhere youre going miss new economy,0.07878787878787878,0.5515151515151515,43,1
1456,1619232043.0,2021-04-23 22:40:43,1,0.0,agreed gigantic wave defenders incoming,0.0,0.0,10,0
1457,1619246798.0,2021-04-24 02:46:38,0,0.0,bitcoin die slow death doesnt fix transaction fees opening closing lightning channel costs 90 right 2x tx fees,-0.007142857142857173,0.46785714285714286,26,1
1458,1619265836.0,2021-04-24 08:03:56,0,1.0,bitcoin never meant store value,0.0,0.0,10,1
1459,1619281160.0,2021-04-24 12:19:20,0,1.0,strike wallet works great lightning electrum works fairly well public lightning nodes allowing pay pretty much invoice anyone walletofsatoshi also easy lightning wallet okex ligthning kraken looking get others onboard well lightning new honestly needs users lol users connections available,0.4433080808080809,0.600378787878788,63,0
1460,1619282868.0,2021-04-24 12:47:48,0,1.0,proving time doesnt guarantee knowledge youve got spend time learning,0.0,0.0,16,0
1461,1619288757.0,2021-04-24 14:25:57,0,1.0,zero knowledge rollups optimistic rollups good example bitcoin core made dramatic mistakes turns zero knowledge rollups x100 scalibility although bit less flexibility keeping security base blockchain however need smart contracts btc core consider waste finally ethereum scale btc end tx block size btc close mindedness bitcoin core time mcuch,0.06785714285714285,0.4716269841269842,93,0
1462,1619235938.0,2021-04-23 23:45:38,0,-5.0,xrp one,0.0,0.0,4,0
1463,1619248442.0,2021-04-24 03:14:02,0,-1.0,totally agreed also bitcoin community willing change status que matter think bitcoins glory last forever wont bitcoin dominance already dropped 50 gon na stop,-0.041666666666666664,0.5222222222222223,39,0
1464,1619258357.0,2021-04-24 05:59:17,0,0.0,like litecoin good wait find certain coin,0.2630952380952381,0.5154761904761905,16,0
1465,1619258614.0,2021-04-24 06:03:34,0,2.0,true hold btc couldnt care less ln would rather use alts lowvalue transfers even offchain transactions using exchange etc better use cases ln,0.22777777777777777,0.4055555555555556,34,0
1466,1619259233.0,2021-04-24 06:13:53,1,-1.0,understand main problem transaction fee taking custody sats im never going sell use sats dont channel liquidity one spend money open incoming channel immediately close move funds cold wallet hodler lot 3rd world residents use bitcoin sov would amazing could take custody 50000 stats every month,0.03333333333333335,0.5466666666666666,91,1
1467,1619256077.0,2021-04-24 05:21:17,0,4.0,right open one channel long node directly indirectly connected node connected reach,0.03511904761904762,0.5351190476190476,32,1
1469,1619232612.0,2021-04-23 22:50:12,2,7.0,eat broccoli,0.0,0.0,6,1
1470,1619239037.0,2021-04-24 00:37:17,0,2.0,name starts n ends ano,0.0,0.0,9,0
1471,1619238852.0,2021-04-24 00:34:12,0,2.0,contain potassium,0.0,0.0,4,1
1473,1619238196.0,2021-04-24 00:23:16,0,3.0,heard shiny stellar lumens,0.25,0.25,9,1
1474,1619253929.0,2021-04-24 04:45:29,0,2.0,yes even used bitcoin itd still lot cheaper 4x block generation speed clear heavier transactions chain becomes lot free,0.25,0.5916666666666667,34,0
1475,1619277455.0,2021-04-24 11:17:35,0,1.0,problem bch ltc way slow many better coins small purchases,0.11249999999999999,0.44999999999999996,20,0
1476,1619233191.0,2021-04-23 22:59:51,0,11.0,lol add buy bch kim dotcom point lmao insta perma ban,0.7,0.85,17,0
1477,1619234957.0,2021-04-23 23:29:17,1,3.0,banned bitcoin going two years,0.0,0.0,8,0
1478,1619246695.0,2021-04-24 02:44:55,0,0.0,youll insta banned,0.0,0.0,4,1
1479,1619234376.0,2021-04-23 23:19:36,0,2.0,think issue need aggregate txns useful wake one morning say id like turn cash bitcoin today need persistent ln channel useful dont dca buy times year doesnt make sense spin channel ln withdraw tear,0.04888888888888888,0.2777777777777778,73,1
1480,1619233892.0,2021-04-23 23:11:32,0,2.0,looks like issue still need pay chain fee openclose channel even issues sorted ln really work base layer usable larger scale,-0.15000000000000002,0.675,46,1
1481,1619233239.0,2021-04-23 23:00:39,0,-1.0,lightning fine useful,0.13333333333333336,0.25,7,1
1482,1619278140.0,2021-04-24 11:29:00,0,1.0,issue lightning network didnt buy btc years ago,0.0,0.0,14,0
1483,1619254077.0,2021-04-24 04:47:57,0,2.0,correct im frustrated lot people help onboard cant withdraw wallets,-0.7,0.2,19,1
1484,1619253128.0,2021-04-24 04:32:08,1,2.0,even better take monero example,0.5,0.5,6,1
1485,1619235590.0,2021-04-23 23:39:50,2,4.0,treated store value devs drove ground pushing shitty layer 2s refusing scale lot people circle jerk bch theyre transactions per day fee 00025 mostly blockchain would really centralized btc 2 mb blocks like right btc grows 52 gbyr im running node really give shit 104gbyr 1 tb hdd 47 thats 235yr vs 47yr space gimped reason call store value hope brand name carries nbsp side note property value use need shelter good comparison,0.1419642857142857,0.43258928571428573,134,1
1486,1619235102.0,2021-04-23 23:31:42,0,1.0,think designed daily transactions scalable enough plenty better alternatives,0.16666666666666666,0.3333333333333333,24,0
1487,1619233777.0,2021-04-23 23:09:37,0,-1.0,yeah take possession house doesnt make sense transaction fee equals buy monthly,0.0,0.0,22,1
1488,1619239101.0,2021-04-24 00:38:21,1,8.0,exactly hear pos pow time thing bash bitcoin bitcoin go pos option goes scaling bitcoin demand let shitcoins experiment onchain changes scale king stays true main benefits security reliability every cycle altcoiners hold biggest bags make mistake every bullrun,0.16583333333333333,0.3466666666666666,73,0
1489,1619233742.0,2021-04-23 23:09:02,1,0.0,institutions like ones bitcoin whitepaper mentions bitcoin designed help people avoid,0.0,0.0,22,1
1490,1619233899.0,2021-04-23 23:11:39,0,1.0,big money flowing bitcoin finally got crypto seen volatile thought gamble institutions started piling bitcoin could see domino effect coins,-0.041666666666666664,0.4916666666666667,41,1
1491,1619266647.0,2021-04-24 08:17:27,0,5.0,activation method biggest upgrade bitcoin merged less 2 weeks ago,-0.16666666666666666,0.06666666666666667,17,0
1492,1619261605.0,2021-04-24 06:53:25,1,-1.0,guess missed bitcoin chinese miners owned wont anything interests,0.0,0.0,18,0
1493,1619232514.0,2021-04-23 22:48:34,1,4.0,yeah eth spent 10 fees low settings get rid,-0.05,0.2,19,0
1495,1619232912.0,2021-04-23 22:55:12,1,7.0,nah think people realize lightning never going work,0.5,0.5,15,0
1496,1619285823.0,2021-04-24 13:37:03,0,1.0,main issue lightning dont know use efficiently doesnt ln work close inbound channels instantly dont worry theyll make ui easy use eventually wont manually manage channels people didnt know send email became app ipad youll get easy app 2 buttons send receive eventually,0.2583333333333333,0.6666666666666667,75,1
1498,1619232757.0,2021-04-23 22:52:37,1,5.0,thats secret captain im always broccolish,-0.4,0.7,7,1
1499,1619237450.0,2021-04-24 00:10:50,0,-2.0,also need potassium,0.0,0.0,6,1
1500,1619235205.0,2021-04-23 23:33:25,1,2.0,banned san francisco reddit im sf,0.0,0.0,12,1
1501,1619266511.0,2021-04-24 08:15:11,1,-2.0,secret inflation bugs botnet mining deployed undisclosed asics capable mining monero centralised development korea japan banned exchanges listing monero others follow compared monero bitcoin massively scalable coin want trade offs listed,-0.08125,0.61875,46,1
1502,1619238585.0,2021-04-24 00:29:45,0,3.0,spot devs captured industrial scale mining interests design keep fees high usable,0.16,0.5399999999999999,17,1
1503,1619261792.0,2021-04-24 06:56:32,0,0.0,guess ppl missed bitcoin chinese miners owned wont anything interests store value lol,0.43333333333333335,0.39999999999999997,24,0
1504,1619265578.0,2021-04-24 07:59:38,0,1.0,bitcoin could technically implement pos thats realistically possible financial political reasons point really trying add pos bitcoin might well use ethereum,0.04,0.28,35,1
1505,1619246314.0,2021-04-24 02:38:34,0,-1.0,one talks fact bitcoin designed part jp morgan goldman ball sachs portfolio financial plan meant people means escape corruption financial system backfired alts taken reigns,0.0,0.0,50,0
1506,1619293574.0,2021-04-24 15:46:14,0,0.0,bigger mining pools come china mean hash power also chinese people hook asics world pools china big missconception,0.0390625,0.321875,34,0
1507,1619232849.0,2021-04-23 22:54:09,0,3.0,pretty much time eth fees make sense,0.15,0.7333333333333334,9,0
1508,1619232257.0,2021-04-23 22:44:17,0,1.0,need lozenge somebody get two covid test stat,0.0,0.0,12,0
1509,1619234048.0,2021-04-23 23:14:08,1,0.0,actually forgot existed havent heard term lightning months years,0.0,0.1,14,0
1510,1619234423.0,2021-04-23 23:20:23,0,-1.0,broccoli favorite vegetable,0.5,1.0,5,0
1511,1619259263.0,2021-04-24 06:14:23,1,1.0,rnews rconservative rbestof rtd,0.0,0.0,7,1
1512,1619269456.0,2021-04-24 09:04:16,0,5.0,asic issue resolved long time algorithm hardforked randomx check network hashrate even 80 cpu make 05 day electricity free doesnt centralised development dont speak something dont know developers anonymous satoshi government banning gives reason get involved monero made one thing providing fungible decentralised currency low transaction fee perfectly,0.37,0.6,93,0
1513,1619235078.0,2021-04-23 23:31:18,1,1.0,every someone mention part argument bitcoin still eventually going standard currency daily transactions,0.0,0.0,29,0
1514,1619262628.0,2021-04-24 07:10:28,0,1.0,fucking authoritarian dick sucking san francisco liberals took td effective leftists damn closed minded,-0.06388888888888888,0.4972222222222223,20,0
1515,1619237045.0,2021-04-24 00:04:05,0,3.0,think bitcoiners maximalist come round way thinking bitcoin daily currency bitcoin store value way send big transactions another coin project used daily transactions going use bitcoin buy one knows coin yet,0.06,0.2,70,0
1516,1619280113.0,2021-04-24 12:01:53,6,0.67,four arrested turkish exchange vebitcoin closes doors,0.0,0.0,9,1
1517,1619280188.0,2021-04-24 12:03:08,0,1.0,theyll regret couple years,0.0,0.0,8,0
1519,1619280439.0,2021-04-24 12:07:19,0,1.0,another turkish scam exchange,0.0,0.0,4,0
1520,1619281832.0,2021-04-24 12:30:32,0,1.0,tldr four employees vebitcoin arrested turkey allegations fraud last night exchange announced would ceasing operations citing unspecified financial strain comes amid countrywide cryptocurrency ban go effect april 30th summary auto generated bot meant replace reading original article always dyor,0.125,0.2722222222222222,63,1
1521,1619282610.0,2021-04-24 12:43:30,0,1.0,use stolen money buy lawyers judges,0.0,0.0,12,1
1522,1619283098.0,2021-04-24 12:51:38,0,1.0,dont trust turkish government,0.0,0.0,6,0
1523,1619298322.0,2021-04-24 17:05:22,1,0.67,turkish authorities detained 4 probe vebitcoin crypto exchange,0.0,0.0,11,1
1524,1619298910.0,2021-04-24 17:15:10,0,1.0,tldr turkish authorities detained four people part investigation vebitcoin cryptocurrency exchange platform action comes day staterun media announced bank accounts associated exchange frozen second crypto platform week face troubles country banning use cryptocurrencies summary auto generated bot meant replace reading original article always dyor,0.15833333333333333,0.2833333333333333,77,0
1525,1619263247.0,2021-04-24 07:20:47,10,0.77,bitcoin corrects 27 oh time buy bitcoin,0.0,0.0,12,0
1526,1619263248.0,2021-04-24 07:20:48,0,1.0,hello rcryptocurrency readers please try following links sort comments controversial first click doesnt work mobile potentially find cryptowikis articles subject post click contribute cryptowikis click bot action performed automatically please contact moderators subredditmessagecomposetorcryptocurrency questions concerns,0.12222222222222223,0.4694444444444445,64,1
1527,1619264006.0,2021-04-24 07:33:26,0,3.0,correction healthy market overall also remember correction crash bear market happens stocks tooalmost everything else happened times last bull run well,0.06,0.15833333333333333,43,0
1528,1619263344.0,2021-04-24 07:22:24,1,2.0,good chance increase coins portfolio get coins always wanted,0.7,0.6000000000000001,18,0
1529,1619263898.0,2021-04-24 07:31:38,1,2.0,im waiting dip low volume isnt looking good also tomorrow sunday always discounts sunday,0.39999999999999997,0.46666666666666673,24,0
1530,1619263932.0,2021-04-24 07:32:12,1,1.0,tldr bitcoin 25 week always bounced back produce mindbending returns price bitcoin trading new low right inside range think produce bottom bitcoin worth 50 18 trillion cryptocurrency market likely remain 1 long time summary auto generated bot meant replace reading original article always dyor,0.13765223665223664,0.44491486291486293,83,1
1531,1619289980.0,2021-04-24 14:46:20,0,1.0,wtf thumbnail shift key lmao,0.033333333333333326,1.0,9,0
1532,1619264021.0,2021-04-24 07:33:41,1,8.0,discount crypto sales best disposable income buy,0.5,0.6,15,0
1533,1619266928.0,2021-04-24 08:22:08,0,1.0,every sunday dips kind random although quite bloody sundays never guaranteed,-0.275,0.6,21,0
1534,1619265769.0,2021-04-24 08:02:49,0,3.0,btc dominance falling mr bot,0.0,0.0,6,1
1535,1619264377.0,2021-04-24 07:39:37,0,2.0,allready limit investing crypto,0.0,0.125,9,1
1536,1619297619.0,2021-04-24 16:53:39,9,0.67,dex volumes continue rising bitcoin corrects,0.0,0.0,7,0
1537,1619297621.0,2021-04-24 16:53:41,0,1.0,advised website cointelegraphcom proven unreliable source information bot action performed automatically please contact moderators subredditmessagecomposetorcryptocurrency questions concerns,0.1,0.1,38,1
1538,1619297954.0,2021-04-24 16:59:14,2,5.0,id love dexs first one simpler use binance none futures leverage bullshit secure away grubby governments absolutely huge thing even offramp users fiat dont government backing,0.41,0.5866666666666667,48,0
1539,1619298917.0,2021-04-24 17:15:17,0,2.0,tldr decentralized exchange dex volume spiked late february followed downtrend first week april saw total volume traded dexs fall low 603 million april 4 price bitcoin declined april 6 april 8 dex volume began increase reached peak april 7 summary auto generated bot meant replace reading original article always dyor,0.065,0.5466666666666666,81,0
1540,1619297620.0,2021-04-24 16:53:40,0,1.0,hello rcryptocurrency readers please try following links sort comments controversial first click doesnt work mobile potentially find cryptowikis articles subject post click contribute cryptowikis click bot action performed automatically please contact moderators subredditmessagecomposetorcryptocurrency questions concerns,0.12222222222222223,0.4694444444444445,64,1
1541,1619302951.0,2021-04-24 18:22:31,2,3.0,check soku swap since youre looking newer exchanges might worth keeping eye seems value users exchanges offering classes teaching users rewarding governance token voice people,0.39125,0.495,49,0
1542,1619302229.0,2021-04-24 18:10:29,0,1.0,egld watch space defi 20 coming soon maiar exchange,0.0,0.0,11,1
1543,1619303185.0,2021-04-24 18:26:25,0,1.0,love enthusiasm im sold,0.5,0.6,6,0
1545,1619250037.0,2021-04-24 03:40:37,48,0.61,found bitcoin wallet 2012,0.0,0.0,6,0
1546,1619250038.0,2021-04-24 03:40:38,0,1.0,hello rcryptocurrency readers please try following links sort comments controversial first click doesnt work mobile potentially find cryptowikis articles subject post click contribute cryptowikis click bot action performed automatically please contact moderators subredditmessagecomposetorcryptocurrency questions concerns,0.12222222222222223,0.4694444444444445,64,1
1547,1619251098.0,2021-04-24 03:58:18,4,25.0,true story vs story got crypto reopened coinbase account set unsuccessfully buy drugs darknet back 2015 never used setup used transfer 2 cents verify bank info 2 cents 5 kerchinggg kicking trying harder buy drugs inter webs,0.08333333333333333,0.21666666666666667,69,0
1548,1619250099.0,2021-04-24 03:41:39,5,35.0,today things didnt happen,0.0,0.0,6,0
1549,1619252474.0,2021-04-24 04:21:14,0,6.0,daaamnn nice grandpa found tresor stick 2009 2500 btc fckin remembered password even tough dementia yea im kinda rich,0.19537037037037033,0.8611111111111112,32,0
1550,1619251077.0,2021-04-24 03:57:57,0,3.0,big true congrats fuck,-0.01666666666666668,0.45,7,0
1551,1619251430.0,2021-04-24 04:03:50,2,8.0,lol theres cynical people like would say brother 10 grand heres screenshot,0.10000000000000002,0.76,21,0
1552,1619264932.0,2021-04-24 07:48:52,0,2.0,people downvoting saying didnt happen 1 op posted screenshot comments congrats 2 price bitcoin 2012 never went 15 equivalent leaving 3 online wallet one day 9 years later worth 10k,0.09999999999999999,0.06666666666666667,52,0
1553,1619250155.0,2021-04-24 03:42:35,1,5.0,ill take moonfarming 2000 alex damn miss trebek,0.0,0.0,11,1
1554,1619250598.0,2021-04-24 03:49:58,0,2.0,wtf hedgehog also barely remembered old password 8 billion dollars worth xrp kerchiiiiing,0.0062500000000000056,0.35000000000000003,19,0
1556,1619250216.0,2021-04-24 03:43:36,0,1.0,really want praise memory brother cant even remember reddit password reset yesterday,0.2,0.2,21,0
1557,1619250211.0,2021-04-24 03:43:31,0,1.0,imagine 100s bitcoin lying mined hours back day,-0.1,0.05,21,0
1559,1619250314.0,2021-04-24 03:45:14,0,1.0,free money bet doge,0.5,0.8,7,1
1560,1619250412.0,2021-04-24 03:46:52,0,1.0,may thinking time whats password,0.0,0.0,11,1
1561,1619250494.0,2021-04-24 03:48:14,0,1.0,feel great reading thiscongrats brother,0.8,0.75,9,1
1562,1619250835.0,2021-04-24 03:53:55,0,1.0,damn really wish old enough understand bitcoin 2012,0.10000000000000002,0.3,13,0
1563,1619251319.0,2021-04-24 04:01:59,0,1.0,thats epic mate congratz,0.1,0.4,4,0
1564,1619254273.0,2021-04-24 04:51:13,0,1.0,good shit hopefully shares,0.22499999999999998,0.7000000000000001,5,0
1565,1619257112.0,2021-04-24 05:38:32,0,1.0,alex ill take things didnt happen 100,0.0,0.0,9,1
1566,1619258953.0,2021-04-24 06:09:13,1,1.0,true story brought 289 bitcoins back 2009 dare forgot lambo 25 ducks 10 camels cat found,0.31666666666666665,0.5499999999999999,33,0
1567,1619262777.0,2021-04-24 07:12:57,0,1.0,take money buy btc,0.0,0.0,8,1
1568,1619270373.0,2021-04-24 09:19:33,0,1.0,best holding strategy ever,1.0,0.3,4,0
1569,1619250270.0,2021-04-24 03:44:30,1,0.0,rip dms,0.0,0.0,3,0
1570,1619250400.0,2021-04-24 03:46:40,0,0.0,found 2 doge 10 yrs ago wonder much today kaching,0.25,0.2,18,0
1571,1619250740.0,2021-04-24 03:52:20,0,0.0,give boring,-1.0,1.0,3,1
1572,1619252418.0,2021-04-24 04:20:18,0,7.0,true story bought 40 bitcoin 2012 yolo dark web mixer stole fast forward 2015 successfully use bitcoin dark web immediately buy 1 bitcoin forget 2018 bullrun panic sell bitcoin yolo alts 1 bitcoin worth 042 bitcoins,0.2571428571428572,0.5142857142857142,65,0
1573,1619269243.0,2021-04-24 09:00:43,0,3.0,bought two eggs bitcoin even thing omelettes kerching,0.0,0.0,16,0
1574,1619252258.0,2021-04-24 04:17:38,0,1.0,coinbase said bunch unearned rewards week lol click click earned 5 thanks,0.5,0.44999999999999996,22,1
1575,1619255891.0,2021-04-24 05:18:11,0,1.0,going gains,0.0,0.0,9,0
1577,1619252347.0,2021-04-24 04:19:07,0,3.0,today shitposting moon farming,0.0,0.0,6,0
1580,1619258975.0,2021-04-24 06:09:35,0,1.0,keeping things didnt happen episode 63,0.0,0.0,10,0
1581,1619253614.0,2021-04-24 04:40:14,0,4.0,yeah like would someone lie 10k perfectly plausible thing happened lol,0.65,0.6,19,0
1583,1619252277.0,2021-04-24 04:17:57,0,1.0,like moons,0.0,0.0,4,0
1584,1619262649.0,2021-04-24 07:10:49,0,0.0,10 camelsthats impressive,1.0,1.0,3,1
1585,1619250407.0,2021-04-24 03:46:47,2,4.0,cant fall scams original message based reality either,0.375,0.75,14,0
1586,1619250678.0,2021-04-24 03:51:18,1,2.0,spouting bullshit awards goes,0.0,0.0,7,0
1587,1619250670.0,2021-04-24 03:51:10,0,2.0,hello kind sir martins name interest business opportunity,0.6,0.9,16,1
1589,1619250773.0,2021-04-24 03:52:53,1,8.0,dog found 10000 btc used mine nintendo 64 back 1996 anyone knew btc,0.0,0.0,23,1
1590,1619250885.0,2021-04-24 03:54:45,1,3.0,thats amazing cat threw shoe,0.6000000000000001,0.9,10,0
1591,1619250941.0,2021-04-24 03:55:41,1,1.0,cat must satoshi nakamoto,0.0,0.0,6,1
1592,1619251187.0,2021-04-24 03:59:47,0,1.0,cat found btc wallet mouse hole mouse happy,-0.4,1.0,13,0
1593,1619181148.0,2021-04-23 08:32:28,242,0.95,crypto whale moves 321000000 bitcoin single transaction,-0.07142857142857142,0.21428571428571427,9,0
