,UTC,Post Date,Number of Comments,Upvote Ratio,Text,polarity,subjectivity,word_count,is_spam
0,1619278961.0,2021-04-24 11:42:41,407,0.76,rant sorry btc eth pretty much unusable right,0.05892857142857143,0.6839285714285714,14,0
1,1619278963.0,2021-04-24 11:42:43,0,1.0,hello rcryptocurrency readers please try following links sort comments controversial first click doesnt work mobile potentially find cryptowikis articles subject post click contribute cryptowikis click bot action performed automatically please contact moderators subredditmessagecomposetorcryptocurrency questions concerns,0.12222222222222223,0.4694444444444445,64,1
2,1619282964.0,2021-04-24 12:49:24,2,52.0,could someone explain like 5 year old gas fees occur,0.1,0.2,21,0
3,1619279044.0,2021-04-24 11:44:04,11,114.0,isnt stellar nano lite coin vertcoin etc introducted mainly mitigate fees,0.20833333333333331,0.29166666666666663,17,0
4,1619282160.0,2021-04-24 12:36:00,2,22.0,xlm good fast ive liking algo well pick tokens thats build eth,0.44999999999999996,0.6000000000000001,19,0
5,1619280024.0,2021-04-24 12:00:24,5,81.0,eth gas fees actually dropping gradually transactions remaining high ideal high btc either 250 moment edit 120 right,0.031142857142857132,0.543142857142857,32,0
6,1619286595.0,2021-04-24 13:49:55,0,6.0,really hope alt coins sure bitcoin sacrifices speed security ethereum extensive ecosystem downfall would possible ran major major security issues,0.103125,0.6152777777777778,36,1
7,1619307585.0,2021-04-24 19:39:45,1,5.0,algo best overall package right,0.42857142857142855,0.2785714285714285,8,0
8,1619290280.0,2021-04-24 14:51:20,2,12.0,sent transaction btc costed 60 using segwit 5 10 outputs inputs even peak next block transactions 20,0.16666666666666666,0.5,39,0
9,1619280309.0,2021-04-24 12:05:09,3,50.0,moment gas fee eth low,0.0,0.39,11,1
10,1619284338.0,2021-04-24 13:12:18,0,5.0,btc adress use didnt cost 60usd send btc lol,0.8,0.7,14,0
11,1619287815.0,2021-04-24 14:10:15,0,4.0,bitcoin fees perfectly fine right 50 satbyte gets next block probably less 2 dollars,0.13392857142857142,0.27559523809523806,24,0
12,1619290508.0,2021-04-24 14:55:08,0,5.0,projects could scale low feesoh wait already exist,0.0,0.65,16,1
13,1619292635.0,2021-04-24 15:30:35,1,4.0,say eth unusable fees lowest months,0.0,0.0,15,0
14,1619279046.0,2021-04-24 11:44:06,2,28.0,well least eth solution coming,-0.3,0.4,8,0
15,1619283094.0,2021-04-24 12:51:34,4,36.0,narrative tired eth already scales right eth 2 launched 4 months ago youre choosing send transactions use applications directly layer 1 heres transaction eth 1 minute ago cost 283 still expensive far cry unusable,-0.08285714285714288,0.667142857142857,50,0
16,1619283260.0,2021-04-24 12:54:20,2,20.0,computers pretty expensive first rich people universities could afford seems true lot new technologies,0.12305194805194805,0.6982683982683983,26,1
17,1619279067.0,2021-04-24 11:44:27,1,10.0,theyre store value great way p2p,-0.4,0.75,13,0
19,1619279150.0,2021-04-24 11:45:50,3,11.0,well use lower fee crypto transfers ie ltc xlm xmr ect eth gas fee like 3 last night got ta wait bro,0.0,0.06666666666666667,26,0
20,1619279845.0,2021-04-24 11:57:25,0,7.0,fake eth fee ive wanting put nft opensea damn eth gas fees like 70 come know people aint much people way much ridiculously,-0.033333333333333326,0.675,46,0
21,1619286521.0,2021-04-24 13:48:41,1,4.0,eth fees lowest theyve year youre complaining,0.0,0.0,13,0
22,1619283332.0,2021-04-24 12:55:32,1,6.0,bitcoin fees coming quickly difficulty adjustment coming could waited lower fees since guarantee coming also lightning works today go try recommend breez wallet muun wallet phoenix wallet,0.08888888888888886,0.3944444444444445,46,1
23,1619281555.0,2021-04-24 12:25:55,1,7.0,use xlm like rest us,0.0,0.0,8,1
24,1619287314.0,2021-04-24 14:01:54,0,2.0,rbtc love post,0.5,0.6,5,1
25,1619296289.0,2021-04-24 16:31:29,1,2.0,right pay premium using decentralized technology sucks ultimately technologies designed decentralization eliminating fees hopefully gets better future theres option thats decentralized low fee like early days internet pay minute crappy 56k connection youre paying premium use burgeoning technology,0.0836734693877551,0.4372448979591836,71,0
26,1619296743.0,2021-04-24 16:39:03,0,2.0,yes yes yes iota fees doesnt make sense,0.0,0.0,11,0
27,1619297816.0,2021-04-24 16:56:56,0,2.0,lightning already use bitrefill buy daily stuff freakin third world country 13 sats fees,0.0,0.0,23,1
28,1619301590.0,2021-04-24 17:59:50,0,2.0,properly decentralized crypto possible scale base layer bitcoin decentralized crypto currency crypto currencies 3 properties decentralization security speed want increase speed base layer would need compromise decentralization security reason bitcoin doesnt want make modifications base layer scaling reason lightning network yet widely adopted one wants use bitcoin buy coffee money starts store value currently bitcoin medium exchange already happening larger transactions base layer smaller transactions lightning unit account takes time adoption companies like tesla already accepting bitcoin payment,-0.21666666666666667,0.625,138,1
29,1619282127.0,2021-04-24 12:35:27,0,4.0,really used ethereum morning worked great,0.5,0.475,9,0
30,1619283330.0,2021-04-24 12:55:30,1,5.0,hold nanos solves problems btc crypto currency,-0.1925,0.2525,23,0
31,1619283522.0,2021-04-24 12:58:42,2,6.0,really dont get cost 250 eth transaction coinbase wallet morning,0.2,0.2,17,1
32,1619286103.0,2021-04-24 13:41:43,4,8.0,exactly dont single btc eth dont believe long term far ada xrp etc made profits,0.21892857142857144,0.5807142857142856,34,0
33,1619286205.0,2021-04-24 13:43:25,0,3.0,ever heard nano instant transactions fees check imagine paying fees per transaction,0.0,0.6666666666666666,19,1
34,1619283563.0,2021-04-24 12:59:23,0,3.0,let shitcoin shilling comments commence,0.0,0.0,7,0
35,1619295655.0,2021-04-24 16:20:55,0,2.0,eth 20 whens half life 3 coming,-0.16666666666666666,0.16666666666666666,9,1
36,1619288452.0,2021-04-24 14:20:52,0,2.0,always use xrp great coin fast transactions low fees,0.3333333333333333,0.55,12,0
37,1619289073.0,2021-04-24 14:31:13,0,2.0,maybe try feeless coins like iota nano,0.0,0.0,8,1
38,1619287076.0,2021-04-24 13:57:56,0,1.0,thats need move ltc think top 10 coin faster cheaper everything,0.5,0.5,20,1
39,1619289131.0,2021-04-24 14:32:11,1,1.0,man anyone know iota feel like im taking crazy pills zoolander reference,-0.6,0.9,15,1
40,1619301939.0,2021-04-24 18:05:39,0,1.0,doge coin coming,0.0,0.0,4,0
41,1619303667.0,2021-04-24 18:34:27,0,1.0,g e c n,0.0,0.0,8,1
42,1619279176.0,2021-04-24 11:46:16,3,-4.0,btc like gold crypto currency first crypto used shit crypto eth like silver plus functionality failed transaction fees gas point view crypto smash destroy two cryptos much advanced technology speed,0.05000000000000001,0.4154761904761905,73,0
43,1619282600.0,2021-04-24 12:43:20,0,1.0,btc great brand value anything eth opinion great teamorganization pushing envelope cryptocurrency neither end state could crash spectacularly,0.7333333333333334,0.7999999999999999,35,0
44,1619284311.0,2021-04-24 13:11:51,1,1.0,try use l2 solutions like loopring send receive money still wonders people dont use often,0.5,0.5,23,1
45,1619285411.0,2021-04-24 13:30:11,0,1.0,maybe wed better using doge gas,0.5,0.5,9,1
46,1619286585.0,2021-04-24 13:49:45,1,1.0,btc eth big ones everybody knows dont see future longterm theyre serving purpose need faster cheaper transactions use less hardware resources try running ethereum node see much cpu ram takes run bitcoin core even cpu miner active cores usable machine love ethereum think growing far quickly sustain become transaction fees still cheaper convert something like litecoin transfer convert back,0.10303030303030303,0.3446969696969697,109,0
47,1619287142.0,2021-04-24 13:59:02,1,1.0,transact eth btc painfull experience always try avoid firsts outdated,-0.4000000000000001,0.6333333333333334,23,0
48,1619296560.0,2021-04-24 16:36:00,0,1.0,yeah started moving money better built blockchain tech like cardano polkadot stellar algorand dont feel good eth btc hand much limited supply wider adoption look store value nothing,0.32193877551020406,0.40969387755102044,50,1
49,1619301787.0,2021-04-24 18:03:07,0,1.0,risk crucified everyone think doge solves exact problem,0.25,0.25,16,0
50,1619280287.0,2021-04-24 12:04:47,2,-1.0,first person reply gets free award,0.375,0.5666666666666667,8,0
51,1619285158.0,2021-04-24 13:25:58,1,0.0,im heavily invested coins hope btc eth drop mine go cool story bro,0.008333333333333323,0.5083333333333333,20,1
52,1619288612.0,2021-04-24 14:23:32,1,0.0,moved 300 usd crypto three exchanges yesterday total 2 usd network fees dogecoin,0.0,0.75,21,0
53,1619279104.0,2021-04-24 11:45:04,0,1.0,agree point atm dont know protocol better whether better one sense another even matters comes people end using,0.5,0.5,36,0
54,1619279335.0,2021-04-24 11:48:55,0,1.0,transaction go last night 0000316 btc long patience get away lower fees although still pretty high compared cryptos,0.047,0.4763333333333334,34,0
55,1619281248.0,2021-04-24 12:20:48,0,1.0,think widely accepted btc currency ideal albeit lightning helps eth bit victim success reaction defi far greater network cope going right direction,0.1450892857142857,0.5607142857142857,48,0
56,1619281919.0,2021-04-24 12:31:59,0,1.0,im genuinely curious people think decred possibly upgraded version btc proof stake consensus help lower fees costs mining keep mining taken big companies also stakeholders vote project direction hold always hold btc though looking investments,-0.05625,0.61875,62,1
57,1619283266.0,2021-04-24 12:54:26,0,1.0,yeah btc eth collected dip sit exchange quite time,0.0,0.0,20,0
58,1619287155.0,2021-04-24 13:59:15,0,1.0,fair ethereum massive network many coins different uses dont like eth trade one dozens coins network unlike bitcoin invest eth network technology behind,0.11249999999999999,0.6791666666666667,43,1
59,1619287187.0,2021-04-24 13:59:47,0,1.0,usually trade eos costs less dollar send fast arrives exchange trade eos btcusdt probably dont lose might even make small profit much btceth transaction fee would,-0.05333333333333332,0.30333333333333334,49,1
60,1619287226.0,2021-04-24 14:00:26,0,1.0,gravity bridge bitcoin bridge cosmos network going great tool entire ecosystem bitcoin always king eth one important projects space ibc change,0.34,0.675,46,1
61,1619288262.0,2021-04-24 14:17:42,0,1.0,dont trade hodl thats become big boy dca hodl,0.0,0.1,13,1
62,1619288531.0,2021-04-24 14:22:11,1,1.0,fastest way sending 30 btc would cost 31 thank exodus ill stick waiting five days transaction process,0.0,0.0,27,1
63,1619290562.0,2021-04-24 14:56:02,0,1.0,itt full blown pants dicks tribalism,0.0972222222222222,0.4194444444444445,8,0
64,1619291350.0,2021-04-24 15:09:10,0,1.0,anybody buying crypto could use store value somewhat protected inflation see,0.0,0.0,28,1
65,1619292956.0,2021-04-24 15:35:56,0,1.0,facts want invest especially bitcoin become nothing normal paper invest make money really wan na buy stuff bruh,0.0875,0.5875,35,1
66,1619293386.0,2021-04-24 15:43:06,0,1.0,stellar would answers probably think due early btc eth still lot growing,0.075,0.30833333333333335,30,0
67,1619293632.0,2021-04-24 15:47:12,0,1.0,still live past brother ethereum layer 2 already live whining use 10 dollar fee send eth eg polygonmatic enjoy transactionspeeds 23 second cost like less 01 cent dont believe check,0.09908008658008659,0.40238095238095234,53,1
68,1619294277.0,2021-04-24 15:57:57,1,1.0,exactly nice couldnt buy anything unless loose alot transfer high hopes eth20 eliminate problem love buy hodl coins wouldnt bad actually able buy something,0.1761538461538462,0.5644139194139194,52,0
69,1619295109.0,2021-04-24 16:11:49,0,1.0,say hi litecoin,0.0,0.0,4,0
70,1619296122.0,2021-04-24 16:28:42,0,1.0,next biggest thing build btc making cheap scalable might even eth doesnt look like,0.2,0.35,22,1
72,1619296640.0,2021-04-24 16:37:20,0,1.0,store btc nexo celsius long platforms respective tokens get certain number free transactions even give interest btc eth hold,0.23285714285714282,0.5742857142857142,41,1
73,1619296874.0,2021-04-24 16:41:14,0,1.0,well moved eth conflux network order avoid crazy fees,-0.6,0.9,16,0
74,1619297072.0,2021-04-24 16:44:32,0,1.0,want continue buying eth weekly dollar cost average expensive buy transfer exchange wallet havent bought eth last weeks sure holding back new aths many average investors surely boat,0.057851239669421475,0.4112718089990817,52,1
75,1619297711.0,2021-04-24 16:55:11,0,1.0,agreed like defi cases eth buy literally unusable id taken oasis loans past wanted pay 1 swap one shitcoins dai stung 60 eth fee 2 swap another shitcoin dai another60 fee 3 go oasis another 60 allow oassis use dai 4 another fee actually pay loan 5 another fee withdraw crypto oasis paying 100s dollars simple tasks wtf,-0.1875,0.42678571428571427,86,1
76,1619297891.0,2021-04-24 16:58:11,0,1.0,ethereum raised gas fee starting go transaction backlog 1 still much transaction fee imo gas limit increase provide relief another gas limit increase could come play coming months needed layer 2 solutions also peranant relief coming soon still early still growing pains worked,0.19999999999999998,0.275,78,0
77,1619298134.0,2021-04-24 17:02:14,0,1.0,harmony one 1penny transfer fee 2 seconds finality,0.0,0.0,8,1
78,1619298150.0,2021-04-24 17:02:30,0,1.0,coins handle 15 million transactions per day guess would happen,-0.125,0.375,16,1
79,1619299862.0,2021-04-24 17:31:02,0,1.0,good store value price increasing last decade veryvery small amount time especially call something store value people say like gold gold precious metal limited earth made man bitcoin made man improvements made predecessors take market share whereas gold element,0.1076530612244898,0.5120748299319728,74,0
80,1619300006.0,2021-04-24 17:33:26,0,1.0,receive btc europe find speed cost lot better waiting check dealing bank shutting account theres foreign transactions lots cross nation applications rn cheaper quicker western union one benefit,0.09375,0.15625,50,1
81,1619300434.0,2021-04-24 17:40:34,0,1.0,wait itnano posts coming,0.0,0.0,6,0
82,1619300866.0,2021-04-24 17:47:46,0,1.0,x200b use ethereum,0.0,0.0,7,1
83,1619300905.0,2021-04-24 17:48:25,0,1.0,polygon matic solving gas problems eth,0.0,0.0,9,0
84,1619301430.0,2021-04-24 17:57:10,0,1.0,crypto send money easier faster cheaper alright gifgiphyrlwwoupbqobupogolbdownsized,0.0,0.0,12,1
86,1619302416.0,2021-04-24 18:13:36,0,1.0,celr released layer 2 finance solution days ago pay next nothing transactions future,-0.06666666666666667,0.075,22,0
87,1619302718.0,2021-04-24 18:18:38,0,1.0,people finds nano btc eth nano,0.0,0.0,9,0
88,1619302725.0,2021-04-24 18:18:45,0,1.0,eth fees actually declining since berlin hard fork currently around 45 gwei even surprising major price action historically rockets due people selling via uni andor transferring exchanges,0.10509259259259258,0.3351851851851852,44,0
89,1619303275.0,2021-04-24 18:27:55,0,1.0,one day free,0.4,0.8,7,1
90,1619303534.0,2021-04-24 18:32:14,0,1.0,least eth something btc like design least since 17 pivot,-0.3,0.4,20,0
91,1619304095.0,2021-04-24 18:41:35,0,1.0,solutions problems cant arrive fast enough,0.1,0.55,8,0
92,1619304431.0,2021-04-24 18:47:11,0,1.0,algorand blockchain cheap ass fees fast,0.30000000000000004,0.6499999999999999,10,0
93,1619304637.0,2021-04-24 18:50:37,0,1.0,facts use usdc tether u,0.0,0.0,8,1
94,1619304759.0,2021-04-24 18:52:39,0,1.0,bitcoin incredibly high fees much bitcoin worth never meant get volume thats seems unusable however shouldnt moving around btc first place could convert cheaper coin move coin turn back btc fraction cost moving btc knowledge fees needs worked friend buying holding value solid move eth hopefully upgrading system finding ways lower fees moving coins,0.15166666666666664,0.21222222222222223,104,0
95,1619305085.0,2021-04-24 18:58:05,0,1.0,literally took entire hour transfer btc exchange wallet day savage reminder ancient,-0.0625,0.5,25,0
96,1619305242.0,2021-04-24 19:00:42,0,1.0,researching etherium mining,0.0,0.0,3,1
97,1619305276.0,2021-04-24 19:01:16,0,1.0,nano awesome 0 fee instant works,0.5,0.8333333333333333,13,0
98,1619305387.0,2021-04-24 19:03:07,0,1.0,nano real p2p electronic cash system xmr privay,0.2,0.30000000000000004,12,1
99,1619305514.0,2021-04-24 19:05:14,0,1.0,polkadot answer issues,0.0,0.0,7,1
100,1619305977.0,2021-04-24 19:12:57,0,1.0,wish people would stop upvoting crap like exact thing gets posted every day two copypastecollect moons,-0.18333333333333335,0.39166666666666666,20,0
101,1619306275.0,2021-04-24 19:17:55,0,1.0,fair least eth fees vary time time traffic low affordable still annoying however traffic high youre right insane know dude didnt pay attention gas fees blew upwards 300 one transaction,-0.09428571428571429,0.6094642857142858,52,0
102,1619307148.0,2021-04-24 19:32:28,1,1.0,bitcoin right original bitcoin idea satoshi offered made peertopeer electronic cash transactions digital gold accumulated,0.22023809523809523,0.42857142857142855,29,0
103,1619308570.0,2021-04-24 19:56:10,0,1.0,chose pay 60 bitcoin transaction choice could selected lower fee transaction made choose 60 fee transaction,0.0,0.0,32,0
104,1619308670.0,2021-04-24 19:57:50,0,1.0,ravencoin assets easy create nft still coin us underrated golden time purchase n hodl,0.3111111111111111,0.5444444444444444,20,0
105,1619308799.0,2021-04-24 19:59:59,0,1.0,laughs algorand,0.0,0.0,3,1
106,1619308953.0,2021-04-24 20:02:33,0,1.0,doge doesnt seem problem serious suck hear sorry happened mate,-0.41666666666666663,0.8333333333333333,19,0
107,1619309159.0,2021-04-24 20:05:59,0,1.0,hey bud know youre angry im real sorry bitcoin cash community upset stuff bitcoin quite come check rbtc whenever want see bitcoin looks like low fees instant transactions way supposed,-0.3125,0.7416666666666666,54,1
108,1619309242.0,2021-04-24 20:07:22,0,1.0,btc transfer cost 17 know ways reduce fees right everyone pays fees shop around example use exchanges like gemini provide free withdrawals exchanges low withdrawal fees using wallet supports native segwit addresses usually give cheaper fees also,0.044387755102040814,0.483673469387755,65,1
109,1619309502.0,2021-04-24 20:11:42,0,1.0,dont buy use buy expect sell 20 years someone even dumber lot paid,0.5,0.5,34,1
110,1619309721.0,2021-04-24 20:15:21,0,1.0,100 right altoona come miner ye olden days eth still recently dusted fired last 2 gpus transfer around exchanges ive using xlm speed bloat fees though built algorithm mining rewards reduced minting new coins difference supposed made tx fees time takes mine also directly related difficulty pointed dark ages crypto discussions kicked road also anyone eth like since testnet remembers talking pos miners boogeyman last half decade remember zec came supposed new thing lightning fast tx privacy monero one could track blockchain habits like xmr see turned havent seen zec anywhere awhile ltc back day lightning chain compared btc even fallen im digging smart chain coins bnb reminds early days eth anyone remember dragons thst could grow battle omg would millionaire eth spent theres way money crypto scams rampant going trust wallet pancake swap make feel like walked casino thats explain bnb non crypto people aside mining eth dont think ill use anymore genuinely hoped smart contracts dapps thst could used facilitate real estate transactions displace escrow thst could move house ownership taxes etc blockchain think many problems inherent algorithms never whats really needed crosscrypto ledger algorithm difficulty increase blocks reward tied little higher power consumption one coin rule speak spits confirmed tx various chains,0.10852827727827727,0.3907037407037407,386,0
111,1619310127.0,2021-04-24 20:22:07,0,1.0,bsc,0.0,0.0,3,1
112,1619310346.0,2021-04-24 20:25:46,0,1.0,yes point exactly new technology updated general agreement hasnt moved forward yet,0.09318181818181819,0.4772727272727273,16,0
113,1619310724.0,2021-04-24 20:32:04,0,1.0,feel pain eat spicy meatball moving funds cold storage wallet,-0.6,1.0,19,0
114,1619310766.0,2021-04-24 20:32:46,0,1.0,mean tonnes alternatives xlm xrp nano bch dogecoin way cheaper transact would use something shift price 30 day value peer peer transfer generally anything useful currency needs price stablity requires larger marketcap requires less deflationary supply model tldr coins entirely wrong design cash underlying technology isnt reason never cash,-0.014351851851851838,0.5310185185185186,89,1
115,1619310775.0,2021-04-24 20:32:55,0,1.0,im fan digibyte send one million dollars worth dgb person literally receive two seconds later cost one penny send,0.05833333333333333,0.15833333333333333,37,0
116,1619310863.0,2021-04-24 20:34:23,0,1.0,legit got btc sent today gas damn high,0.16,0.5399999999999999,12,0
117,1619311056.0,2021-04-24 20:37:36,0,1.0,yeah amount money costs send btc pretty fucking ridiculous times agree makes almost unusable holding crypto longer expected reason alone,-0.06111111111111111,0.7999999999999999,36,0
118,1619311484.0,2021-04-24 20:44:44,0,1.0,hedera hashgraph solves cost issue tps already adopted eftpos australia,0.0,0.0,15,1
119,1619311725.0,2021-04-24 20:48:45,0,1.0,ada vet amazingly low transfer costs love inexpensive move money around,0.25,0.44999999999999996,19,0
120,1619312799.0,2021-04-24 21:06:39,0,1.0,use bitcoin cash instead bitcoin even nano anything really eth useless crap function create useless coins run top,-0.08571428571428573,0.48571428571428577,28,0
121,1619312886.0,2021-04-24 21:08:06,0,1.0,car duh,-0.3,0.6,3,1
122,1619313740.0,2021-04-24 21:22:20,0,1.0,use layer 2 lolzz,0.0,0.0,4,1
123,1619281522.0,2021-04-24 12:25:22,0,-4.0,iota solve problem,0.0,0.0,5,0
125,1619286396.0,2021-04-24 13:46:36,0,-3.0,lol ether transaction fee dont come near bitcoins stop lying btc outdated meant transactions store value,0.16666666666666666,0.5777777777777778,24,0
126,1619289279.0,2021-04-24 14:34:39,0,-2.0,nice fud everyone knows eth transaction fees dropped drastically mean guy go check coinmarketcap look gwei cost low remain increased block size stuff transactions dont try group eth btc btc big fucking problem 45 hash controlled inner mongolia china thats bitcoin slow fees id concerned know bitcoin holdings basically controlled china nice fud trying gaslight eth,0.033194444444444436,0.5243055555555556,103,0
127,1619282449.0,2021-04-24 12:40:49,0,-1.0,think cost transaction indicate cost issuance cost issuance reflect contribution cost transaction also lower contribution contribution could anything real pow credits software improvements software dispersal community good stable coin costs transaction 03 035 total transacted transferred aware movement accounts regular old bricks mortar bank often zero,0.20833333333333334,0.36282051282051286,81,0
128,1619286844.0,2021-04-24 13:54:04,0,-1.0,make post complaining trasaction costs maybe make effort use latest technologies actually solve problems check loopring fees near zero time,0.19999999999999998,0.4666666666666666,34,1
129,1619295343.0,2021-04-24 16:15:43,1,-1.0,matter time bsc flips eth know people lot eth dont want hear,0.0,1.0,28,0
130,1619284497.0,2021-04-24 13:14:57,0,0.0,come nano algorand help,0.0,0.0,8,1
131,1619292698.0,2021-04-24 15:31:38,0,0.0,dont know people keep insisting btc must used like asset buy hold appreciates im looking go barber pay haircut btc edit anything im looking go barber pay haircut app much like acorns round nearest dollar nearest 5 dollar increment buy bitcoin extra money,0.0,0.23333333333333336,79,1
132,1619294664.0,2021-04-24 16:04:24,0,0.0,wheres customary nano shill,1.0,1.0,6,1
133,1619295118.0,2021-04-24 16:11:58,0,0.0,people unironically saying eth bad lmao,-0.04999999999999993,0.8333333333333333,8,0
134,1619295526.0,2021-04-24 16:18:46,0,0.0,eth useless useful buying shitcoins,-0.06666666666666667,0.39999999999999997,8,0
136,1619311596.0,2021-04-24 20:46:36,0,0.0,well eth 20 pos certainty lightning sowhats point,0.0,0.0,15,0
137,1619284650.0,2021-04-24 13:17:30,4,46.0,every transaction eth chain pay transaction fee called gas without gas network would get spammed hell wouldnt functional layer 2 solutions already works take ton transactions chain report back chain transaction complete,0.03333333333333333,0.4666666666666666,63,1
138,1619284456.0,2021-04-24 13:14:16,2,6.0,gas fee occurs use smart contract smart contract pretty much action eth platform dapps edit gas fee transfers actually thought called transfer fee different take said grain salt dd,0.13979591836734692,0.46938775510204084,51,0
139,1619282738.0,2021-04-24 12:45:38,3,121.0,suggesting market alternative coins,0.0,0.0,10,1
140,1619282207.0,2021-04-24 12:36:47,1,53.0,mentioned nano,0.0,0.0,5,1
141,1619285519.0,2021-04-24 13:31:59,1,7.0,like vertcoin,0.0,0.0,4,0
143,1619286409.0,2021-04-24 13:46:49,0,9.0,xrp,0.0,0.125,3,1
144,1619281801.0,2021-04-24 12:30:01,4,12.0,sacrificing part scalability trilemma achieve low fees theres getting around current blockchain implementation eth 30 fully snarkd system may get close well see even 20 isnt going solve gas fee issue immediately need sort statelessness state expiry system place,0.0,0.35,66,0
145,1619279165.0,2021-04-24 11:46:05,1,2.0,wish could drive adoption easier ways integrate crypto pos solutions,0.5,0.5,16,1
147,1619302694.0,2021-04-24 18:18:14,0,1.0,hell yes use something else plenty options checkout solana,0.0,0.0,10,0
148,1619311517.0,2021-04-24 20:45:17,0,1.0,problem coins doesnt seem like anyone knows theyll scale saying xlm tiny fees means nothing nobody using please anyone explain coins dont suffer scaling issues id grateful,0.0,0.5,44,1
149,1619291619.0,2021-04-24 15:13:39,0,0.0,someone catching,0.6,0.9,4,0
