,UTC,Post Date,Number of Comments,Upvote Ratio,Text,polarity,subjectivity,word_count,is_spam
1619,1619250509.0,2021-04-24 03:48:29,1,3.0,join ethglobalco mailing lists running hackathon talks another summit next friday zero knowledge rollups scaling,0.0,0.0,27,0
1620,1619246709.0,2021-04-24 02:45:09,1,1.0,ive shared upon request ethfinance daily sub find youll see original poster theyd better answer,0.3333333333333333,0.4166666666666667,24,1
1621,1619256159.0,2021-04-24 05:22:39,0,2.0,couldnt give damn moons care eth work individual ethfinance requested someone share also really bullish eth,0.1,0.30000000000000004,34,1
1622,1619250567.0,2021-04-24 03:49:27,0,1.0,watching replay summit would great point departure,0.8,0.75,13,0
1623,1619250586.0,2021-04-24 03:49:46,1,1.0,tried searching results links summit post,0.0,0.0,14,1
1624,1619250847.0,2021-04-24 03:54:07,1,2.0,know eth implementing zero knowledg proofs,0.0,0.0,10,0
1626,1619253122.0,2021-04-24 04:32:02,0,2.0,points made individual viewed summit follow resources head rethfinance daily discussion,0.0,0.2,21,0
1627,1619258484.0,2021-04-24 06:01:24,0,3.0,zkrollups key part ethereum scaling plan people transact zkrollups get 20k transactions per second miniscule fees rolls onto mainnet ethereum zkproof transactions allowing inherit l1 security rather current sidechains l1s compete consensus mechanisms economic security rollupcentric shift came last year started see good rollups theres bunch different teams working zkl2s coming summer hype real merge onto proof stake targeting q4 ethereum overtakes bitcoin economically secure chainhardest 51 attack great incentive build eth l2s focus zkproofs scaling purposes using privacy eg already send private eth transactions cant think top head,0.25441176470588234,0.5156862745098039,168,0
1628,1619293236.0,2021-04-24 15:40:36,6,0.63,accelerated crypto loan great technique used earn interest tether usdt,0.8,0.75,17,1
1629,1619293238.0,2021-04-24 15:40:38,0,1.0,hello rcryptocurrency readers please try following links sort comments controversial first click doesnt work mobile potentially find cryptowikis articles subject post click contribute cryptowikis click bot action performed automatically please contact moderators subredditmessagecomposetorcryptocurrency questions concerns,0.12222222222222223,0.4694444444444445,64,1
1630,1619293404.0,2021-04-24 15:43:24,1,4.0,works well celsius wallet well 1051 apy usdc pay weekly compounds really well,0.2,0.2,21,0
1631,1619294981.0,2021-04-24 16:09:41,0,3.0,pls everyone favor stop using tether scammy af,0.0,0.0,13,1
1632,1619293481.0,2021-04-24 15:44:41,0,2.0,whats apy acl protocol first time hearing,0.25,0.3333333333333333,10,1
1633,1619311074.0,2021-04-24 20:37:54,1,1.0,voyager also pays 9 usdc 10 hold 10000 vgx tokens,0.0,0.0,15,1
1634,1619311193.0,2021-04-24 20:39:53,0,1.0,yea used usdc voyager pay interest per month celsius pays interest weekly run numbers gains compound way faster celsius nothing voyager ease use awesome,0.5,1.0,45,1
1635,1619268257.0,2021-04-24 08:44:17,1,0.78,notes ethglobals merge summit approx timeline eth2 progress plans comes merge,0.0,0.0,18,0
1636,1619269504.0,2021-04-24 09:05:04,0,1.0,thank nice read,0.6,1.0,6,1
1637,1619209880.0,2021-04-23 16:31:20,50,0.98,vitalik buterin went live talk upcoming ethereum 20 merge,0.13636363636363635,0.5,13,1
1638,1619209881.0,2021-04-23 16:31:21,0,1.0,hello rcryptocurrency readers please try following links sort comments controversial first click doesnt work mobile potentially find cryptowikis articles subject post click contribute cryptowikis click bot action performed automatically please contact moderators subredditmessagecomposetorcryptocurrency questions concerns,0.12222222222222223,0.4694444444444445,64,1
1639,1619210185.0,2021-04-23 16:36:25,1,14.0,info merge merge network upgrade ethereum aims swap actual consensus layer proofofwork pow energy friendly capital efficient way secure proofofstake pos consensus energy friendly means happier institutions adopting crypto,0.39375,0.4625,48,0
1640,1619213638.0,2021-04-23 17:33:58,1,14.0,reading eth 20 made realize bitcoin far best crypto bullish eth year,0.55,0.65,20,1
1641,1619209965.0,2021-04-23 16:32:45,4,11.0,nice bullish year eth,0.9375,1.0,8,1
1642,1619209935.0,2021-04-23 16:32:15,6,9.0,thank sir hail vitalik,0.0,0.0,6,1
1643,1619224951.0,2021-04-23 20:42:31,0,3.0,bullish cliffening cliffening community name given large drop eth issuance occur merge occurs ethereum fully upgraded proofofstake pos consensus algorithm cliffening play popular bitcoin phrase halvening bitcoin halves issuance rate every 4 years ethereum see issuance rate reduced roughly 90 time merge thats equivalent 3 bitcoin halvenings happening ethereum experience issuance reduction instant take additional 12 years matched bitcoins network,0.17232142857142857,0.5988095238095238,105,0
1644,1619225567.0,2021-04-23 20:52:47,0,3.0,holding onto eth get rich die trying,0.375,0.75,10,1
1645,1619211176.0,2021-04-23 16:52:56,0,6.0,whenever see speak wonder high iq,0.16,0.5399999999999999,12,0
1646,1619240484.0,2021-04-24 01:01:24,1,2.0,merge work etf automatically merges,0.6,1.0,12,1
1647,1619255326.0,2021-04-24 05:08:46,0,2.0,dont worry go live 2023 talk againthen 2024,0.13636363636363635,0.5,16,1
1648,1619210072.0,2021-04-23 16:34:32,1,2.0,bet eth,0.0,0.0,3,1
1649,1619210136.0,2021-04-23 16:35:36,0,2.0,whos ready rocket,0.2,0.5,4,0
1650,1619210165.0,2021-04-23 16:36:05,0,2.0,let go,0.0,0.0,3,1
1651,1619211435.0,2021-04-23 16:57:15,0,2.0,didnt know thanks link eth20 moon,0.2,0.2,10,1
1652,1619211504.0,2021-04-23 16:58:24,0,2.0,eth 20 going incredible,0.9,0.9,7,1
1653,1619210251.0,2021-04-23 16:37:31,2,0.0,pardon ignorance merge happening later expected heard mid 2020,-0.03333333333333333,0.13333333333333333,16,0
1654,1619211262.0,2021-04-23 16:54:22,0,0.0,nice real people real work,0.3933333333333333,0.5333333333333333,7,1
1655,1619214471.0,2021-04-23 17:47:51,1,1.0,thanks ethmerge link sad see sharding considered low priority atm wonder thats true really something thats super difficult implement thats real reason still pretty far ether way heh fees stay time accumulate tho,0.1143939393939394,0.6196969696969696,51,0
1656,1619215132.0,2021-04-23 17:58:52,0,1.0,also dev meeting earlier talked merge sounded like could coming october year bullish,0.125,0.4,21,1
1657,1619216289.0,2021-04-23 18:18:09,0,1.0,ethglobal tv displaying youtube video thats normal,0.15,0.6499999999999999,9,1
1658,1619223377.0,2021-04-23 20:16:17,0,1.0,okay people watched liked,0.55,0.65,11,0
1659,1619210446.0,2021-04-23 16:40:46,0,0.0,lets hear good news,0.875,0.6000000000000001,5,0
1660,1619210993.0,2021-04-23 16:49:53,1,3.0,us russia china blockchains could corporations want control china testing crypto yuan already us russia start testing crypto usd rub summer,0.6,1.0,38,1
1661,1619252486.0,2021-04-24 04:21:26,0,-1.0,eth even eth 20 harmony one beats several aspects,0.0,0.0,13,0
1662,1619214370.0,2021-04-23 17:46:10,0,3.0,indead may even bullish decade eth truly believe eth flip btc sometime decade,0.0,0.0,21,0
1663,1619210171.0,2021-04-23 16:36:11,0,2.0,favorite coin best performing one,0.75,0.65,11,0
1664,1619210237.0,2021-04-23 16:37:17,0,1.0,already bullish year,0.0,0.0,6,1
1665,1619210618.0,2021-04-23 16:43:38,0,1.0,bullish year portfolio,0.0,0.0,5,1
1667,1619214243.0,2021-04-23 17:44:03,0,3.0,hail great money skelly,1.0,0.75,6,1
1668,1619210007.0,2021-04-23 16:33:27,0,1.0,username checks,0.0,0.0,3,1
1670,1619214277.0,2021-04-23 17:44:37,0,1.0,vitalik lord savior save us poverty,0.0,0.0,11,1
1671,1619210092.0,2021-04-23 16:34:52,0,0.0,hail second,0.0,0.0,3,1
1672,1619249779.0,2021-04-24 03:36:19,0,1.0,far understood yes think update,0.1,1.0,12,0
1673,1619210221.0,2021-04-23 16:37:01,0,2.0,always always,0.0,0.0,4,0
1674,1619213314.0,2021-04-23 17:28:34,2,7.0,merge happening earlier expected prioritized sharding paraphrase vitalik merge complete end year optimists beginning 2022 pessimists rayonism hackathon begins soon test merge finalize spec,0.0,0.43333333333333335,43,0
1675,1619210546.0,2021-04-23 16:42:26,0,0.0,def im wondering scalable 20,0.0,0.0,11,1
1676,1619215804.0,2021-04-23 18:10:04,1,3.0,probably low priority various l2s online running already everything polygon bsc 1100 fees optimism big dapps migrating months fees wont problem regular users anymore long time,0.03571428571428571,0.2824175824175824,58,0
1677,1619213396.0,2021-04-23 17:29:56,2,1.0,europe testing digital currency dont think us testing think still exploratory phase maybe source outdated,-0.20000000000000004,0.3166666666666667,30,1
1678,1619223336.0,2021-04-23 20:15:36,1,3.0,part talk gave didnt see ethmerge site,0.0,0.0,15,1
1679,1619213431.0,2021-04-23 17:30:31,0,2.0,good thank response,0.9099999999999999,0.7800000000000001,7,1
1680,1619216048.0,2021-04-23 18:14:08,1,1.0,hmm ive putting learning l2s whatnots dont much eth didnt think sharding far away lately ive interested uniswap tokens guess might well lol im sick paying 200 100 worth token,0.09841269841269841,0.6063492063492063,54,0
1681,1619214330.0,2021-04-23 17:45:30,1,6.0,fair lagarde said looking developing digital euro 2021 would take away least 4 years actually developed,0.125,0.4,30,0
1682,1619221124.0,2021-04-23 19:38:44,1,2.0,outdated us start testing july russia right towards fall id say,-0.05714285714285719,0.5845238095238096,16,1
1683,1619224154.0,2021-04-23 20:29:14,0,1.0,yes part ethglobal talk,0.0,0.0,8,0
1684,1619216820.0,2021-04-23 18:27:00,0,1.0,aave curve already migrated polygon quickswap uniswap clone want dabble defi fees 0001 good start move funds bsc polygon already without ever touching l1 eth fees,0.6,0.55,43,1
1686,1619222203.0,2021-04-23 19:56:43,0,2.0,alright thanks look,0.2,0.2,6,1
1687,1619229728.0,2021-04-23 22:02:08,20,0.77,bitcoins market dominance slides 50 ethereums valuation climbs higher,0.25,0.5,11,1
1688,1619229731.0,2021-04-23 22:02:11,0,1.0,hello rcryptocurrency readers please try following links sort comments controversial first click doesnt work mobile potentially find cryptowikis articles subject post click contribute cryptowikis click bot action performed automatically please contact moderators subredditmessagecomposetorcryptocurrency questions concerns,0.12222222222222223,0.4694444444444445,64,1
1689,1619229888.0,2021-04-23 22:04:48,0,2.0,broad shouldered head high eth yells im captain,0.13125,0.42624999999999996,11,0
1691,1619229874.0,2021-04-23 22:04:34,3,2.0,even call ethereum altcoin anymore,0.0,0.0,8,0
1692,1619230241.0,2021-04-23 22:10:41,0,1.0,thats still pretty big chasm close,0.125,0.55,8,0
1693,1619231032.0,2021-04-23 22:23:52,0,1.0,flippening talk get 20 online,0.0,0.0,9,1
1694,1619229872.0,2021-04-23 22:04:32,0,1.0,alt coin szn,0.0,0.0,3,1
1695,1619229918.0,2021-04-23 22:05:18,0,1.0,rubs hands together,0.0,0.0,3,0
1696,1619232348.0,2021-04-23 22:45:48,0,1.0,tldr bitcoin dominance metric measures bitcoins overall market capitalization crypto asset valuations dropped considerably recent weeks end february bitcoin dominance levels started sliding downward 61 50 meanwhile point time ethereum increased 118 145 summary auto generated bot meant replace reading original article always dyor,0.05,0.3,73,0
1697,1619234938.0,2021-04-23 23:28:58,0,1.0,btc eth combined controls 75 crypto market cap eth alt coin anymore,0.0,0.0,18,0
1698,1619229822.0,2021-04-23 22:03:42,1,0.0,alt season bear market,0.0,0.0,6,1
1699,1619240882.0,2021-04-24 01:08:02,0,0.0,making posts every time btc dominance moves 1 also ethereum price climb higher btc eth price dropped,0.25,0.5,25,1
1700,1619231038.0,2021-04-23 22:23:58,0,3.0,alts originally anything wasnt bitcoin sense yes probably goes like btc eth alts shitcoins point,0.375,0.75,24,0
1701,1619230192.0,2021-04-23 22:09:52,0,2.0,ive stopped considering one thats sure,0.5,0.8888888888888888,8,0
1702,1619230998.0,2021-04-23 22:23:18,0,1.0,bitcoin maximalists,0.0,1.0,4,1
1704,1619234061.0,2021-04-23 23:14:21,0,1.0,definitely cool see alts others,0.0972222222222222,0.46944444444444444,9,0
1705,1619259557.0,2021-04-24 06:19:17,16,0.67,something happening iran need help,0.0,0.0,10,1
1706,1619259824.0,2021-04-24 06:23:44,1,7.0,bulls make money bears make money pigs get sl,0.0,0.0,11,1
1707,1619259658.0,2021-04-24 06:20:58,0,2.0,talk sense people trying put live savings line including uncle changing someones opinion takes lot time give real examples people losing money dont listen well theres much sadly,-0.06590909090909092,0.5,55,1
1708,1619260109.0,2021-04-24 06:28:29,0,2.0,getting burnt pretty much rite passage crypto sometimes lesson learned hard way,0.05277777777777778,0.5805555555555556,21,0
1709,1619259951.0,2021-04-24 06:25:51,0,2.0,heard doge friends actually got looking cryptocurrency whole think memecoin overall positive influence crypto people get interested better coins opinion,0.2396103896103896,0.36363636363636365,45,0
1710,1619259931.0,2021-04-24 06:25:31,0,1.0,ramadan mubarak youre observing good know learning crypto iran past usually precursor fiat falling keep stacking,0.24,0.42000000000000004,30,0
1711,1619259995.0,2021-04-24 06:26:35,0,1.0,dont really think good way talk people wan na one stop thing might work telling shouldnt invest products understand lets real barely anyone really understands crypto rather technology behind crypto currencys least stopped investing money crypto also opt something less volatile complicated,-0.0016666666666666718,0.4566666666666667,93,0
1712,1619260133.0,2021-04-24 06:28:53,1,1.0,cant take responsibility everyones finances dont try say think encourage research investments move,0.6,1.0,26,1
1713,1619260269.0,2021-04-24 06:31:09,0,1.0,dont think youre saying true know lot people actually learning analyses research crypto currencies know opinion 90 people statistics crypto investors,0.175,0.375,46,0
1714,1619260332.0,2021-04-24 06:32:12,0,1.0,take curve last big drop cut peak go excited show graph ask much wants invest reveal rest graph let know lost 80 investment talk smart ways inflation creation tokens owns many coins practical value general think smart idea divest crypto especially live country unstable economy invest something solid btc eth ada also warn regulatory risk come sure becomes big enough eat tax revenues especially shady operations like thing turkey still early days conditions create big opportunities also create big risks,0.10199675324675324,0.433938492063492,156,0
1715,1619261238.0,2021-04-24 06:47:18,0,1.0,iran holding doge price try convince uncle atleast spread investments different coinstokens might get burn doge learn lesson dd next time,0.0,0.3,38,1
1716,1619266662.0,2021-04-24 08:17:42,0,1.0,tell put life savings put theyre able willing lose never put everything one basket market like things go things go learn start depending lose going end well loselose situation,0.11736111111111111,0.5097222222222222,66,0
1717,1619282876.0,2021-04-24 12:47:56,0,1.0,would want theyll get burned none would listen either way show market cap calculations much doge would need grow price reach expectations eg fact would require doge big apple google reach 10,0.1,0.15000000000000002,60,1
1718,1619260476.0,2021-04-24 06:34:36,0,0.0,long stay away tokens named safe moon suffixprefix fine,0.2888888888888889,0.4666666666666666,19,0
1719,1619260963.0,2021-04-24 06:42:43,0,0.0,try join rnanocurrency rnanocurrencyforbeginners discover nano lot good cryptocurrency depends want believe imo never decide investment friends find something valuable educate choice invest best luck friends,0.09999999999999998,0.45000000000000007,61,0
1720,1619259893.0,2021-04-24 06:24:53,0,8.0,wall street called want quote back,0.0,0.0,8,1
1721,1619264451.0,2021-04-24 07:40:51,0,1.0,charge 1 fee monthly financial advisor culpability explain fiduciary help navigate entrance offer guidance,0.0,0.0,36,1
1722,1619279212.0,2021-04-24 11:46:52,3,0.5,layer2finance v01 mainnet celer network launches allows use ethereum l1 apps using l2 rollup use aaveaave compound curve l1 l2finance zero fees,0.0,0.0,31,1
1723,1619279212.0,2021-04-24 11:46:52,0,1.0,hello rcryptocurrency readers please try following links sort comments controversial first click doesnt work mobile potentially find cryptowikis articles subject post click contribute cryptowikis click bot action performed automatically please contact moderators subredditmessagecomposetorcryptocurrency questions concerns,0.12222222222222223,0.4694444444444445,64,1
1725,1619281844.0,2021-04-24 12:30:44,0,1.0,tldr layer2finance v01 launched ethereum mainnet first 500 eligible users reimburse ethereum gas costs depositing funds layer1 layer2 first 60 days firstever line defi train open ready passengers summary auto generated bot meant replace reading original article always dyor,0.2375,0.4833333333333333,67,1
1726,1619215942.0,2021-04-23 18:12:22,46,0.89,whats catch staking eth downsides converting eth eth 20 im going hold anyway,0.0,0.0,24,1
1727,1619215943.0,2021-04-23 18:12:23,0,1.0,hello rcryptocurrency readers please try following links sort comments controversial first click doesnt work mobile potentially find cryptowikis articles subject post click contribute cryptowikis click bot action performed automatically please contact moderators subredditmessagecomposetorcryptocurrency questions concerns,0.12222222222222223,0.4694444444444445,64,1
1728,1619216213.0,2021-04-23 18:16:53,0,5.0,kraken allows stake well sites always worth stake plan hold,0.0875,0.2375,22,0
1729,1619217917.0,2021-04-23 18:45:17,0,6.0,stake eth 20 cant unstake get back gets online years might find ways stake eth staked eth 20 got ta wait long time see found something dont know something yet wont recommend something dont fully believe careful research think needed becoming liquidity provider yield farming recommending maybe option look put everything eth 2 safe stake normally,0.165625,0.534375,117,1
1730,1619216141.0,2021-04-23 18:15:41,2,8.0,easiest way would stake binance ya know keys coins definitely worth stake helps system earns apy eth,0.3,0.1,40,0
1731,1619216313.0,2021-04-23 18:18:33,2,3.0,long term stake eth ive problem locking long needed,-0.05,0.4,23,0
1732,1619216725.0,2021-04-23 18:25:25,0,3.0,interested exact question,0.31875,0.45,6,0
1733,1619217041.0,2021-04-23 18:30:41,1,3.0,1 dont keys arent hard wallet sleep better night knowing keys crypto 2 tax implications staking seem like nightmare honest least us,0.2847222222222222,0.7236111111111111,45,1
1734,1619216138.0,2021-04-23 18:15:38,0,2.0,youre going hold sell either way definitely worth,0.3,0.1,15,0
1735,1619216173.0,2021-04-23 18:16:13,0,2.0,bet peeps rethstaker help,0.0,0.0,11,1
1736,1619216136.0,2021-04-23 18:15:36,3,2.0,well catch eth staking 1you need minimum 32 eth 2you locked think 6 months cant take,0.0,0.0,33,1
1737,1619217113.0,2021-04-23 18:31:53,0,1.0,could totally wrong dont follow stuff closely anymore understanding staking risk besides much need long access node staking attempts approve invalid transactions otherwise bad actor network staked coins penalized heres info quick search shouldnt risk using standard software good enough hardware validator job,-0.0018518518518518452,0.5296296296296297,100,0
1738,1619217191.0,2021-04-23 18:33:11,1,1.0,wait rocketpool come decentralized solution tokenized staking dont want use exchange lock eth,0.0,0.0,28,1
1739,1619217627.0,2021-04-23 18:40:27,1,1.0,best way shared stake deposit eth platform remove withdraw time without penalties also get staking rewards governance token never locked waiting transition also liquidity pools veeth2 earn rewards liquidity pools well favorite eth staking platform nothing else compares,0.75,0.65,78,0
1741,1619218263.0,2021-04-23 18:51:03,0,1.0,hodl anyway definitely find platform suits enjoy passive income,0.2,0.5,17,0
1742,1619219570.0,2021-04-23 19:12:50,0,1.0,stake pool locked 20 launches longterm commitment certain endpoint alternatively earn interest holdings cefi defi pull whenever want,-0.10714285714285714,0.5714285714285714,40,1
1743,1619220253.0,2021-04-23 19:24:13,0,1.0,locking anything could happen dont necessarily know youll hold,0.0,1.0,12,1
1744,1619222074.0,2021-04-23 19:54:34,0,1.0,kind realized cant keep dirty hands flexible staked coins trading randomly came across many posts people forgetting coins suddenly theyre worth massive amounts kind gift next bullrun cant unstake cant trade,0.09999999999999999,0.577777777777778,55,0
1745,1619232335.0,2021-04-23 22:45:35,0,1.0,dont stake binance use kraken u 32 truly believe eth start ur node,0.6,1.0,20,1
1746,1619260105.0,2021-04-24 06:28:25,0,1.0,germany tax implications stake idk us,0.0,0.0,13,1
1747,1619280262.0,2021-04-24 12:04:22,0,1.0,side note dont disclose exact values especially stored binance someone social engineer might lose coins safety,0.27666666666666667,0.6633333333333333,34,1
1748,1619216262.0,2021-04-23 18:17:42,1,8.0,stake binance knows itll ultimately play trust pull shady shit dont gave enough eth another way,-0.1125,0.73125,32,0
1749,1619218149.0,2021-04-23 18:49:09,0,1.0,im interested staking wanting put bunch money exchange tough conundrum,-0.06944444444444445,0.6666666666666667,18,1
1750,1619218214.0,2021-04-23 18:50:14,1,2.0,check rethstaker theyre super helpful lots discussion around pool staking options since many 32 eth,0.04166666666666666,0.5833333333333333,20,1
1751,1619218409.0,2021-04-23 18:53:29,1,1.0,understanding stake minimum 32 eth many defi institutions like coinbase binance offering stake less minimum exchange interest,0.23333333333333336,0.6416666666666667,40,0
1752,1619218382.0,2021-04-23 18:53:02,1,3.0,2 tax implications staking seem like nightmare honest least us really bad terms complicated pay basic income tax year received fair market value received eventually whenif sell capital gains profits cost basis would amount already paid tax,-0.04285714285714285,0.5988095238095238,71,1
1753,1619217248.0,2021-04-23 18:34:08,1,6.0,32 eth requirement operate validator stake amount,0.0,0.0,15,0
1754,1619216425.0,2021-04-23 18:20:25,1,2.0,im using coinbase dont need 32,0.0,0.0,9,1
1755,1619217104.0,2021-04-23 18:31:44,0,1.0,like username ulilspoops,0.0,0.0,5,0
1756,1619217372.0,2021-04-23 18:36:12,0,1.0,pretty interesting although worried get exchange eth 20 ill pay high transaction fee oh well probably high staking rewards worth end thanks suggestion ill keep eye,0.27,0.48000000000000004,52,0
1757,1619217769.0,2021-04-23 18:42:49,1,1.0,wouldnt depositing eth platform means dont keys hence coins eth staking require sending coins 3rd party pool,0.3,0.5,25,0
1758,1619217046.0,2021-04-23 18:30:46,1,1.0,im shoes stake convert beth wrapped vversion eth 20 ive heard convert 105 ratio sure recommended said dont 32 eth spare lol,0.275,0.7944444444444444,48,1
1759,1619218937.0,2021-04-23 19:02:17,0,1.0,perfect ill head research thank,1.0,1.0,10,1
1760,1619218902.0,2021-04-23 19:01:42,0,4.0,well coinbase binance centralized get lol get mean,0.24375000000000002,0.69375,17,0
1761,1619218558.0,2021-04-23 18:55:58,1,2.0,im assuming staking platforms documents prepared end year,0.5,0.5,16,0
1762,1619254914.0,2021-04-24 05:01:54,0,1.0,validator staking platforms usually apy,-0.1875,0.3125,12,1
1763,1619216835.0,2021-04-23 18:27:15,1,2.0,im still waiting list switched voyagers 5 interest,0.0,0.0,13,0
1764,1619217864.0,2021-04-23 18:44:24,0,0.0,thats question seems quite shady tbh,-0.25,0.625,8,0
1765,1619217183.0,2021-04-23 18:33:03,0,2.0,think beth lot volatile suspect binance make favourable conversion rate figure staking return offsets quite bit im selling,0.5,0.5,40,0
1766,1619218922.0,2021-04-23 19:02:02,1,2.0,dont tax programs apparently scrape transactions andor utilize csv file parse platform doesnt personally im keeping track spreadsheet manually sounds worse back solution give idea much ill need pay tax goal reasonably accurate possible im making quite bit surprisingly month due staking itll bit tax expecting definitely worth im planning 35 tax safe,0.17708333333333334,0.4215277777777778,110,1
1767,1619231638.0,2021-04-23 22:33:58,0,1.0,took around 56 hrs signed waitlist,0.0,0.0,10,0
1768,1619219152.0,2021-04-23 19:05:52,0,2.0,yeah last smart im sure isnt complicated honestly interest work im happy dcaing hodling without worrying anything else know im missing profit im good,0.2723214285714286,0.6676587301587302,42,0
1769,1619242119.0,2021-04-24 01:28:39,25,0.7,ethereum classic well,0.16666666666666666,0.16666666666666666,7,0
1770,1619242120.0,2021-04-24 01:28:40,0,1.0,hello rcryptocurrency readers please try following links sort comments controversial first click doesnt work mobile potentially find cryptowikis articles subject post click contribute cryptowikis click bot action performed automatically please contact moderators subredditmessagecomposetorcryptocurrency questions concerns,0.12222222222222223,0.4694444444444445,64,1
1771,1619243386.0,2021-04-24 01:49:46,0,11.0,like 1 6 coins available robinhood,0.4,0.4,10,0
1772,1619242400.0,2021-04-24 01:33:20,1,8.0,maybe new people cryptoverse confusing ethereum seeing sort bargain,-0.08181818181818182,0.42727272727272725,19,1
1773,1619242303.0,2021-04-24 01:31:43,0,13.0,random altcoins tend better bitcoin theres huge demand gains bitcoin ethereums ships already left speak new investors go scrounging next big thing especially helps familiar name like bitcoin cash ethereum classic low price fools inexperienced investors buying thus pumping,0.08150252525252526,0.4184343434343434,67,1
1774,1619247377.0,2021-04-24 02:56:17,0,4.0,robinhood noobs see ethereum super cheap buy,0.3666666666666667,0.6833333333333333,14,0
1775,1619242467.0,2021-04-24 01:34:27,0,4.0,would rich knew answer question,0.375,0.75,13,1
1776,1619243875.0,2021-04-24 01:57:55,0,4.0,newbies think cheaper ethereum,0.0,0.0,6,0
