,UTC,Post Date,Number of Comments,Upvote Ratio,Text,polarity,subjectivity,word_count,is_spam
686,1619312743.0,2021-04-24 21:05:43,0,1.0,perhaps efficient proof thumb war needed less waste get security issuesand scalability,0.04444444444444445,0.18888888888888888,21,0
687,1619311803.0,2021-04-24 20:50:03,0,1.0,true miners got ta make cut verify transfer another major drawback,0.25875,0.6725000000000001,15,1
688,1619309776.0,2021-04-24 20:16:16,23,0.91,sec commissioner banning bitcoin difficult ban peertopeer technology,-0.375,0.8,12,0
689,1619309776.0,2021-04-24 20:16:16,0,1.0,hello rcryptocurrency readers please try following links sort comments controversial first click doesnt work mobile potentially find cryptowikis articles subject post click contribute cryptowikis click bot action performed automatically please contact moderators subredditmessagecomposetorcryptocurrency questions concerns,0.12222222222222223,0.4694444444444445,64,1
690,1619309808.0,2021-04-24 20:16:48,1,7.0,hes wrong,0.25,0.9,3,0
691,1619309818.0,2021-04-24 20:16:58,0,7.0,something tells thats exactly satoshi designed way,0.25,0.25,13,0
692,1619310037.0,2021-04-24 20:20:37,1,7.0,plot twist sec commissioner holdr,-0.1,0.6,7,0
693,1619309844.0,2021-04-24 20:17:24,1,3.0,difficult damnit trying,-0.8125,1.0,7,1
694,1619310075.0,2021-04-24 20:21:15,0,2.0,well try damndest anyway,0.0,0.0,6,0
696,1619310532.0,2021-04-24 20:28:52,0,1.0,youre goddamn right,0.3571428571428571,0.5357142857142857,3,0
697,1619310766.0,2021-04-24 20:32:46,0,1.0,ive listened gary genslers mit masterclass love hate guy great grasp block chain technology expect interesting things sec helm,0.18,0.67,35,0
698,1619310907.0,2021-04-24 20:35:07,0,1.0,generally speaking crypto always attack large governments less attack expected,-0.0005952380952380931,0.3488095238095238,19,0
699,1619310995.0,2021-04-24 20:36:35,0,1.0,thats right dont try anything funny,0.30357142857142855,0.7678571428571428,6,0
700,1619311358.0,2021-04-24 20:42:38,0,1.0,yeah go break peoples homes unplug computer thats way stop bitcoin,0.0,1.0,18,0
701,1619311698.0,2021-04-24 20:48:18,0,1.0,turkey india south korea,0.0,0.0,4,0
702,1619311737.0,2021-04-24 20:48:57,0,1.0,good goodmuahahhhhh,0.44999999999999996,0.45000000000000007,3,0
703,1619312285.0,2021-04-24 20:58:05,0,1.0,difficult think means impossible imagine trying ban handing physical cash someone else,-0.4388888888888889,0.7142857142857143,21,0
704,1619312596.0,2021-04-24 21:03:16,0,1.0,tldr hester peirce commissioner us securities exchange commission sec believes us government ban bitcoin difficult ban something thats essentially peertopeer technology said sec also new chairman gary gensler deep knowledge cryptocurrencies summary auto generated bot meant replace reading original article always dyor,-0.04837662337662337,0.5863636363636363,70,1
705,1619313889.0,2021-04-24 21:24:49,0,1.0,sec trying hard,-0.19583333333333336,0.5708333333333333,5,1
706,1619310492.0,2021-04-24 20:28:12,0,0.0,turkey entered chat,0.0,0.0,5,1
707,1619313875.0,2021-04-24 21:24:35,0,1.0,hester pearce aka crypto mom woman,0.0,0.0,8,0
708,1619312132.0,2021-04-24 20:55:32,0,1.0,already started dca dips,0.0,0.0,8,1
709,1619310158.0,2021-04-24 20:22:38,0,3.0,like boss making know dumb,0.0625,0.5,14,1
710,1619311246.0,2021-04-24 20:40:46,0,1.0,isnt always country permits theres way stop people visiting sites wish would ban cexs though dexs future cexs irrelevant eventually,-0.25,0.5625,39,0
711,1619293391.0,2021-04-24 15:43:11,22,1.0,louisiana state house heaps praise bitcoin dubs btc alternative gold,0.0,0.0,13,0
712,1619293392.0,2021-04-24 15:43:12,0,1.0,hello rcryptocurrency readers please try following links sort comments controversial first click doesnt work mobile potentially find cryptowikis articles subject post click contribute cryptowikis click bot action performed automatically please contact moderators subredditmessagecomposetorcryptocurrency questions concerns,0.12222222222222223,0.4694444444444445,64,1
713,1619293725.0,2021-04-24 15:48:45,1,7.0,ya baby btc life actually better gold since capped 21m,0.5,0.5,15,0
714,1619294138.0,2021-04-24 15:55:38,2,7.0,im proud home state,0.8,1.0,8,1
715,1619293704.0,2021-04-24 15:48:24,1,4.0,love see states municipalities admitting bitcoins legitimacy,0.5,0.6,9,0
716,1619293854.0,2021-04-24 15:50:54,0,4.0,commend bitcoin success becoming first decentralized trilliondollar asset encourage state local governments consider ways could help benefit increased use new technology louisiana document heaps praise btc describing several details including rising rate adoption decentralized nature usage notably resolution also dubbed bitcoin alternative gold love see,0.23737373737373735,0.35976430976430973,79,1
717,1619293523.0,2021-04-24 15:45:23,1,2.0,guess got new favourite state,0.13636363636363635,0.45454545454545453,7,1
718,1619294036.0,2021-04-24 15:53:56,1,2.0,needs bitcoin float mardi gras,0.0,0.0,10,1
719,1619294108.0,2021-04-24 15:55:08,0,2.0,im paying next crawfish boil btc everyones welcome,0.5,0.45,11,1
720,1619294884.0,2021-04-24 16:08:04,0,2.0,believe heap praise onto louisiana state house recognizing,0.0,0.5,14,1
721,1619294989.0,2021-04-24 16:09:49,0,2.0,im glad didnt call alternative money something alternative gold exactly,0.375,0.625,21,1
722,1619298937.0,2021-04-24 17:15:37,0,1.0,tldr governing body state louisiana us recently gave major shoutout bitcoins success new resolution resolution also commended accomplishments contributions satoshi nakamoto pseudonymous creator bitcoin notably resolution also dubbed bitcoin alternative gold summary auto generated bot meant replace reading original article always dyor,0.22897727272727272,0.4090909090909091,69,1
723,1619303362.0,2021-04-24 18:29:22,0,1.0,bienvenuewelcome sign like middle louisiana far alexandria ive always wondered one,0.05,0.5,24,0
724,1619293937.0,2021-04-24 15:52:17,0,4.0,love energy,0.625,0.6,3,0
725,1619295191.0,2021-04-24 16:13:11,0,5.0,wish could proud country,0.8,1.0,10,1
726,1619299547.0,2021-04-24 17:25:47,0,1.0,must say breathtaking nature thats something proud,0.8333333333333334,0.8333333333333334,15,0
727,1619295687.0,2021-04-24 16:21:27,0,1.0,new york could join crypto train feel awful new york residents hoops jump crypto,-0.18181818181818182,0.7272727272727273,28,1
728,1619303438.0,2021-04-24 18:30:38,0,1.0,come crypto stay seafood boudin,0.0,0.0,10,0
729,1619303510.0,2021-04-24 18:31:50,1,2.0,actually great idea think ill pass yellow certificates redeemable banano next year banano beads,0.26666666666666666,0.25,20,0
730,1619303792.0,2021-04-24 18:36:32,1,2.0,know would little pricey order customer mardi gras doubloons,-0.1875,0.5,16,1
731,1619304016.0,2021-04-24 18:40:16,1,2.0,oh know ive done various parties walking krewes im actually going look disclaimer im suggesting banano investment anything like like foldinghome project think would fun way get people interested crypto fun,0.17,0.3,58,1
732,1619306732.0,2021-04-24 19:25:32,1,2.0,totally agree great idea use feeless coin crypto promotion,0.5,0.75,15,0
733,1619306886.0,2021-04-24 19:28:06,0,2.0,would especially good krewe du vieux next year tends toward phallic themes loves mocking louisiana politics im imagining krewe du vieux float something like louisiana legislature bullish bitcoin banana like strap rather surprised looking bull,0.3666666666666667,0.6333333333333333,48,0
734,1619312017.0,2021-04-24 20:53:37,20,0.86,hope bitcoin keeps resisting 50000,0.0,0.0,6,0
735,1619312020.0,2021-04-24 20:53:40,0,1.0,hello rcryptocurrency readers please try following links sort comments controversial first click doesnt work mobile potentially find cryptowikis articles subject post click contribute cryptowikis click bot action performed automatically please contact moderators subredditmessagecomposetorcryptocurrency questions concerns,0.12222222222222223,0.4694444444444445,64,1
736,1619312182.0,2021-04-24 20:56:22,0,7.0,truly believe 42069 stronger psycological barrier,0.0,0.0,9,0
737,1619312239.0,2021-04-24 20:57:19,0,4.0,wouldnt ppl especially sidelines waiting btc cheaper hope bigger dip rebounding ath,0.0,0.75,24,1
738,1619312527.0,2021-04-24 21:02:07,1,3.0,25bn usd added market institutions recently thats biggest jump since elon musk shill 35bn february thats good sign almost bottom ask bullish,0.36999999999999994,0.4433333333333334,43,0
739,1619313328.0,2021-04-24 21:15:28,1,3.0,march50k btc shit gon na rich april 50k btc shit bear comming,0.022916666666666658,0.7833333333333333,17,0
740,1619312664.0,2021-04-24 21:04:24,0,2.0,start bear market would show reduction cycle peaks suspect itll headed higher one really knows,0.225,0.35,28,1
741,1619312092.0,2021-04-24 20:54:52,0,1.0,wild think sub 50k btc bear market,0.1,0.4,12,1
742,1619312127.0,2021-04-24 20:55:27,2,1.0,wouldnt welcome deeper bear chance buy cheap know wish bought cheap,0.525,0.7,24,1
743,1619312379.0,2021-04-24 20:59:39,0,1.0,50k floor would amazing even 40k floor would absolutely amazing,0.6000000000000001,0.9,14,0
744,1619312918.0,2021-04-24 21:08:38,0,1.0,guess sideways movement next weeks altcoins pump,-0.1,0.05,15,0
745,1619313130.0,2021-04-24 21:12:10,0,1.0,think 43k trouble start im worried yet personally,-0.1,0.25,13,1
746,1619313908.0,2021-04-24 21:25:08,0,1.0,going 57,0.0,0.0,5,0
747,1619312770.0,2021-04-24 21:06:10,2,0.0,really worries zoom see daily trend shouldnt touched 50k floor orden keep bullish trend dont growth 52k tomorrow fuced least months,-0.06,0.16,45,0
749,1619312255.0,2021-04-24 20:57:35,1,1.0,really took 3 years recover money profit held market crash nobody told could make money selling start bearish market rebuying later holding years,0.13333333333333333,0.2333333333333333,45,1
750,1619312211.0,2021-04-24 20:56:51,0,1.0,people get scared drops others get excited sale,0.375,0.75,13,1
751,1619312979.0,2021-04-24 21:09:39,0,2.0,wish fucked im hurry would rather pile money get 280k next year reach 90k next month crash 3years wants party end anyway,-0.09999999999999999,0.19999999999999998,39,0
752,1619313061.0,2021-04-24 21:11:01,0,1.0,thoughts tho could trade 50k month ups downs keep hodling,0.5,0.5,22,1
753,1619312715.0,2021-04-24 21:05:15,1,4.0,people comfortable timing market usually start liquidating expect bear market personally im smooth brained approach market timing day trading volatility lol confident dip probably bad idea sell portion bitcoin buy back youre wrong lose potential revenue went easy people lose money trying say leave advanced stuff professionals lol,0.21222222222222223,0.6388888888888888,97,1
754,1619312996.0,2021-04-24 21:09:56,0,1.0,yeah lost lot potential profits trying time market last 2 months lucky sold dip buy makes lost end greed thats whats institutions betting retail traders going buy dip people say dips followed another another another dip got stucked coins growth,0.1111111111111111,0.6333333333333333,87,0
755,1619301752.0,2021-04-24 18:02:32,21,0.84,think good time get back going btc w strong resistance signs,0.37777777777777777,0.4444444444444445,16,0
756,1619301752.0,2021-04-24 18:02:32,0,1.0,hello rcryptocurrency readers please try following links sort comments controversial first click doesnt work mobile potentially find cryptowikis articles subject post click contribute cryptowikis click bot action performed automatically please contact moderators subredditmessagecomposetorcryptocurrency questions concerns,0.12222222222222223,0.4694444444444445,64,1
757,1619302798.0,2021-04-24 18:19:58,1,13.0,sir spelt support wrong agree sentiment bought 49k another limit order set 49k,-0.5,0.9,22,1
758,1619301887.0,2021-04-24 18:04:47,0,8.0,gave timing market long time ago dca way unless youre absolutely 1000 really really sure got edge buying selling specific point time said yeah ready takeoff soon,0.17,0.5627777777777778,47,0
759,1619302091.0,2021-04-24 18:08:11,2,7.0,basically buy,0.0,0.0,3,0
760,1619303546.0,2021-04-24 18:32:26,0,3.0,bears come night looks good 15am different beast,0.35,0.6000000000000001,15,0
761,1619301930.0,2021-04-24 18:05:30,0,3.0,absolutely right sir dip isnt obstacle way next pump cause next pump lower go people buy people buy higher price slingshot,0.25595238095238093,0.33928571428571425,42,1
762,1619302278.0,2021-04-24 18:11:18,0,2.0,think meant say support resistance boundary upside im dca nothing ever happened hodl ups downs gifgiphymos8nxxidp513vxfw6,0.0,0.0,28,0
763,1619302292.0,2021-04-24 18:11:32,0,2.0,lets hope etch start dcaing profits,0.0,0.0,12,1
764,1619304531.0,2021-04-24 18:48:51,0,2.0,nice see 49k floor,0.6,1.0,6,0
765,1619311868.0,2021-04-24 20:51:08,1,2.0,gut tells bull run im bored senseless crypto im trimming stash small amount case moons coming alts btc nailing crooked pieces wood door getting imaginary wife fed cakes n pastry nice n plump like survive winter enough meat able satisfy desires snow melts trimmed eager lady btc looks inviting wish good luck hope im wrong,0.04382716049382715,0.6015432098765433,100,0
766,1619301866.0,2021-04-24 18:04:26,0,2.0,dream guy didnt know driving outer space like honda dont know means anything might good luck,0.7,0.6000000000000001,32,1
767,1619304213.0,2021-04-24 18:43:33,1,1.0,would better put 250 bitcoin ethereum right,0.39285714285714285,0.5178571428571428,13,1
768,1619304283.0,2021-04-24 18:44:43,1,-2.0,btc reach id rather put money exotic alts,0.5,1.0,15,1
769,1619303049.0,2021-04-24 18:24:09,1,1.0,thanks man still fighting language barrier,0.25,0.2,7,0
770,1619302998.0,2021-04-24 18:23:18,1,1.0,thats hour ago seems like moving averages hold support repeat history start second part run,0.0,0.0,26,0
771,1619304570.0,2021-04-24 18:49:30,0,1.0,never,0.0,0.0,4,0
772,1619312543.0,2021-04-24 21:02:23,0,1.0,gut says although wish wrong many people saying buy doesnt feel right,0.07142857142857142,0.5151785714285714,25,0
773,1619307537.0,2021-04-24 19:38:57,0,4.0,personally think eth increase higher percentage past year financial advice,0.0,0.2625,21,0
774,1619308735.0,2021-04-24 19:58:55,0,2.0,yea like 50k 1 coin cant afford shit better buy one cent coin read frontpage,0.15,0.65,23,0
775,1619303909.0,2021-04-24 18:38:29,0,1.0,struggles real win,0.5,0.29375,10,1
776,1619303073.0,2021-04-24 18:24:33,0,1.0,surely start rising alot next week think,0.3333333333333333,0.46296296296296297,11,0
777,1619283638.0,2021-04-24 13:00:38,103,0.92,anyone exclude bitcoin portfolio discussion,0.0,0.0,8,1
778,1619283642.0,2021-04-24 13:00:42,0,1.0,hello rcryptocurrency readers please try following links sort comments controversial first click doesnt work mobile potentially find cryptowikis articles subject post click contribute cryptowikis click bot action performed automatically please contact moderators subredditmessagecomposetorcryptocurrency questions concerns,0.12222222222222223,0.4694444444444445,64,1
779,1619284213.0,2021-04-24 13:10:13,2,25.0,btcs like 5 portfolio mainly eth ada,0.08333333333333333,0.6666666666666666,11,0
780,1619285029.0,2021-04-24 13:23:49,2,16.0,pirate unless pirate ship btc must even tiny bit dust,0.0,0.75,23,0
781,1619284898.0,2021-04-24 13:21:38,1,10.0,nope try exclude alt coins bitcoin 95,0.0,0.0,10,1
782,1619283724.0,2021-04-24 13:02:04,1,6.0,im risky people like,0.0,0.0,12,1
783,1619284342.0,2021-04-24 13:12:22,1,5.0,eth maxis understandable people ive seen interest btc ones chasing 10000x shortterm gains consider btcand eth slow,0.2333333333333333,0.4666666666666666,33,1
784,1619283753.0,2021-04-24 13:02:33,5,18.0,btc 0 eth rarer sub believe polls,0.0,0.0,18,1
785,1619283788.0,2021-04-24 13:03:08,3,10.0,im 50 btc 50 eth 50 alts,0.0,0.0,7,1
786,1619284018.0,2021-04-24 13:06:58,0,4.0,always keep bitcoins wallet huge sum make huge profits owning bitcoin like owning something feel good,0.5,0.8000000000000002,34,1
787,1619289555.0,2021-04-24 14:39:15,1,3.0,anyone whos around space years likely owns btc think common newcomers zero btc believe missed chance early bitcoin think could still early smaller market cap project especially looking moonshot,0.08888888888888888,0.5777777777777777,56,0
788,1619285532.0,2021-04-24 13:32:12,0,10.0,idea stack many sats profit made alts converted back btc truly believe btc gold next generation wan na much also good store value thats reach pesky politicians,0.27999999999999997,0.26,64,0
789,1619283737.0,2021-04-24 13:02:17,3,16.0,dont btc mine invest coins future tech bitcoin things imo simply first surviving legacy alone instead portfolio 50 eth,0.08333333333333333,0.2718253968253968,50,0
790,1619284131.0,2021-04-24 13:08:51,0,3.0,btc isnt big part portfolio anymore place taken eth 2020,0.0,0.1,17,0
791,1619284271.0,2021-04-24 13:11:11,0,3.0,simply dont havent gotten around buy eth tho,0.0,0.35714285714285715,18,0
792,1619284672.0,2021-04-24 13:17:52,0,3.0,dont btc,0.0,0.0,4,1
793,1619288177.0,2021-04-24 14:16:17,1,3.0,wrote post 2017 shit search profile wish stayed 100 btc man oh god,-0.1,0.4625,25,0
794,1619288726.0,2021-04-24 14:25:26,0,3.0,zero btc eth alts im great,0.8,0.75,12,0
795,1619284141.0,2021-04-24 13:09:01,0,7.0,cant exclude btc im older people need money back next 56 years hopefully retire early past several months seen whales institutions putting huge amounts money btc pulling exchanges reason continue make btc 1 holding sure thing crypto space decades invest would likely smaller btc op suggests,0.15972222222222224,0.4310185185185185,89,1
796,1619285211.0,2021-04-24 13:26:51,0,2.0,2017 bull market seems bitcoin least affected crypto 2018 bear market mean lost 90 value bear 20202021 bull market bitcoin tripled former ath 201720k lot altcoins ath 2017 still 1550 value today basically btc way minimize risk may turn wrong im still buying btc,-0.278125,0.49687499999999996,86,0
797,1619289244.0,2021-04-24 14:34:04,0,2.0,im mainly btc eth little algo ada im staking theyre two big dogs space dont need fastest growing coin want coins around decade coin grows faster btc long run thats cool end million bucks someone investing amount nonbtc 2 million im happy im still millionaire,0.11927083333333333,0.4354166666666666,80,0
798,1619297048.0,2021-04-24 16:44:08,0,2.0,btc 10x long run people holding btc,0.225,0.45,18,0
799,1619289373.0,2021-04-24 14:36:13,0,3.0,hold xrp ada vet xlm,0.0,0.0,7,1
800,1619284244.0,2021-04-24 13:10:44,1,6.0,exclude btc portfolio real tech value itand really bad planet buy invest cryptos believe real use case,-0.18124999999999997,0.4104166666666667,36,1
801,1619283712.0,2021-04-24 13:01:52,0,2.0,got ta help flippening along somehow,0.0,0.0,7,1
802,1619284387.0,2021-04-24 13:13:07,1,1.0,dont btc mine im looking aggressive gains bigger upside think happen solid altcoins,0.16666666666666666,0.3666666666666667,25,0
803,1619284820.0,2021-04-24 13:20:20,0,1.0,yolo move ask dont balls,0.0,0.0,15,0
804,1619287033.0,2021-04-24 13:57:13,0,1.0,im super new space opinions penny dozen actually hold btc eth currently plan accumulate altcoins dips bull market dca positions toward end year probably 70 august november use earnings reinvest bear market comes around reasoning starting way take bit risk higher potential gains throughout bull cycle think fairly undeniable btc safest hedge inflation store value im really looking profit much possible bull run bear market comes back town im gon na dcaing back bullish alts ada vet bnb eth alongside btc id like eventually 25 crypto portfolio problem strategy giant f dont see normal 4 year cycle repeat see btc hit something like 150k end year drop 7090 following months strategy could make difficult grab back positions however always dips history tends rhyme feels like safest strategy,0.1244829244829245,0.4695286195286195,245,1
805,1619296609.0,2021-04-24 16:36:49,1,1.0,hold basically btc inefficient shitcoin barely pumps anymore huge mcap lot good coins neo xmr nano eth avax etc,0.25625,0.49375,30,0
806,1619284338.0,2021-04-24 13:12:18,0,1.0,moved lot btc coins used thing besides eth ive seen potential elsewhere,0.21875,0.59375,30,0
808,1619287110.0,2021-04-24 13:58:30,0,1.0,dont trade frequently tend hold got early enough btc portfolio maybe ill change mind later right think ive bought last btc future accumulation likely eth ada im bearish enough btc want sell btc 100k 200k likely next years eth 10x certanly possible though fix scaling issues,0.08571428571428572,0.4284920634920635,86,1
809,1619291758.0,2021-04-24 15:15:58,0,1.0,btc nothing tho hope believe ny coins pop even tho know btc appreciate eventually buy edit ada eth little coins,-0.14583333333333334,0.4166666666666667,38,1
810,1619295203.0,2021-04-24 16:13:23,0,1.0,dont like fact btc uses pow fact institutions buying btc feels like becoming thing set dont anymore altruistic sense opposed financial sense,0.31666666666666665,0.45,48,0
811,1619295491.0,2021-04-24 16:18:11,0,1.0,mainly btc definitely dozens smaller alt bags youre new realize many alts dropped high 90s previous ath last bear market alts uniquenoteworthy use cases many go zero close dont time em right youre gon na left holding bag,0.14382526564344744,0.3724478551751279,62,0
812,1619295535.0,2021-04-24 16:18:55,0,1.0,btc money put see bigger profits coins willing risk bit bigger profit,0.125,0.525,33,0
813,1619298563.0,2021-04-24 17:09:23,0,1.0,99 btc 1 shitcoins,0.0,0.0,4,1
814,1619301515.0,2021-04-24 17:58:35,0,1.0,5 btc consider btc safe investment also one gains value slowly college thus small portfolio much willing take risks older people therefore mainly invested alt coins made good choices currently betting 20m mcap coin really believe lose investments wouldnt hurt therefore willing risk trying get life changing money portfolio becomes big enough need preserve start accumulating btc way know keep growing without risk involved alt coins,0.16794871794871793,0.44358974358974357,121,1
815,1619304681.0,2021-04-24 18:51:21,0,1.0,last cycle btc made small profit sold time ive done research prefer buy tech believe whilst think btc still around long term functional feels dated dont hold hopefully one day soon market stops following btc focuses practical solutions,0.11666666666666665,0.3277777777777778,69,0
816,1619311130.0,2021-04-24 20:38:50,0,1.0,100 btc column spreadsheet 15 difference actual portfolio value 15 worth stress literally keeping track many things shitcoins,0.26666666666666666,0.2333333333333333,34,1
817,1619313353.0,2021-04-24 21:15:53,0,1.0,hold zero environmental impact,0.0,0.0,8,0
818,1619283860.0,2021-04-24 13:04:20,0,-6.0,dont btc eth 100 stormx gon na explode soon,0.0,0.0,13,1
820,1619311369.0,2021-04-24 20:42:49,0,2.0,add algo vet portfolio,0.0,0.0,10,1
821,1619285401.0,2021-04-24 13:30:01,1,5.0,last sentence rhymed spoke,0.0,0.06666666666666667,8,0
823,1619286042.0,2021-04-24 13:40:42,1,2.0,position seems even rarer considering sub favorite alts,0.15,0.55,15,0
824,1619284463.0,2021-04-24 13:14:23,1,2.0,would mind sharing rationale believe risky btc,0.0,0.0,16,1
825,1619285261.0,2021-04-24 13:27:41,1,2.0,im actually opposite short term btc may fine see wild growth new investors enter long term feels like investing blackberry,0.08614718614718615,0.30779220779220784,31,1
826,1619284000.0,2021-04-24 13:06:40,2,9.0,actually sound pretty rare mind sharing rationale behind,0.10999999999999999,0.6199999999999999,14,0
827,1619284034.0,2021-04-24 13:07:14,0,2.0,yes ive seen find strange though illogical,-0.05,0.15,12,0
828,1619292420.0,2021-04-24 15:27:00,0,2.0,eth 0 btc,0.0,0.0,6,1
829,1619286556.0,2021-04-24 13:49:16,0,1.0,ofc rare hate boner btc sub crazy,-0.3666666666666667,0.9,13,1
830,1619284991.0,2021-04-24 13:23:11,0,1.0,im sure thing quick 10x alt,0.11111111111111112,0.5046296296296297,14,0
831,1619284161.0,2021-04-24 13:09:21,3,25.0,personally 100 btc 100 eth 100 alts,0.0,0.3,9,1
832,1619284187.0,2021-04-24 13:09:47,1,6.0,math equates grandfather saying pie squared cornbread round would see homework school,-0.2,0.4,24,0
833,1619283970.0,2021-04-24 13:06:10,0,1.0,wow ive wrong lol,0.13333333333333333,0.8666666666666666,7,0
834,1619307194.0,2021-04-24 19:33:14,0,1.0,ive crypto years recently sold btc large cap alts eth,0.07142857142857142,0.26785714285714285,24,0
835,1619283938.0,2021-04-24 13:05:38,1,4.0,youre minority someone posted graph data coins members holding eth percentage bigger btc,0.0,0.5,24,0
836,1619283790.0,2021-04-24 13:03:10,1,2.0,mean cant see 5000 gains btc lol,-0.3125,0.6875,11,1
837,1619283831.0,2021-04-24 13:03:51,1,1.0,ive thinking lot recently kind feel way thing really going legacy mean og terms tech kind old school,0.1484375,0.5328125,40,0
838,1619297014.0,2021-04-24 16:43:34,0,1.0,true hodlers know,0.35,0.65,5,1
839,1619284637.0,2021-04-24 13:17:17,1,2.0,yes feel like anyone would propose btc move greener consensus mech would met fierce resistance current mining farms incredible amounts money invested,0.45,0.65,34,1
840,1619284858.0,2021-04-24 13:20:58,1,3.0,starting come mindset would mind sharing alts believe solid think eth sure im super bullish neo terms aggressive future gains,0.16666666666666666,0.3761111111111111,34,0
841,1619296906.0,2021-04-24 16:41:46,0,1.0,portfolio literally neo eth xmr nano btc shitcoins,-0.1625,0.2375,14,0
842,1619284772.0,2021-04-24 13:19:32,0,1.0,dont think itll perform well coins doesnt much use,0.037500000000000006,0.2875,20,0
843,1619285446.0,2021-04-24 13:30:46,1,4.0,didnt even notice rhymed hit submit like whoaaa,0.0,0.0,14,0
844,1619286384.0,2021-04-24 13:46:24,0,1.0,use 5 alts albeit short term still always end moving bitcoin right 5 split ada eth along side scammy coins hope 5x soon lol,0.24017857142857144,0.47767857142857145,42,0
845,1619284680.0,2021-04-24 13:18:00,0,4.0,suppose risky might wrong word mean bitcoin moves alts follow least thats history shows first mover portfolio give advantage ways like bitcoin regardless,-0.2,0.5802083333333333,49,1
846,1619294177.0,2021-04-24 15:56:17,0,3.0,feeling exactly also energy usage issue,0.125,0.1875,13,0
