,UTC,Post Date,Number of Comments,Upvote Ratio,Text,polarity,subjectivity,word_count,is_spam
2614,1619097654.0,2021-04-22 09:20:54,0,0.0,dca fronted cash weeks payday bought eth last week felt bones price going continue upwards might still buy today thats show biz baby,0.3333333333333333,0.35555555555555557,42,0
2616,1619109974.0,2021-04-22 12:46:14,0,1.0,dca best thing happen,1.0,0.3,9,0
2617,1619110375.0,2021-04-22 12:52:55,0,1.0,dca,0.0,0.0,3,1
2618,1619112895.0,2021-04-22 13:34:55,0,1.0,def dcad 2k much shit going stonk market atm crypto almost seems safer,-0.2,0.8,20,0
2619,1619114353.0,2021-04-22 13:59:13,0,1.0,yeah dealing btc buy little bit every month hope pans far,-0.03125,0.75,25,0
2620,1619119895.0,2021-04-22 15:31:35,0,1.0,dca always good strategy regardless price believe investment,0.7,0.6000000000000001,18,0
2621,1619120987.0,2021-04-22 15:49:47,0,1.0,yup went 800 euros waiting dip around 800 euros obviously never came,0.0,0.24166666666666667,24,0
2622,1619138842.0,2021-04-22 20:47:22,0,1.0,keep dcaing buying whenever got ta accumulate,0.5,0.75,12,0
2623,1619145610.0,2021-04-22 22:40:10,0,1.0,whole point dcaing agnostic price movements otherwise trying time market doesnt work 9969 people,0.2,0.4,28,1
2625,1619097771.0,2021-04-22 09:22:51,1,80.0,comment looking market based approach price movement happens posted arent posts comments like,0.5,0.5,31,1
2626,1619101770.0,2021-04-22 10:29:30,1,27.0,longshort ratio moved shorts market goes little bit get liquidated thus market goes nice,0.3825,0.6,28,0
2627,1619109222.0,2021-04-22 12:33:42,3,9.0,yeah brother totally agree dumdums eli5 im totally crypto savvy bruv,0.0,0.75,22,0
2628,1619102364.0,2021-04-22 10:39:24,0,8.0,good information thank,0.85,0.8,5,1
2630,1619104776.0,2021-04-22 11:19:36,0,2.0,funding fine across board well matter time degenerate leveraged top longers join party though,0.3055555555555556,0.6666666666666666,23,0
2631,1619112927.0,2021-04-22 13:35:27,0,2.0,getting info open longs shorts futures market ive trying find good source dont really know accurate sites ive found relation market whole ive seen datamish bybt blockchainwhispers really clear whether represent single exchanges aggregates entire market,0.17232142857142857,0.44449404761904765,66,1
2632,1619106108.0,2021-04-22 11:41:48,0,1.0,thanks explanation friend moons,0.25,0.2,8,1
2633,1619107431.0,2021-04-22 12:03:51,1,1.0,question im admittedly someone interested believes crypt small amount invested lacks background knowledge time truly understand inner workings question tokens projects exist ethereum network raise floor ethereum value words value drop far large amount activity relies,0.02704081632653061,0.552891156462585,76,0
2634,1619110445.0,2021-04-22 12:54:05,0,1.0,raw mountains cash yes please,0.0,0.0,6,1
2635,1619112923.0,2021-04-22 13:35:23,0,1.0,buyers also people need eth mint nft buy uniswap etc,0.0,0.0,16,1
2636,1619117901.0,2021-04-22 14:58:21,0,1.0,explain know leveraged longs detail please dont understand know longshort ratio,0.5,0.5,28,1
2637,1619148663.0,2021-04-22 23:31:03,0,2.0,checked ethereum wallet since pump,0.0,0.0,10,0
2638,1619109368.0,2021-04-22 12:36:08,1,14.0,hope doesnt hit 100k mark payday,0.0,0.0,10,1
2639,1619109542.0,2021-04-22 12:39:02,1,2.0,3k end today plz,0.0,0.0,6,0
2640,1619122126.0,2021-04-22 16:08:46,0,2.0,10k september layer 2 multiple mainstream apps think underestimating amount people eth cant afford actually use,0.19999999999999998,0.3666666666666667,32,0
2641,1619122539.0,2021-04-22 16:15:39,0,1.0,month soon moon,0.0,0.0,10,1
2642,1619097320.0,2021-04-22 09:15:20,2,28.0,many coins etherwum blockchain going follow hype,0.25,0.3125,14,1
2643,1619105429.0,2021-04-22 11:30:29,0,20.0,friends dad told buy eth 100 ignored bought 900 oh well,0.0,0.0,23,1
2644,1619109844.0,2021-04-22 12:44:04,1,5.0,sold eth two years fund college sad pay entire college tuition though guess worth,-0.2375,0.68125,28,0
2645,1619107261.0,2021-04-22 12:01:01,0,2.0,bought first bitcoin selling 372eth mined converted back eth sold nothing basically compared todays price,0.125,0.16666666666666666,26,1
2646,1619111239.0,2021-04-22 13:07:19,0,2.0,first blockchain heard real use case dapps programming going fare much better bitcoin ahead,0.31666666666666665,0.37777777777777777,27,0
2648,1619123664.0,2021-04-22 16:34:24,0,2.0,mine favorite learn,0.5,1.0,9,0
2649,1619097586.0,2021-04-22 09:19:46,2,6.0,bizarrely first one bought ada cant remember,0.35625,0.4666666666666667,11,0
2650,1619145562.0,2021-04-22 22:39:22,1,2.0,sorted new read exact comment,0.19318181818181818,0.3522727272727273,9,1
2651,1619103169.0,2021-04-22 10:52:49,1,24.0,bullish days eth cant wait eth 20 bring table maybe well actually see ethereum valued,0.0,0.1,24,1
2652,1619096273.0,2021-04-22 08:57:53,1,44.0,oilpowers gold,0.5,0.5,7,0
2653,1619107972.0,2021-04-22 12:12:52,0,2.0,mean usual followers going ensure eth takes credit bull run bitcoin started,-0.28125,0.46875,20,0
2654,1619116987.0,2021-04-22 14:43:07,0,1.0,talking friends thing eth leading pump alts,0.0,0.125,18,0
2655,1619097235.0,2021-04-22 09:13:55,2,37.0,boat pal started week back almost 400 dollars ethereum keep dca,-0.06666666666666667,0.075,24,0
2656,1619095251.0,2021-04-22 08:40:51,0,17.0,think good idea,0.9099999999999999,0.7800000000000001,8,0
2657,1619097824.0,2021-04-22 09:23:44,0,9.0,id say tree fiddy jk actually like 275 depending time bought,0.5,0.5,17,0
2658,1619122735.0,2021-04-22 16:18:55,1,2.0,much money make,0.2,0.2,7,1
2659,1619104573.0,2021-04-22 11:16:13,0,4.0,best time sell cash juicy gains,1.0,0.3,12,0
2660,1619113566.0,2021-04-22 13:46:06,0,1.0,someone bought 15 dollars worth last week,0.15,0.08333333333333334,9,0
2661,1619117780.0,2021-04-22 14:56:20,0,1.0,thank contribution ath,0.0,0.0,8,1
2662,1619123139.0,2021-04-22 16:25:39,0,1.0,feel like could figured using math,0.0,0.0,10,0
2663,1619102804.0,2021-04-22 10:46:44,5,16.0,dumped ada eth 2 weeks ago happy decision far,0.45,1.0,14,0
2664,1619109544.0,2021-04-22 12:39:04,0,2.0,buy back gainzzz,0.0,0.0,6,1
2665,1619120624.0,2021-04-22 15:43:44,1,1.0,im honestly tempted today feels risky,0.6,0.9,10,0
2666,1619096867.0,2021-04-22 09:07:47,6,40.0,whos 10th dentist punch,0.0,0.0,8,1
2667,1619098253.0,2021-04-22 09:30:53,1,9.0,dentcoin hodlings strongly disagree,0.4333333333333333,0.7333333333333333,5,1
2668,1619096061.0,2021-04-22 08:54:21,0,8.0,thats got opening post good one indeed,0.7,0.6000000000000001,11,1
2670,1619108361.0,2021-04-22 12:19:21,0,3.0,agreed dip helped nearly double eth,0.0,0.0,9,0
2671,1619161037.0,2021-04-23 02:57:17,1,2.0,thankful back,0.0,0.0,7,1
2673,1619111817.0,2021-04-22 13:16:57,1,4.0,im 95 eth rn boy im loving waters,0.9375,0.95,10,1
2674,1619113723.0,2021-04-22 13:48:43,0,4.0,im future wealthy man within year,0.25,0.5625,13,1
2675,1619117326.0,2021-04-22 14:48:46,0,3.0,im 90 eth mana ethereum token lol btc fine believe eth way,0.4291666666666667,0.45625,23,0
2678,1619116722.0,2021-04-22 14:38:42,1,-2.0,youll regret eth competitors working product,0.0,0.0,12,1
2679,1619112077.0,2021-04-22 13:21:17,0,12.0,trading,0.0,0.0,4,1
2681,1619125646.0,2021-04-22 17:07:26,0,2.0,used mine dash time called dark coin regular ass pc would get like 12 dark coins per day sold monthly like 1,-0.09999999999999999,0.2923076923076923,34,1
2682,1619106466.0,2021-04-22 11:47:46,0,5.0,pretty much thing,0.15,0.44166666666666665,6,0
2683,1619122089.0,2021-04-22 16:08:09,0,1.0,wow 5 eth hoping doge goes least 1 whole eth bought doge pretty cheap makes feel bad getting eth late,-0.040624999999999974,0.7208333333333333,42,0
2684,1619122038.0,2021-04-22 16:07:18,1,9.0,okay cash especially something smart like paying debt everyone different endgame made big dan like million dollars crypto id cash payment stop paying rent think ill always keep portion crypto think long term 2030 years gains going wild possibly current coins swap around got ta live life bit probably wont buy tesla btc unless see massive gains overall,0.05731490731490731,0.5255189255189255,98,0
2685,1619122859.0,2021-04-22 16:20:59,1,5.0,high interest rate debt worst worth hang onto crypto get destroyed compounding interest get rid debt always buy back later,-0.198,0.328,34,0
2686,1619108373.0,2021-04-22 12:19:33,1,9.0,rate give couple days,0.0,0.0,8,1
2687,1619107536.0,2021-04-22 12:05:36,0,3.0,sounds cooler bitcoin,0.0,0.0,6,0
2688,1619106489.0,2021-04-22 11:48:09,1,3.0,similar sentiment think altcoin season may well become permanent long run akin tokens actually provide use cases major industries well see many die many likely live grow faster similar eth stands eth likely successor btc,0.15407196969696968,0.5083333333333334,53,0
2689,1619103151.0,2021-04-22 10:52:31,4,1.0,dogecoin fiasco im wondering take call success,0.3,0.0,13,1
2690,1619106802.0,2021-04-22 11:53:22,1,-1.0,dogecoin holding around 30 cents depending time day people omg fiasco pretty much worthless,-0.2351851851851852,0.7296296296296297,22,0
2691,1619113351.0,2021-04-22 13:42:31,0,1.0,thats really good point would difference terms store value ethereum becomes deflationary besides course based pos,0.7,0.6000000000000001,29,0
2692,1619108172.0,2021-04-22 12:16:12,0,-1.0,tack store value people buy bitcoin expect price go happens ethereum serve purpose also suffers lot bear market centralized,0.1,0.45625,44,1
2693,1619100423.0,2021-04-22 10:07:03,2,26.0,2018 know comes alt season low btc dominance,0.0,0.3,15,0
2694,1619102490.0,2021-04-22 10:41:30,1,1.0,middle altseason next phase,0.0,0.0,11,0
2696,1619112037.0,2021-04-22 13:20:37,0,5.0,racing fan thats perfect analogy hopefully eth 2 get ground soon staked 90 eth 2 hopefully others consider dont need access funds,1.0,1.0,41,0
2697,1619114706.0,2021-04-22 14:05:06,1,2.0,happy see nascar related comment subreddit,0.5,0.7,13,1
2698,1619096269.0,2021-04-22 08:57:49,0,8.0,got ta pump,0.0,0.0,6,0
2699,1619097913.0,2021-04-22 09:25:13,0,7.0,green snaaaake snaaaake,-0.2,0.3,5,0
2700,1619091595.0,2021-04-22 07:39:55,0,20.0,oh man badger meme brings back memories,0.0,0.0,8,0
2702,1619097423.0,2021-04-22 09:17:03,0,1.0,speaks spiritual level,0.0,0.13333333333333333,8,0
2704,1619117475.0,2021-04-22 14:51:15,0,1.0,badger badger badger badger badger badger mush room mush room,0.0,0.0,10,1
2705,1619114821.0,2021-04-22 14:07:01,1,7.0,thats still 100 lot people youre great,0.75,0.625,12,0
2706,1619100276.0,2021-04-22 10:04:36,0,5.0,ethereum hot new transfer student class starting qb made pass,0.12878787878787878,0.46818181818181825,18,1
2707,1619117304.0,2021-04-22 14:48:24,1,3.0,sell btc pls,0.0,0.0,5,1
2708,1619096943.0,2021-04-22 09:09:03,4,26.0,run numbers calculations correct tuesday thursday days letters e h think suggests strong correlation thursday price eth someone call un need rename thursday ethursday monday 0 tuesday 2 wednesday 1 e twice thursday 2 friday 0 saturday 1 sunday 0,0.4666666666666667,0.6166666666666667,70,0
2709,1619094462.0,2021-04-22 08:27:42,0,5.0,hope every thursday like,0.0,0.0,10,1
2711,1619111734.0,2021-04-22 13:15:34,0,4.0,itll definition crypto 20 theres storm predicted weather experts,0.0,0.0,18,1
2712,1619100562.0,2021-04-22 10:09:22,0,1.0,everyone thinks thats going happen dont even think itll reach btc ath cycle,0.0,0.0,19,0
2713,1619110158.0,2021-04-22 12:49:18,1,4.0,gon na go much knows,0.022222222222222213,0.24444444444444446,11,0
2714,1619110276.0,2021-04-22 12:51:16,0,4.0,buy whenever point wont matter bought dip future gains amazing,0.30000000000000004,0.5125,25,0
2715,1619110935.0,2021-04-22 13:02:15,1,3.0,course dip lmao last weekend dropped 2k provided great buying opportunity,0.4666666666666666,0.6055555555555555,25,0
2716,1619110277.0,2021-04-22 12:51:17,0,2.0,research fwiw im 500 since tuesday 1 eth long term hold dip dip might still higher currently one knows,0.05,0.575,38,0
2718,1619095572.0,2021-04-22 08:46:12,1,8.0,met dentacoin,0.0,0.0,4,1
2719,1619101829.0,2021-04-22 10:30:29,2,8.0,bnb edit medical advice,0.0,0.0,5,1
2720,1619106134.0,2021-04-22 11:42:14,0,2.0,brush teeth bitch simpleflips,0.0,0.0,5,0
2721,1619111650.0,2021-04-22 13:14:10,1,2.0,think doge safemoon good one long term theyre running,0.32499999999999996,0.5,15,0
2724,1619095146.0,2021-04-22 08:39:06,0,4.0,thank money skelly,0.0,0.0,4,1
2725,1619108226.0,2021-04-22 12:17:06,0,1.0,centralized,0.0,0.0,4,1
2726,1619102896.0,2021-04-22 10:48:16,1,9.0,funny thing would capable gpu wasnt insane gas prices first place,-0.07500000000000001,0.6833333333333333,21,0
2727,1619110390.0,2021-04-22 12:53:10,1,1.0,might sound stupid wallet id enter public wallet id,-0.1333333333333333,0.4888888888888889,14,1
2728,1619130078.0,2021-04-22 18:21:18,1,1.0,isnt barely worth people considering electric costs gpu wear tear,0.4,0.3,15,0
2729,1619123233.0,2021-04-22 16:27:13,1,2.0,congrats next project 1 btc,0.0,0.0,6,0
2730,1619114041.0,2021-04-22 13:54:01,1,2.0,think people converting btc eth,0.0,0.0,9,0
2731,1619116081.0,2021-04-22 14:28:01,0,1.0,alt season shmalt season hold 10 years quit job,0.0,0.0,13,0
2732,1619118691.0,2021-04-22 15:11:31,0,1.0,want cheap sats stacking fuk times,0.4,0.7,14,0
2733,1619118890.0,2021-04-22 15:14:50,0,1.0,isnt even close everyone,0.0,0.0,6,0
2734,1619140876.0,2021-04-22 21:21:16,0,2.0,time high,0.16,0.5399999999999999,3,1
2735,1619145670.0,2021-04-22 22:41:10,0,2.0,tom petty free fallin39 250 415,-0.175,0.9,6,1
2737,1619113915.0,2021-04-22 13:51:55,0,1.0,never bet us never bet eth,0.0,0.0,10,1
2738,1619105888.0,2021-04-22 11:38:08,0,3.0,7 dollars move eth right mainnet fractions pennies several l2s seems around 58 dollars bitcoin mainnet,0.14285714285714285,0.26785714285714285,24,0
2739,1619106287.0,2021-04-22 11:44:47,0,3.0,high fees smart contracts send eth costs 10,0.18714285714285714,0.5914285714285714,12,1
2740,1619106903.0,2021-04-22 11:55:03,2,3.0,high fees due overwhelming demand nobody drives city theres much traffic,0.18375000000000002,0.52875,17,0
2741,1619109540.0,2021-04-22 12:39:00,0,1.0,legit use smart contracts eth everyday albeit significant amount eth,0.12976190476190474,0.705952380952381,16,1
2742,1619108055.0,2021-04-22 12:14:15,0,4.0,downvote fun,0.4375,0.35,6,0
2743,1619108752.0,2021-04-22 12:25:52,0,2.0,still thinks dentacoin bags let retire maybe year definitely end 2023 100 bro,0.0,0.5,23,0
2744,1619106896.0,2021-04-22 11:54:56,0,1.0,olympussomeones call one dentist wan na know thinks also fucking branded hes using 25mm,-0.6,0.8,20,0
2746,1619098803.0,2021-04-22 09:40:03,0,3.0,2k valentines day,0.0,0.0,4,1
2747,1619091734.0,2021-04-22 07:42:14,0,11.0,dip remindme 6 months,0.0,0.0,7,0
2748,1619091008.0,2021-04-22 07:30:08,1,3.0,mean could buy bitcoin kinda low right bitcoin dominance rises convert eth eth doesnt explode lol,0.19330357142857144,0.5558035714285714,29,0
2749,1619105296.0,2021-04-22 11:28:16,0,3.0,dont think,0.0,0.0,4,0
2750,1619091046.0,2021-04-22 07:30:46,1,1.0,much better great btceth flipping happen,0.65,0.625,8,0
2751,1619105306.0,2021-04-22 11:28:26,0,2.0,im remembering correctly eth actually fork etc exploit dao smart contract software 50 million worth ether stolen decided fork ethereum know happened early project didnt want undermine eths future definitely dont buy etc unless youre memes something,0.10738095238095237,0.30964285714285716,70,0
2752,1619100648.0,2021-04-22 10:10:48,2,2.0,eth basically top crypto comes marketshare cap besides btc developers using general future potential imo dont invest ath tho,0.1375,0.53125,28,0
2754,1619111627.0,2021-04-22 13:13:47,0,1.0,good rule thumb sell max 20 holdings set next sell higher also never liquidate entire bag leaving percentage guarantee dont miss moonshot youll never know ever 2k id set money dca back 4 years youll happy gotten,0.25,0.5321428571428571,74,0
2755,1619105906.0,2021-04-22 11:38:26,0,2.0,vechain completely different concept gas fees high actually heavily used good sign,0.13199999999999998,0.46799999999999997,21,0
2756,1619104512.0,2021-04-22 11:15:12,0,5.0,1010 selfawareness comment,0.0,0.0,5,1
2757,1619093200.0,2021-04-22 08:06:40,1,11.0,maths weird man,-0.5,1.0,6,0
2758,1619106169.0,2021-04-22 11:42:49,1,0.0,sour little boy us favor short,-0.1125,0.3,13,1
2759,1619108680.0,2021-04-22 12:24:40,0,1.0,every time feel like celebrating remind 147 still pretty far away,0.175,1.0,17,0
2760,1619106671.0,2021-04-22 11:51:11,0,1.0,olympus 40150mm 456 uma 1 dentist knee deep shitcoin bet,0.0,0.4,14,1
2761,1619106759.0,2021-04-22 11:52:39,1,1.0,olympus 25mm,0.0,0.0,4,1
2762,1619106170.0,2021-04-22 11:42:50,1,2.0,check put polygonmatic layer 2 trying help eth scaling would also recommend checking vechain matter time see major adoption solves ton real world issues cosmos tezos also worth looking make sure research invest tech believe im personally bullish projects long also add im waiting bear market load alts ive space awhile reminds time leading last crash believe eth true game changer strategy take profits alts put eth right btc eth tend hold way better crashes dips like opinion man,0.1956845238095238,0.47010582010582014,158,1
2763,1619109109.0,2021-04-22 12:31:49,1,1.0,whats difference holding eth eth2 ive stacking money eth putting basically one,0.0,0.125,30,1
2764,1619105472.0,2021-04-22 11:31:12,0,1.0,comment removed contains link telegram discord please adjust post resubmit bot action performed automatically please contact moderators subredditmessagecomposetorcryptocurrency questions concerns,0.1,0.1,43,1
2765,1619108218.0,2021-04-22 12:16:58,0,1.0,worried price going even 2000 1800 whatever going nice long term,0.19148148148148147,0.562962962962963,22,0
2766,1619108559.0,2021-04-22 12:22:39,0,1.0,comment removed contains link telegram discord please adjust post resubmit bot action performed automatically please contact moderators subredditmessagecomposetorcryptocurrency questions concerns,0.1,0.1,43,1
2767,1619109299.0,2021-04-22 12:34:59,0,2.0,think research find beginning youre looking 3 5 years,0.0,1.0,24,0
2768,1619109262.0,2021-04-22 12:34:22,0,1.0,research isnt get rich quick thing,0.35416666666666663,0.625,9,0
2769,1619110572.0,2021-04-22 12:56:12,0,1.0,wait 6 hours 31 minutes,0.0,0.0,6,0
2771,1619110646.0,2021-04-22 12:57:26,1,1.0,gas fees thought using mostly renewable energy,0.5,0.5,11,0
2772,1619118776.0,2021-04-22 15:12:56,0,1.0,atleast week think wat anyone know,0.0,0.0,10,0
2773,1619118224.0,2021-04-22 15:03:44,0,1.0,coins x coin price,0.0,0.0,4,1
2774,1619114233.0,2021-04-22 13:57:13,0,1.0,greetings eric42 comment contained referral link directed webnewtoncor violation rule ii spam consequence banned rcryptocurrency bot action performed automatically please contact moderators subredditmessagecomposetorcryptocurrency questions concerns,0.1,0.1,54,1
2776,1619118566.0,2021-04-22 15:09:26,0,1.0,time high,0.16,0.5399999999999999,3,1
2777,1619118824.0,2021-04-22 15:13:44,1,1.0,made killing sports cards year thats way afford whole eth super grateful,0.17777777777777778,0.6888888888888888,21,0
2778,1619120428.0,2021-04-22 15:40:28,0,1.0,coolio fine,0.4166666666666667,0.5,4,1
2779,1619119388.0,2021-04-22 15:23:08,0,1.0,greetings glccrypto comment contained referral link directed binancecomenregisterref violation rule ii spam consequence banned rcryptocurrency bot action performed automatically please contact moderators subredditmessagecomposetorcryptocurrency questions concerns,0.1,0.1,54,1
2781,1619122313.0,2021-04-22 16:11:53,1,0.0,dont let greed get best,1.0,0.3,8,0
2782,1619122270.0,2021-04-22 16:11:10,0,2.0,thats extremely conservative,-0.125,1.0,4,0
2783,1619122226.0,2021-04-22 16:10:26,0,1.0,comment removed contains link telegram discord please adjust post resubmit bot action performed automatically please contact moderators subredditmessagecomposetorcryptocurrency questions concerns,0.1,0.1,43,1
2785,1619123512.0,2021-04-22 16:31:52,0,2.0,tbf post made price still rising edit entire market going,-0.07777777777777779,0.4569444444444445,17,0
2786,1619125065.0,2021-04-22 16:57:45,0,2.0,atheth meanwhile last hour heyooo,0.0,0.06666666666666667,6,0
2787,1619145263.0,2021-04-22 22:34:23,0,2.0,drops double edge sword,0.25,0.25,6,1
2788,1619116997.0,2021-04-22 14:43:17,0,2.0,clearly havent done research,0.10000000000000002,0.3833333333333333,6,1
2789,1619106689.0,2021-04-22 11:51:29,0,1.0,say im bullish long term eth want accumulate,0.21666666666666667,0.39999999999999997,14,0
2790,1619146177.0,2021-04-22 22:49:37,0,1.0,noice im noicing noice,0.0,0.0,5,1
2792,1619112984.0,2021-04-22 13:36:24,0,2.0,underrated crypto space beginning understand michael saylor elon,0.375,0.75,18,0
2793,1619129266.0,2021-04-22 18:07:46,0,1.0,bad sold eth end 2017 buy pokmon cards,-0.6999999999999998,0.6666666666666666,17,0
2795,1619096202.0,2021-04-22 08:56:42,4,53.0,yep really see eth closing ethbtc pair gap coming months,0.25,0.2,14,0
2796,1619096233.0,2021-04-22 08:57:13,6,101.0,im bullish 10k eoy 25k 2 years,0.0,0.0,9,0
2797,1619100091.0,2021-04-22 10:01:31,1,9.0,get link video,0.0,0.0,7,1
2798,1619097159.0,2021-04-22 09:12:39,7,46.0,new price target 6969 69,0.13636363636363635,0.45454545454545453,6,1
2799,1619101819.0,2021-04-22 10:30:19,3,17.0,long crypto eth future bright project gifgiphytjumm58ycl6eyxvjf1downsized,0.275,0.44166666666666665,18,0
2800,1619104321.0,2021-04-22 11:12:01,0,1.0,excatly people think accumulating,-0.125,0.375,10,0
2801,1619104700.0,2021-04-22 11:18:20,0,1.0,damn vitalik really letting loose wait starts 2 step,0.06153846153846154,0.23461538461538461,15,0
2803,1619105548.0,2021-04-22 11:32:28,0,1.0,fact eth successful even gas fees incredible,0.825,0.925,14,0
2804,1619106399.0,2021-04-22 11:46:39,0,1.0,geeeeeezsomeone please help peeps dance,0.0,0.0,7,1
2805,1619107024.0,2021-04-22 11:57:04,0,1.0,eth 20 gon na take way long though layer 2 protocols development right beat market years good sign eth fir cmon anyone whos studied space even little see eth bit dinosaur first market clout remains im gon na waiting sell long,0.15803571428571428,0.4615079365079365,78,0
2806,1619107604.0,2021-04-22 12:06:44,0,1.0,best gif ever cmonnn ethereum,1.0,0.3,8,0
2808,1619108213.0,2021-04-22 12:16:53,0,1.0,surprised passes 6k mark,-0.05,0.9,8,1
2809,1619108303.0,2021-04-22 12:18:23,0,1.0,new ticker eth20 comes eth holder automatically moved eth20,0.13636363636363635,0.45454545454545453,19,1
2811,1619109384.0,2021-04-22 12:36:24,0,1.0,yeah dont get eth popular gas fees make almost worthless use,-0.10000000000000003,0.9,20,0
2812,1619109420.0,2021-04-22 12:37:00,0,1.0,cant wait happen im miner side fees go truly explode witnessing history amazing,0.4222222222222222,0.5944444444444444,29,0
2813,1619110250.0,2021-04-22 12:50:50,0,1.0,broke away btc today,0.0,0.0,6,1
2814,1619110530.0,2021-04-22 12:55:30,0,1.0,pardon ignorance eth 20 going stop fees like going lower keep fixed price youean actually gas fees seems far fetched hope going lower gas fees,-0.016666666666666663,0.5666666666666667,51,1
2815,1619111123.0,2021-04-22 13:05:23,1,1.0,eth 20 eip 1559 wont reduce fees eip 1559 makes predictable less failed transactions reduce inflationcause deflation reduce fees l2 adoption scalability improvements,-0.09166666666666667,0.3416666666666667,34,1
2816,1619111655.0,2021-04-22 13:14:15,0,1.0,eth 20 comes happens eth become worthless somehow upgrade,-0.8,0.9,18,0
2818,1619115831.0,2021-04-22 14:23:51,0,1.0,nothing better watching dorks dancing,0.5,0.5,6,0
2819,1619115875.0,2021-04-22 14:24:35,0,1.0,compeltely offtopic ive never understood kind presentations microsoft bitconneeeect mean background people hanging much oh eth top,0.278125,0.5718749999999999,36,0
2820,1619118314.0,2021-04-22 15:05:14,0,1.0,thought animation someone getting jizzed feel getting hit gas fees days,0.0,0.0,21,0
2821,1619119703.0,2021-04-22 15:28:23,0,1.0,eth 20 coming,0.0,0.0,5,1
2822,1619121073.0,2021-04-22 15:51:13,0,1.0,moon even mars,0.0,0.0,7,0
2823,1619122929.0,2021-04-22 16:22:09,0,1.0,lets see eth maintain stranglehold smart contract market gas fees long wait 20 means prime picking,0.08214285714285713,0.5214285714285715,27,0
2824,1619125741.0,2021-04-22 17:09:01,0,1.0,love,0.5,0.6,4,0
2825,1619132213.0,2021-04-22 18:56:53,0,1.0,many good things come,0.6875,0.55,5,0
2826,1619136940.0,2021-04-22 20:15:40,0,1.0,eth 20 drop,0.0,0.0,5,1
2827,1619143303.0,2021-04-22 22:01:43,0,1.0,able convert eth eth 20,0.5,0.625,11,1
2828,1619096379.0,2021-04-22 08:59:39,5,86.0,0046 ethbtc highest since august 2018 think 010 back menu next months,-0.06666666666666667,0.03333333333333333,23,0
2829,1619097161.0,2021-04-22 09:12:41,2,33.0,eth finally starting separate price btc,0.0,0.1,10,0
2830,1619096848.0,2021-04-22 09:07:28,3,24.0,btc dominance also 50,0.0,0.0,6,1
2831,1619101234.0,2021-04-22 10:20:34,1,9.0,comes flippening talk bust sleeping giant great team shirts 2017 lol eth safe generally kinda game town trigger phrases 2017 get,0.2785714285714285,0.692857142857143,38,0
2832,1619098624.0,2021-04-22 09:37:04,3,9.0,eth still 68 priced bitcoin dont soak panties yet,-0.15555555555555559,0.2888888888888889,16,0
2833,1619100989.0,2021-04-22 10:16:29,0,1.0,time waiting 4 years get close ratio,0.0,0.0,15,0
2834,1619102169.0,2021-04-22 10:36:09,0,1.0,im glad eth btc huge margin,0.46666666666666673,0.7999999999999999,14,0
2835,1619104852.0,2021-04-22 11:20:52,1,1.0,canadian etf went market,0.0,0.0,13,0
2836,1619105317.0,2021-04-22 11:28:37,0,1.0,fucking hugeee go eth,-0.75,0.8,4,0
2837,1619106910.0,2021-04-22 11:55:10,1,1.0,correlated im bullish eth shitload applications btc good store value digital gold say,0.3,0.525,32,0
2838,1619107320.0,2021-04-22 12:02:00,0,1.0,swapped little btc eth cheer got matic feel good,0.25625,0.55,19,0
2839,1619109599.0,2021-04-22 12:39:59,0,1.0,one follows extent always switched btc eth gained 4 day see btcs price respond next day,0.125,0.2916666666666667,33,1
