,UTC,Post Date,Number of Comments,Upvote Ratio,Text,polarity,subjectivity,word_count,is_spam
2256,1619172245.0,2021-04-23 06:04:05,1,3.0,big players selling,0.0,0.1,5,0
2257,1619172544.0,2021-04-23 06:09:04,0,3.0,true test patience zen mode,0.4375,0.65,7,0
2258,1619174075.0,2021-04-23 06:34:35,0,3.0,seems pullback big prior ones reading daily threads make seems like end world,0.0,0.03333333333333333,28,0
2259,1619174109.0,2021-04-23 06:35:09,0,3.0,baptisms fire month purge noobs paper hands hodlers,0.0,0.0,15,1
2260,1619177804.0,2021-04-23 07:36:44,0,3.0,knew risks going man fuck sucks sure tickle balls pink goes doesnt,-0.11111111111111112,0.47555555555555545,28,0
2261,1619172702.0,2021-04-23 06:11:42,0,4.0,every month chunk new people gets crypto lack experience whats causing panic,0.13636363636363635,0.45454545454545453,20,1
2262,1619175740.0,2021-04-23 07:02:20,0,2.0,someone started crypto month ago thank reassurance,0.0,0.0,15,1
2263,1619185756.0,2021-04-23 09:49:16,0,2.0,yeah get used dont,0.0,0.0,9,0
2264,1619186023.0,2021-04-23 09:53:43,0,2.0,thank god altcoins still green makes big fat next btc profitloss easier look hahaha hodl regardless ayy,0.0,0.2,26,0
2265,1619186260.0,2021-04-23 09:57:40,0,2.0,got stack cash hell buy,0.0,0.0,12,0
2266,1619186963.0,2021-04-23 10:09:23,0,2.0,shit makes hands weak go watch cowen videos hes talking months always good hear level headed analysis data back,0.03125,0.5062500000000001,33,0
2267,1619187685.0,2021-04-23 10:21:25,0,2.0,whove came cryto winter still feel chill stand strong bags,0.4333333333333333,0.7333333333333333,20,0
2268,1619190084.0,2021-04-23 11:01:24,0,2.0,im 690 year,-0.4527777777777778,0.6444444444444445,8,1
2269,1619190838.0,2021-04-23 11:13:58,0,2.0,good ass post,0.7,0.6000000000000001,6,1
2270,1619191419.0,2021-04-23 11:23:39,0,2.0,tbh volatility much lower percentage previous 3 cycles btc stress watch ben cowen videos soothes soul,0.016666666666666677,0.18333333333333335,29,1
2271,1619191518.0,2021-04-23 11:25:18,0,2.0,surprised different eth behaving compared btc last pullback first one year eth held better far noticed,0.15833333333333333,0.5666666666666667,28,0
2272,1619192525.0,2021-04-23 11:42:05,0,2.0,3 first ever coinpocalypse welcome jungle hey hey heeeeeeeeeeey,0.525,0.6166666666666667,17,1
2273,1619193952.0,2021-04-23 12:05:52,0,2.0,thanks posting im sure itll help keep emotions check bit hope good stress free friday,0.475,0.6222222222222222,25,1
2274,1619197130.0,2021-04-23 12:58:50,1,2.0,dip next week rises back,0.0,0.0,10,0
2275,1619198177.0,2021-04-23 13:16:17,0,2.0,need pull 6 month chart nothing worry especially massive institutional support bitcoin time around,0.0,1.0,29,1
2276,1619200653.0,2021-04-23 13:57:33,1,2.0,good reminder simple list take award,0.35,0.47857142857142865,9,1
2277,1619202181.0,2021-04-23 14:23:01,0,2.0,sure forgot january one check history btc believe maybe repressed memory lmao,0.175,0.9444444444444444,27,1
2278,1619235335.0,2021-04-23 23:35:35,2,2.0,really great see opportunity buy anyone else see technicals eth look wonky starting move independently bitcoin doesnt dip low used preserving gains better alt market also starting take cues eth bitcoin least dot ksm,0.13333333333333333,0.3416666666666667,63,1
2279,1619172122.0,2021-04-23 06:02:02,1,4.0,lets beat record get 32 dips guys,0.0,0.0,13,1
2280,1619172316.0,2021-04-23 06:05:16,1,3.0,hodl friends still early crypto game,-0.15000000000000002,0.35,10,0
2281,1619172401.0,2021-04-23 06:06:41,1,2.0,cool visual found twitter pointing percentages last cycle btc market dip percentages,-0.1,0.4291666666666667,19,0
2282,1619173272.0,2021-04-23 06:21:12,1,1.0,new crypto 6 weeks scared hodl,0.17045454545454544,0.45454545454545453,16,1
2283,1619177359.0,2021-04-23 07:29:19,0,1.0,history repeats everyone knows one buys fear,0.0,0.0,13,0
2284,1619175108.0,2021-04-23 06:51:48,0,1.0,right however still minor corrections look big picture gon na double peak cycle looks like theres still big chungusesque correction horizon might one feeling eth might rally bitcoin one time theres another big pullback,0.10510204081632654,0.21938775510204084,61,0
2285,1619178629.0,2021-04-23 07:50:29,0,1.0,average looks like time buy,-0.15,0.39999999999999997,9,0
2286,1619185792.0,2021-04-23 09:49:52,0,1.0,would great also possible causes pullbacks listed,0.4,0.875,15,1
2287,1619189511.0,2021-04-23 10:51:51,0,1.0,mean next month 20,-0.15625,0.34375,10,1
2288,1619190458.0,2021-04-23 11:07:38,0,1.0,hope right pretty sad see 50,0.011904761904761899,0.8452380952380952,15,0
2289,1619193134.0,2021-04-23 11:52:14,0,1.0,90 2018 lasted 900 days,0.0,0.0,7,1
2290,1619194329.0,2021-04-23 12:12:09,0,1.0,always post calming people dip always post hyping people things rising feel sorry newbs lurking,-0.3277777777777778,0.6444444444444445,32,1
2291,1619196117.0,2021-04-23 12:41:57,0,1.0,im sure feb dip lasted 2 weeks took 3 weeks get previous ath,0.16666666666666669,0.5277777777777778,16,1
2292,1619201961.0,2021-04-23 14:19:21,0,1.0,one spooky ath crossed arbitrary number1,-0.125,0.6,10,0
2293,1619211354.0,2021-04-23 16:55:54,0,1.0,thing 201820,0.0,0.125,9,0
2294,1619222215.0,2021-04-23 19:56:55,0,1.0,nice touch edit truer words never spoken,0.6,1.0,11,0
2295,1619214994.0,2021-04-23 17:56:34,1,6.0,never financially recover,0.0,0.0,7,0
2296,1619181263.0,2021-04-23 08:34:23,0,14.0,tradition,0.0,0.0,3,1
2297,1619188154.0,2021-04-23 10:29:14,0,8.0,like salsa like guacamole like hummus even like babaganoush dip enjoy hot chilli crypto dip burns way burns way god damn cant stop eating,0.3833333333333333,0.6166666666666667,48,0
2298,1619185057.0,2021-04-23 09:37:37,1,1.0,pants smell like shit,-0.475,0.9,5,0
2299,1619173790.0,2021-04-23 06:29:50,3,39.0,one easiest times ever someone long crypto every dip bought back within days stressful people better prepare market inevitably drops 30 doesnt go back 6 months dont know happen tomorrow months happen definitely people fomod top without luxury price popping,0.1125,0.39375,92,0
2300,1619172327.0,2021-04-23 06:05:27,1,5.0,welcome game grasshopper,0.2,0.65,5,1
2301,1619185173.0,2021-04-23 09:39:33,0,3.0,commenting see anyone answers math later,0.0,0.0,10,0
2302,1619185633.0,2021-04-23 09:47:13,1,2.0,lot 2021 far ever 2017 take look 1d charts,0.3,0.75,21,1
2303,1619187611.0,2021-04-23 10:20:11,1,1.0,sure bull market moving quite quickly cycle bound slow point,0.09444444444444441,0.5194444444444444,22,0
2306,1619176777.0,2021-04-23 07:19:37,1,2.0,hey next time coordinate better,0.16666666666666666,0.20833333333333334,10,1
2307,1619176854.0,2021-04-23 07:20:54,1,1.0,bought last night dipped 50k sorry made another dip,-0.25,0.5333333333333333,16,0
2309,1619189723.0,2021-04-23 10:55:23,0,1.0,oughtt happen bull run,0.0,0.0,7,0
2310,1619194395.0,2021-04-23 12:13:15,0,1.0,sources sold following analysis guy another channel,0.0,0.1,15,1
2311,1619230132.0,2021-04-23 22:08:52,0,1.0,heard first folks sell farm sell wife get rich next week,0.22916666666666666,0.3611111111111111,17,0
2312,1619210727.0,2021-04-23 16:45:27,0,2.0,thanks brother hodler,0.2,0.2,3,1
2313,1619236446.0,2021-04-23 23:54:06,0,2.0,yes noticed maker seems take cues eth im excited ethereums future,0.24375000000000002,0.55,19,1
2314,1619245136.0,2021-04-24 02:18:56,0,1.0,related alt season btc dominance 50 doesnt gravitational force,0.0,0.2625,23,0
2315,1619172331.0,2021-04-23 06:05:31,0,2.0,32 ath wouldnt even break technical support id probably buy case cant lie falls far would start shorting tether strap free fall,0.25,0.6000000000000001,38,1
2316,1619172440.0,2021-04-23 06:07:20,1,8.0,dont think thats case anymore huge misconception sub,0.4000000000000001,0.9,14,1
2317,1619178496.0,2021-04-23 07:48:16,0,1.0,entered like 2 year bear market reassuring chart,0.5,0.5,15,1
2318,1619175884.0,2021-04-23 07:04:44,0,2.0,lot us thing 2017 regret buying btc ath 20k friends sold really regret,0.2333333333333333,0.27499999999999997,32,1
2319,1619231782.0,2021-04-23 22:36:22,0,1.0,doesnt votes,0.5,0.5,7,0
2320,1619185126.0,2021-04-23 09:38:46,0,1.0,hope didnt taste,0.0,0.0,6,1
2321,1619184662.0,2021-04-23 09:31:02,1,26.0,longterm hodlers also chilling right scary youre going 800 700 original investment,-0.09896825396825397,0.6949206349206349,25,0
2322,1619181958.0,2021-04-23 08:45:58,0,5.0,honest im probably bit naive cant wait day get dca bottom,0.15,0.95,22,0
2323,1619202029.0,2021-04-23 14:20:29,0,2.0,long dips plenty time buy big peaks big market caps bitcoin closer currency rather asset,-0.016666666666666666,0.19999999999999998,23,0
2324,1619172538.0,2021-04-23 06:08:58,1,10.0,market dipped bc im,0.0,0.0,6,1
2325,1619186427.0,2021-04-23 10:00:27,1,3.0,probably hype trading paperhand opportunities idk people knew buying btc 2017 december big believers,0.25,0.525,28,0
2326,1619188758.0,2021-04-23 10:39:18,0,3.0,subsequent cycle slower last except one get back expected behaviour need little bit slow,-0.10615079365079365,0.24365079365079365,26,0
2327,1619175709.0,2021-04-23 07:01:49,4,12.0,people think institutional adoption difference know crash eventually,0.5,0.5,16,0
2328,1619177386.0,2021-04-23 07:29:46,1,2.0,coordinate would dump pump would sell low make work tho,0.0,0.3,23,1
2329,1619242950.0,2021-04-24 01:42:30,1,2.0,hahaha lets organise dip 2k get good value btc,0.24814814814814812,0.42962962962962964,15,0
2330,1619174098.0,2021-04-23 06:34:58,1,4.0,yeah people perspective theres still significant growth potential one early buy something already 1 trillion dollar market cap anyone living rock least general awareness bitcoin people sure like tell,0.12083333333333333,0.6606481481481481,55,0
2331,1619191848.0,2021-04-23 11:30:48,1,15.0,someone born bear market 2018 going ive ever known investing couple hundred seeing evaporated next day ive dcad lot 2019 invested wanted invest 2021 first time ive plus im 450 instead 550 last week youre right im chilling ive 65 2 half years,-0.0409297052154195,0.3273242630385487,79,0
2332,1619184885.0,2021-04-23 09:34:45,0,3.0,dont feel bad keeps dipping started dipping toes altcoins january 2018 glad kept dcaing since,-0.03749999999999992,0.8333333333333333,28,0
2333,1619187480.0,2021-04-23 10:18:00,0,2.0,probably becomes mainstream paperhands come dips become frequent,0.4,0.45,15,0
2334,1619197571.0,2021-04-23 13:06:11,0,2.0,think make difference enough people trading massive leverage youll always open door drops like,0.0,0.6666666666666666,27,1
2335,1619182531.0,2021-04-23 08:55:31,1,1.0,everybody say elon long haul aka tech aka diamond hands,-0.05,0.4,19,0
2336,1619203177.0,2021-04-23 14:39:37,1,1.0,said last time,0.0,0.06666666666666667,5,0
2337,1619185130.0,2021-04-23 09:38:50,0,1.0,well talk institutional investors 2017 really see start big corp banks investing least calling scam anymore least btc kinda different doesnt mean market wont crash 90,-0.10178571428571427,0.35892857142857143,52,0
2338,1619177476.0,2021-04-23 07:31:16,0,2.0,pump 100 bag,0.0,0.0,8,1
2339,1619250040.0,2021-04-24 03:40:40,0,1.0,bro thats big brain right,0.14285714285714285,0.31785714285714284,6,0
2340,1619174404.0,2021-04-23 06:40:04,0,5.0,yeah mean stock market us 30 trillion dollars real output significant crypto future think 130 based much real world value produces right anything slightly overvalued,0.08307823129251701,0.427125850340136,48,0
2341,1619197309.0,2021-04-23 13:01:49,1,5.0,lol getting started crypto beginning bear market best time could possibly started got like 3 whole years build stack buying everything 90 discount,0.5125,0.6,37,0
2342,1619199220.0,2021-04-23 13:33:40,0,1.0,maybe dont think elons plan keep buying mean elon aint dcaing bitcoin didnt bought like 15b worth hell hodl bag,0.1625,0.4291666666666667,34,0
2343,1619204518.0,2021-04-23 15:01:58,0,1.0,may said huge players actually executing could easily wrong remember 2017 bluechip companies buying btc,-0.033333333333333305,0.6333333333333333,29,0
2344,1619197654.0,2021-04-23 13:07:34,0,4.0,one regret couldve invested considerable amount money 2019 2020 didnt chump change started looking crypto properly towards end 2020 sucks hopefully thyme market makes,-0.049999999999999996,0.4625,46,0
2345,1619280172.0,2021-04-24 12:02:52,20,0.67,thoughts peter schiffs beginning end bitcoin bear market,0.0,0.0,14,0
2346,1619280173.0,2021-04-24 12:02:53,0,1.0,hello rcryptocurrency readers please try following links sort comments controversial first click doesnt work mobile potentially find cryptowikis articles subject post click contribute cryptowikis click bot action performed automatically please contact moderators subredditmessagecomposetorcryptocurrency questions concerns,0.12222222222222223,0.4694444444444445,64,1
2347,1619280752.0,2021-04-24 12:12:32,1,5.0,opposite whatever peter schiff says youll fine,0.20833333333333334,0.25,13,0
2348,1619280345.0,2021-04-24 12:05:45,1,5.0,peter fuding since emerged womb,0.0,0.0,10,0
2349,1619280711.0,2021-04-24 12:11:51,1,3.0,advice son schiffspencer bought even bitcoin whose advice want follow 57yearold experienced investorbusiness owner whos investment professional 30 years 18yearold college freshman whos never even job 80 voted kid professional sounds like someone cant take public loss hes wrong btc crypto general since beginning,0.15000000000000005,0.43809523809523815,70,0
2350,1619280929.0,2021-04-24 12:15:29,1,2.0,tldr peter doesnt know shit like rest us dont waste time gob shyte,-0.2,0.4,20,1
2351,1619280941.0,2021-04-24 12:15:41,1,2.0,mean peter schill,-0.3125,0.6875,4,0
2352,1619292100.0,2021-04-24 15:21:40,0,2.0,thing right believe part stagnationdip recently due fact grayscale close fund new issuance supply got way ahead demand institutions levering buy shares par sell six months later gbtc premium wait retail demand mops supply coming market 6 month lockup expiration blind squirrel gets nut every,-0.03382034632034633,0.5053210678210678,94,0
2353,1619280752.0,2021-04-24 12:12:32,1,1.0,guy sounds like skip bayless crypto world,0.0,0.0,11,0
2354,1619280922.0,2021-04-24 12:15:22,1,1.0,comparing coinbase aol wondering next step crypto gets rid middlemen like coinbase binance know companies create large whales already paying fees use cant see existing forever whats next open source trading software become popular something allows trade wallet straight blockchain,0.23061224489795915,0.4612244897959184,70,0
2355,1619299304.0,2021-04-24 17:21:44,1,1.0,dont pay boomers mind,0.0,0.0,6,0
2357,1619280554.0,2021-04-24 12:09:14,0,1.0,loves shilling rare set,0.3,0.9,6,0
2358,1619281199.0,2021-04-24 12:19:59,0,1.0,100 btc,0.0,0.0,5,1
2359,1619281041.0,2021-04-24 12:17:21,0,1.0,yeah waste time little education,-0.19375,0.25,11,0
2360,1619281003.0,2021-04-24 12:16:43,0,1.0,apologies gay,0.4166666666666667,0.5833333333333334,3,0
2361,1619280984.0,2021-04-24 12:16:24,0,1.0,google fan stephen smith skip cool,0.35,0.65,14,1
2362,1619281139.0,2021-04-24 12:18:59,1,1.0,believe dex next big thing,0.0,0.05,9,0
2363,1619307682.0,2021-04-24 19:41:22,0,1.0,isnt micheal saylor boomer,0.0,0.0,5,0
2366,1619210382.0,2021-04-23 16:39:42,37,0.87,friendly reminder bitcoin one year ago struggling get past 8k mark,0.0625,0.375,19,0
2367,1619210383.0,2021-04-23 16:39:43,0,1.0,hello rcryptocurrency readers please try following links sort comments controversial first click doesnt work mobile potentially find cryptowikis articles subject post click contribute cryptowikis click bot action performed automatically please contact moderators subredditmessagecomposetorcryptocurrency questions concerns,0.12222222222222223,0.4694444444444445,64,1
2368,1619210671.0,2021-04-23 16:44:31,1,8.0,eth 300,0.0,0.0,3,1
2369,1619210460.0,2021-04-23 16:41:00,3,8.0,eth struggling get 3k mark logic eth 20k next year,0.0,0.0,19,1
2370,1619210955.0,2021-04-23 16:49:15,2,5.0,told dad buy dipped 3500 retired alot cash would multimillionaire bought,0.0,0.0,29,1
2371,1619210590.0,2021-04-23 16:43:10,0,3.0,still early crypto game large picture plenty time hop board afford course,-0.010714285714285732,0.3761904761904762,27,0
2372,1619210627.0,2021-04-23 16:43:47,2,3.0,wonder well one year,0.5,0.5,8,0
2373,1619211040.0,2021-04-23 16:50:40,0,3.0,friendly reminder bitcoin one year ago struggling get past 8k mark friendly reminder bitcoin 10 year ago struggling get past 1 mark,0.0625,0.375,37,1
2374,1619211522.0,2021-04-23 16:58:42,0,3.0,look year ago washing groceries furiously browsing web supplies make masks toilet paper difference year makes,0.2833333333333333,0.5,32,1
2375,1619210567.0,2021-04-23 16:42:47,0,2.0,dont mad little step,-0.3226851851851852,0.5962962962962963,9,1
2376,1619214665.0,2021-04-23 17:51:05,0,2.0,anyone got spare time machine kicking around,0.0,0.0,8,1
2377,1619215173.0,2021-04-23 17:59:33,0,2.0,eth btc going wild,0.125,0.4,5,0
2378,1619210731.0,2021-04-23 16:45:31,0,1.0,still room grow,0.0,0.0,4,0
2379,1619217979.0,2021-04-23 18:46:19,0,1.0,tldr btc markets valuation striving hard push northbound worth us dollar btcusd bulls eventually lose strength 7200 line range price moves continue forceful breakdown 6800 lower range mark may result touching summary auto generated bot meant replace reading original article always dyor,0.22083333333333333,0.47291666666666665,68,1
2380,1619249104.0,2021-04-24 03:25:04,0,1.0,people realizing passed 4th correction cycle 60 finished run4th 6th crypto summer thats sure next year early next year could fireworks next spring check ledgers wallets packed stop checking charts 2024 least bear years next halving always,0.06666666666666668,0.2432098765432099,80,0
2381,1619211076.0,2021-04-23 16:51:16,3,7.0,still regret buying point,0.0,0.0,8,0
2382,1619210624.0,2021-04-23 16:43:44,0,2.0,thats really logic works 2 different things 2 different situations 20k next year would pretty cool anyways,0.08333333333333333,0.5083333333333333,22,1
2383,1619211784.0,2021-04-23 17:03:04,0,2.0,bitcoin reaches 200000 next year,0.0,0.0,9,1
2384,1619210587.0,2021-04-23 16:43:07,2,3.0,50k end year,0.0,0.0,4,0
2385,1619211141.0,2021-04-23 16:52:21,1,6.0,easy invest someone elses money though,0.43333333333333335,0.8333333333333334,8,1
2386,1619215857.0,2021-04-23 18:10:57,0,2.0,bought sure,0.5,0.8888888888888888,14,0
2387,1619211050.0,2021-04-23 16:50:50,1,3.0,hopefully driving lambo,0.0,0.0,4,1
2388,1619215537.0,2021-04-23 18:05:37,0,1.0,remindme 1 year lets see,0.0,0.0,5,1
2390,1619214240.0,2021-04-23 17:44:00,0,2.0,hindsight 2020,0.0,0.0,3,1
2391,1619215520.0,2021-04-23 18:05:20,1,2.0,,0.0,0.0,3,1
2395,1619215885.0,2021-04-23 18:11:25,0,1.0,itll either real one toy one special sub member queue gif,0.32321428571428573,0.4357142857142857,16,0
2397,1619258216.0,2021-04-24 05:56:56,0,1.0,comment removed contains link telegram discord please adjust post resubmit bot action performed automatically please contact moderators subredditmessagecomposetorcryptocurrency questions concerns,0.1,0.1,43,1
2398,1619252617.0,2021-04-24 04:23:37,11,0.63,philosophical battle heart 5000000 btc,0.0,0.0,10,1
2399,1619252617.0,2021-04-24 04:23:37,0,1.0,hello rcryptocurrency readers please try following links sort comments controversial first click doesnt work mobile potentially find cryptowikis articles subject post click contribute cryptowikis click bot action performed automatically please contact moderators subredditmessagecomposetorcryptocurrency questions concerns,0.12222222222222223,0.4694444444444445,64,1
2400,1619253761.0,2021-04-24 04:42:41,1,5.0,find someone writes essays like person bitcoin,0.0,0.0,13,0
2402,1619254162.0,2021-04-24 04:49:22,0,3.0,rarely read long posts enjoyed one write well,0.2916666666666667,0.6666666666666666,12,1
2403,1619253400.0,2021-04-24 04:36:40,0,1.0,wow lot take,0.1,1.0,8,1
2404,1619254173.0,2021-04-24 04:49:33,0,1.0,worth farm absolutely dont bet livelihood cryptocurrency worth extra cash absolutely,0.15,0.42000000000000004,16,0
2405,1619258142.0,2021-04-24 05:55:42,0,1.0,50k right,0.2857142857142857,0.5357142857142857,4,0
2406,1619262762.0,2021-04-24 07:12:42,0,1.0,think friend mark bought 2018 2019 2020 could asking money,0.0,0.0,21,1
2408,1619263556.0,2021-04-24 07:25:56,0,2.0,came find info,0.0,0.0,6,0
2409,1619246618.0,2021-04-24 02:43:38,12,0.71,governing body louisiana gives bitcoin nod approval,0.0,0.0,10,0
2410,1619246621.0,2021-04-24 02:43:41,0,1.0,advised website cointelegraphcom proven unreliable source information bot action performed automatically please contact moderators subredditmessagecomposetorcryptocurrency questions concerns,0.1,0.1,38,1
2411,1619248694.0,2021-04-24 03:18:14,0,3.0,seems bullish,0.0,0.0,4,0
2412,1619250344.0,2021-04-24 03:45:44,0,3.0,bullish news welcome,0.65,0.7,5,1
2413,1619246648.0,2021-04-24 02:44:08,1,2.0,holy shit state usa gives btc green light,0.033333333333333326,0.6,12,0
2414,1619247295.0,2021-04-24 02:54:55,0,2.0,first lines resolution read commend bitcoin success becoming first decentralized trillion dollar asset encourage state local governments consider ways could help benefit increased use new technology dont know isnt bullish would,0.23106060606060605,0.3285353535353535,56,1
2416,1619248956.0,2021-04-24 03:22:36,0,2.0,make moonshine boonies soon mining farms,0.0,1.0,13,1
2417,1619249262.0,2021-04-24 03:27:42,0,2.0,long till pay bingo bitcoin,-0.05,0.4,10,0
2418,1619246621.0,2021-04-24 02:43:41,0,1.0,hello rcryptocurrency readers please try following links sort comments controversial first click doesnt work mobile potentially find cryptowikis articles subject post click contribute cryptowikis click bot action performed automatically please contact moderators subredditmessagecomposetorcryptocurrency questions concerns,0.12222222222222223,0.4694444444444445,64,1
2419,1619247336.0,2021-04-24 02:55:36,0,1.0,one step ahead towards crypto adoption,0.0,0.0,6,1
2420,1619249421.0,2021-04-24 03:30:21,0,1.0,tldr us state louisiana recently released resolution praising bitcoin creator satoshi nakamoto contribution economic security document noted bitcoin achieved market cap greater 1 trillion early 2021 also praised assets prevalence decentralization usage summary auto generated bot meant replace reading original article always dyor,0.23499999999999996,0.4,67,1
2421,1619246838.0,2021-04-24 02:47:18,0,2.0,step toward mainstream adaptation,0.0,0.0,5,1
2422,1619238469.0,2021-04-24 00:27:49,10,0.89,largest bitcoin fund dives record discount amid crypto dip,0.0,0.0,10,0
2423,1619238469.0,2021-04-24 00:27:49,0,1.0,hello rcryptocurrency readers please try following links sort comments controversial first click doesnt work mobile potentially find cryptowikis articles subject post click contribute cryptowikis click bot action performed automatically please contact moderators subredditmessagecomposetorcryptocurrency questions concerns,0.12222222222222223,0.4694444444444445,64,1
2425,1619238629.0,2021-04-24 00:30:29,0,3.0,discount season baby,0.0,0.0,4,0
2426,1619240500.0,2021-04-24 01:01:40,0,3.0,well maybe question crazy fees etf work much lower fees,-0.19999999999999998,0.55,20,1
2427,1619240621.0,2021-04-24 01:03:41,0,2.0,recovers btc recovers hate clickbait bs,-0.8,0.9,11,0
2428,1619238572.0,2021-04-24 00:29:32,1,1.0,35 billion grayscale fund ticker gbtc lost roughly fifth value since last friday bitcoin tumbled record highs got sting chance would sell coins hold,-0.05,0.23333333333333334,39,0
2429,1619244152.0,2021-04-24 02:02:32,0,1.0,tldr grayscale bitcoin trust trading record discount value digital assets holds 35 billion fund lost roughly fifth value since last friday bitcoin tumbled record highs structure trust doesnt allow redemptions like traditional exchangetraded funds exacerbate discount summary auto generated bot meant replace reading original article always dyor,0.12916666666666668,0.41111111111111115,80,0
2430,1619238721.0,2021-04-24 00:32:01,1,6.0,cant thats discount also good news anyone getting discount gbtc converts etf,0.2333333333333333,0.5333333333333333,30,1
2431,1619239253.0,2021-04-24 00:40:53,1,3.0,thanks man sure case trust ffs figured yes etf would bring flood insto investment sec whoever gives go ahead dragging feet,0.19999999999999998,0.5629629629629629,42,0
2432,1619239610.0,2021-04-24 00:46:50,0,2.0,gbtc converts etf redemption feature meaning entire discount gbtc currently disappear imagine first etf approved us fund hopping gbtc declares conversion discount buy disappear,0.0625,0.5895833333333333,53,0
2433,1619272339.0,2021-04-24 09:52:19,12,0.4,second turkish bitcoin exchange abruptly shuts locking funds,-0.09351851851851851,0.42962962962962964,10,1
2434,1619272342.0,2021-04-24 09:52:22,0,1.0,hello rcryptocurrency readers please try following links sort comments controversial first click doesnt work mobile potentially find cryptowikis articles subject post click contribute cryptowikis click bot action performed automatically please contact moderators subredditmessagecomposetorcryptocurrency questions concerns,0.12222222222222223,0.4694444444444445,64,1
2435,1619272415.0,2021-04-24 09:53:35,0,1.0,tldr vebitcoin turkish cryptocurrency exchange today abruptly halted trading citing unspecified financial difficulties vebitcoin one smaller exchanges country daily trade volume 60 million yesterday comparison thodexs daily trade volume 5855 million last day trading paribu one countrys largest exchanges today recorded trade volume 1 billion,-0.020833333333333332,0.2611111111111111,62,0
2436,1619272519.0,2021-04-24 09:55:19,1,1.0,turkey crypto seems imploding,0.0,0.0,6,0
2437,1619274331.0,2021-04-24 10:25:31,0,1.0,scary stuff man,-0.5,1.0,3,1
